id,source_id,babe_url,lib_url,babe_title,lib_title,title_distance,babe_title_len,lib_title_len,content_distance,babe_content_len,lib_content_len,,
5227024,,http://www.tribunnews.com/video/2016/01/17/dinilai-hina-nabi-muhammad-di-facebook-guru-di-pangkalpinang-dinonaktifkan,http://www.tribunnews.com/video/2016/01/17/dinilai-hina-nabi-muhammad-di-facebook-guru-di-pangkalpinang-dinonaktifkan,"Dinilai Hina Nabi Muhammad di Facebook, Guru di Pangkalpinang Dinonaktifkan","Dinilai Hina Nabi Muhammad di Facebook, Guru di Pangkalpinang Dinonaktifkan",0,75,75,90,1623,1535,,
5227142,,http://nasional.inilah.com/read/detail/2267489/densus-88-jemput-lima-napi-di-lapas-tangerang,http://nasional.inilah.com/read/detail/2267489/densus-88-jemput-lima-napi-di-lapas-tangerang,Densus 88 Jemput Lima Napi di Lapas Tangerang,Densus 88 Jemput Lima Napi di Lapas Tangerang,0,45,45,0,1026,1026,,
4544389,,http://olahraga.inilah.com/read/detail/2252944/target-berbeda-ganda-campuran-di-hong-kong,http://olahraga.inilah.com/read/detail/2252944/target-berbeda-ganda-campuran-di-hong-kong,Target Berbeda Ganda Campuran di Hong Kong,Target Berbeda Ganda Campuran di Hong Kong,0,42,42,1,986,987,,
5754167,,http://www.tempo.co/read/news/2016/02/29/203749299/MS-Rotterdam-Singgah-di-Surabaya-Turis-Belanda-Nostalgiahttp://www.tempo.co/read/news/2016/02/29/203749299/MS-Rotterdam-Singgah-di-Surabaya-Turis-Belanda-Nostalgia,https://m.tempo.co/read/news/2016/02/29/203749299/ms-rotterdam-singgah-di-surabaya-turis-belanda-nostalgia,"MS Rotterdam Singgah di Surabaya, Turis Belanda Nostalgia","MS Rotterdam Singgah di Surabaya, Turis Belanda Nostalgia",0,57,57,434,2318,1968,,
4540125,,http://www.supersoccer.co.id/sepakbola-internasional/raul-gonzales-pensiun-dengan-manis,http://www.supersoccer.tv/sepakbola-internasional/raul-gonzales-pensiun-dengan-manis,Raul Gonzales Pensiun Dengan Manis,Raul Gonzales Pensiun Dengan Manis,0,34,34,68,1492,1424,,
4630619,,http://www.tempo.co/read/news/2015/11/27/111722870/JK-Rowling-Buka-Rahasia-Mengapa-Potter-Namai-Anaknya-Severus,https://m.tempo.co/read/news/2015/11/27/111722870/jk-rowling-buka-rahasia-mengapa-potter-namai-anaknya-severus,"JK Rowling Buka Rahasia, Mengapa Potter Namai Anaknya Severus  ","JK Rowling Buka Rahasia, Mengapa Potter Namai Anaknya Severus",2,63,61,214,1173,959,,
5239210,,http://malesbanget.com/2016/01/8-kepribadian-orang-berdasarkan-makanan-kelilng-kesukaannya/,http://malesbanget.com/2016/01/8-kepribadian-orang-berdasarkan-makanan-kelilng-kesukaannya/,8 Kepribadian Orang Berdasarkan Makanan Kelilng Kesukaannya,8 Kepribadian Orang Berdasarkan Makanan Keliling Kesukaannya,1,59,60,172,4420,4252,,
5231683,,http://www.goal.com/id-ID/news/1108/sepakbola-inggris/2016/01/17/19425172/willian-targetkan-kontrak-baru-di-chelsea,http://www.goal.com/id-ID/news/1108/sepakbola-inggris/2016/01/17/19425172/willian-targetkan-kontrak-baru-di-chelsea,Willian Targetkan Kontrak Baru Di Chelsea,Willian Targetkan Kontrak Baru Di Chelsea,0,41,41,2,1120,1122,,
5214191,,http://bola.inilah.com/read/detail/2267356/aguero-perpaduan-sempurna-dari-messi-dan-henry,http://bola.inilah.com/read/detail/2267356/aguero-perpaduan-sempurna-dari-messi-dan-henry,"""Aguero Perpaduan Sempurna dari Messi dan Henry""","""Aguero Perpaduan Sempurna dari Messi dan Henry""",0,48,48,1,1262,1263,,
5231691,,http://www.antaranews.com/berita/540540/juventus-hajar-10-pemain-udinese-4-0,http://www.antaranews.com/berita/540540/juventus-hajar-10-pemain-udinese-4-0,Juventus hajar 10 pemain Udinese 4-0,Juventus hajar 10 pemain Udinese 4-0,0,36,36,1614,340,1923,,
4544397,,http://www.antaranews.com/berita/529847/prince-juga-batalkan-konser-di-prancis,http://www.antaranews.com/berita/529847/prince-juga-batalkan-konser-di-prancis,Prince juga batalkan konser di Prancis,Prince juga batalkan konser di Prancis,0,38,38,1181,361,1502,,
4544398,,http://www.antaranews.com/berita/529845/teror-paris--70-juta-unggah-dukungan-via-instagram,http://www.antaranews.com/berita/529845/teror-paris--70-juta-unggah-dukungan-via-instagram,TEROR PARIS - 70 juta unggah dukungan via Instagram,TEROR PARIS,40,51,11,933,367,1257,,
4546888,,http://jurnalotaku.com/2015/11/17/11-berita-game-hari-ini-disgaea-siap-hadir-di-pc-fripside-nyanyikan-lagu-opening-schwarzesmarken/,http://jurnalotaku.com/2015/11/17/11-berita-game-hari-ini-disgaea-siap-hadir-di-pc-fripside-nyanyikan-lagu-opening-schwarzesmarken/,"11 Berita Game Hari Ini: Disgaea Siap Hadir di PC, fripSide Nyanyikan Lagu Opening Schwarzesmarken","11 Berita Game Hari Ini: Disgaea Siap Hadir di PC, fripSide Nyanyikan Lagu Opening Schwarzesmarken",0,98,98,1430,12659,11257,,
5240193,,http://www.kotakgame.com/berita/detail.php?id=56843&jenis=news,http://www.kotakgame.com/berita/detail.php?id=56843&jenis=news,[VIDEO] X-Legend Ungkap Keempat Class yang Akan Hadir Di Laplace (TW) Lewat Trailer Baru,Berita : [VIDEO] X-Legend Ungkap Keempat Class yang Akan Hadir Di Laplace (TW) Lewat Trailer Baru,9,88,97,109,964,1064,,
4677828,,http://www.imogame.com/android/seven-knights-hadirkan-area-ke-8-moonlit-isle.html,http://www.imogame.com/android/seven-knights-hadirkan-area-ke-8-moonlit-isle.html,Seven Knights Hadirkan Area ke-8 Moonlit Isle,Seven Knights Hadirkan Area ke-8 Moonlit Isle,0,45,45,10,2371,2365,,
4212276,,http://www.kaorinusantara.or.id/newsline/36076/sword-art-online-akan-hadir-di-bioskop-jepang,https://www.kaorinusantara.or.id/newsline/36076/sword-art-online-akan-hadir-di-bioskop-jepang,Sword Art Online akan Hadir di Bioskop Jepang,Sword Art Online akan Hadir di Bioskop Jepang,0,45,45,68,939,871,,
4202081,,http://www.aplikanologi.com/berita/spesifikasi-htc-one-a9-bocor-lhoo-penasaran/,http://aplikanologi.com/berita/spesifikasi-htc-one-a9-bocor-lhoo-penasaran/,Spesifikasi HTC One A9 BocorLhoo. Penasaran?,Spesifikasi HTC One A9 Bocor Lhoo. Penasaran?,1,44,45,66,2118,2054,,
4546699,,http://nasional.inilah.com/read/detail/2253089/kejagung-tahan-tersangka-korupsi-tiket-merpati,http://nasional.inilah.com/read/detail/2253089/kejagung-tahan-tersangka-korupsi-tiket-merpati,Kejagung Tahan Tersangka Korupsi Tiket Merpati,Kejagung Tahan Tersangka Korupsi Tiket Merpati,0,46,46,0,1515,1515,,
4544222,,http://www.antaranews.com/berita/529841/baasyir-tidak-hadiri-sidang-peninjauan-kembali,http://www.antaranews.com/berita/529841/baasyir-tidak-hadiri-sidang-peninjauan-kembali,Baasyir tidak hadiri sidang peninjauan kembali,Baasyir tidak hadiri sidang peninjauan kembali,0,46,46,1405,308,1690,,
5231481,,http://www.antaranews.com/berita/540538/sanksi-dicabut-iran-bebaskan-empat-tahanan-as,http://www.antaranews.com/berita/540538/sanksi-dicabut-iran-bebaskan-empat-tahanan-as,"Sanksi dicabut, Iran bebaskan empat tahanan AS","Sanksi dicabut, Iran bebaskan empat tahanan AS",0,46,46,1824,307,2111,,
4540074,,http://www.voaindonesia.com/content/walikota-muslim-rotterdam-serukan-penghancuran-isis/3059786.html,http://www.voaindonesia.com/a/walikota-muslim-rotterdam-serukan-penghancuran-isis/3059786.html,Walikota Muslim Rotterdam Serukan Penghancuran ISIS,Walikota Muslim Rotterdam Serukan Penghancuran ISIS,0,51,51,268,1117,853,,
5765242,,http://international.sindonews.com/read/1089370/41/jet-tempur-su-25-jatuh-di-rusia-pilot-moskow-tewas-1456796082,http://international.sindonews.com/read/1089370/41/jet-tempur-su-25-jatuh-di-rusia-pilot-moskow-tewas-1456796082,"Jet Tempur Su-25 Jatuh di Rusia, Pilot Moskow Tewas","Jet Tempur Su-25 Jatuh di Rusia, Pilot Moskow Tewas",0,51,51,64,1496,1538,,
5765952,,http://nasional.sindonews.com/read/1089378/12/jk-usul-efektivitas-jumlah-tps-dalam-pemilu-1456799857,http://nasional.sindonews.com/read/1089378/12/jk-usul-efektivitas-jumlah-tps-dalam-pemilu-1456799857,JK Usul Efektivitas Jumlah TPS dalam Pemilu,JK Usul Efektivitas Jumlah TPS dalam Pemilu,0,43,43,13,1236,1225,,
4543359,,http://www.voaindonesia.com/content/setara-institute-luncurkan-indeks-kota-toleran/3061256.html,http://www.voaindonesia.com/a/setara-institute-luncurkan-indeks-kota-toleran/3061256.html,Setara Institute Luncurkan Indeks Kota Toleran 2015,Setara Institute Luncurkan Indeks Kota Toleran 2015,0,51,51,440,3990,3553,,
4544141,,http://www.antaranews.com/berita/529838/wapres-kerja-sama-apec-diharapkan-perbaiki-ekonomi,http://www.antaranews.com/berita/529838/wapres-kerja-sama-apec-diharapkan-perbaiki-ekonomi,Wapres: kerja sama APEC diharapkan perbaiki ekonomi,Wapres: kerja sama APEC diharapkan perbaiki ekonomi,0,51,51,1853,300,2136,,
5240222,,http://keuangan.kontan.co.id/news/bankir-pilih-menurunkan-bunga-deposito,http://keuangan.kontan.co.id/news/bankir-pilih-menurunkan-bunga-deposito,Bankir pilih menurunkan bunga deposito,Bankir pilih menurunkan bunga deposito,0,38,38,1,2232,2233,,
4544142,,http://wartaekonomi.co.id/berita80339/alex-noerdin-akan-bangun-sirkuit-motogp.html,http://wartaekonomi.co.id/berita80339/alex-noerdin-akan-bangun-sirkuit-motogp.html,Alex Noerdin Akan Bangun Sirkuit MotoGP,Alex Noerdin Akan Bangun Sirkuit MotoGP,0,39,39,21,1159,1138,,
4544224,,http://dapurpacu.com/269231/ford-hadirkan-jok-senyaman-sofa/,http://dapurpacu.com/269231/ford-hadirkan-jok-senyaman-sofa/,Ford Hadirkan Jok Senyaman Sofa,Ford Hadirkan Jok Senyaman Sofa | Majalah Otomotif Online by. Dapurpacu.com,44,31,75,1,951,952,,
8441765,,http://otomotifnet.com/Motor/Modifikasi/Modifikasi-Harley-Davidson-Sportster-1200-Flat-Tracker-Keluar-Dari-Pakem?utm_source=babe&utm_medium=app&utm_campaign=share_content&utm_content=article,http://otomotifnet.com/Motor/Modifikasi/Modifikasi-Harley-Davidson-Sportster-1200-Flat-Tracker-Keluar-Dari-Pakem,"Modifikasi Harley-Davidson Sportster 1200, Flat Tracker Keluar dari Pakem","Modifikasi Harley-Davidson Sportster 1200, Flat Tracker Keluar dari Pakem",0,73,73,632,2817,2185,,
4544309,,http://doktersehat.com/penyebab-sembelit-yang-tidak-terduga/,,Penyebab Sembelit Yang Tidak Terduga,Penyebab Sembelit Yang Tidak Terduga,0,36,36,49,2568,2519,,
4544131,,http://www.antaranews.com/berita/529839/pertemuan-tokoh-agama-hasilkan-lima-butir-rekomendasi,http://www.antaranews.com/berita/529839/pertemuan-tokoh-agama-hasilkan-lima-butir-rekomendasi,Pertemuan tokoh agama hasilkan lima butir rekomendasi,Pertemuan tokoh agama hasilkan lima butir rekomendasi,0,53,53,2267,304,2548,,
5231693,,https://jalantikus.com/gadgets/alasan-menggunakan-android/?utm_source=babe&utm_medium=article&utm_campaign=artikel-from-babe,https://jalantikus.com/gadgets/alasan-menggunakan-android/,Alasan Kenapa Harus Gunakan Android Dibanding iOS,Alasan Kenapa Harus Menggunakan Android Dibanding iOS,5,49,53,192,5431,5257,,
4203575,,http://feedproxy.google.com/~r/dsnet/~3/szEOV1sk7zU/,https://dailysocial.id/post/connected-e-conomy-dan-alasan-berinvestasi-di-indonesia/,“Connected e-Conomy” dan Alasan Berinvestasi di Indonesia,“Connected e-Conomy” dan Alasan Berinvestasi di Indonesia,0,57,57,2,3290,3292,,
4544147,,http://dailysocial.id/post/withings-activite-steel-adalah-activity-tracker-dalam-wujud-arloji-analog-yang-menawan/,https://dailysocial.id/post/withings-activite-steel-adalah-activity-tracker-dalam-wujud-arloji-analog-yang-menawan/,Withings Activite Steel Adalah Activity Tracker dalam Wujud Arloji Analog yang Menawan,Withings Activite Steel Adalah Activity Tracker dalam Wujud Arloji Analog yang Menawan,0,86,86,22,2594,2578,,
4204251,,http://gigsplay.com/sembojan-sebuah-entitas-pendek-dari-tigapagi-untuk-peringati-g30s/,http://gigsplay.com/sembojan-sebuah-entitas-pendek-dari-tigapagi-untuk-peringati-g30s/,"Sembojan, Sebuah Entitas Pendek dari Tigapagi Untuk Peringati G30S","Sembojan, Sebuah Entitas Pendek dari Tigapagi Untuk Peringati G30S",0,66,66,98,1307,1405,,
4544234,,http://nasional.sindonews.com/read/1062179/12/publik-perlu-curigai-motif-menteri-sudirman-said-ke-mkd-1447736072,http://nasional.sindonews.com/read/1062179/12/publik-perlu-curigai-motif-menteri-sudirman-said-ke-mkd-1447736072,Publik Perlu Curigai Motif Menteri Sudirman Said ke MKD,Publik Perlu Curigai Motif Menteri Sudirman Said ke MKD,0,55,55,95,1646,1663,,
4544237,,http://ngonoo.com/2015/11/121234/keren-petugas-pemadam-kebakaran-dubai-dilengkapi-dengan-jetpack/,https://ngonoo.com/2015/11/121234/keren-petugas-pemadam-kebakaran-dubai-dilengkapi-dengan-jetpack,"Keren, Petugas Pemadam Kebakaran Dubai Dilengkapi Dengan Jetpack","Keren, Petugas Pemadam Kebakaran Dubai Dilengkapi Dengan Jetpack",0,64,64,116,2510,2400,,
4534193,,http://ngonoo.com/2015/11/095108/8-insiden-penuh-duka-yang-pernah-terjadi-dalam-dunia-sepak-bola/,https://ngonoo.com/2015/11/095108/8-insiden-penuh-duka-yang-pernah-terjadi-dalam-dunia-sepak-bola,8 Insiden Penuh Duka yang Pernah Terjadi Dalam Dunia Sepak Bola,8 Insiden Penuh Duka yang Pernah Terjadi Dalam Dunia Sepak Bola,0,63,63,293,4101,3812,,
4548045,,http://ngonoo.com/2015/11/181853/ini-lho-8-tokoh-emosi-yang-hilang-dari-film-inside-out/,https://ngonoo.com/2015/11/181853/ini-lho-8-tokoh-emosi-yang-hilang-dari-film-inside-out,Ini Dia 8 Tokoh Emosi yang Hilang dari Film Inside Out,Ini Dia 8 Tokoh Emosi yang Hilang dari Film Inside Out,0,54,54,105,2744,2647,,
4535276,,http://ngonoo.com/2015/11/121507/4-fakta-menarik-tim-amatir-hingga-selebrasi-unik-ps-tni-usai-kalahkan-surabaya-united-kemarin/,https://ngonoo.com/2015/11/121507/4-fakta-menarik-tim-amatir-hingga-selebrasi-unik-ps-tni-usai-kalahkan-surabaya-united-kemarin,4 Fakta Menarik Tim‘Amatir’ Hingga Selebrasi Unik PS TNI Usai Kalahkan Surabaya United Kemarin,4 Fakta Menarik Tim 'Amatir' Hingga Selebrasi Unik PS TNI Usai Kalahkan Surabaya United Kemarin,3,94,95,181,1723,1546,,
4549710,,http://ngonoo.com/2015/11/214012/wow-mobil-pemburu-hantu-ghostbusters-ini-menghabiskan-biaya-sebesar-27-miliar/,https://ngonoo.com/2015/11/214012/wow-mobil-pemburu-hantu-ghostbusters-ini-menghabiskan-biaya-sebesar-27-miliar,"Wow! Mobil Pemburu Hantu“Ghostbusters” Ini Menghabiskan Biaya Sebesar 2,7 Miliar","Wow! Mobil Pemburu Hantu ""Ghostbusters"" Ini Menghabiskan Biaya Sebesar 2,7 Miliar",3,80,81,72,1735,1663,,
5244179,,http://www.oprekandroid.com/yuk-cari-tahu-fitur-fitur-canggih-smartwatch-huawei-w1.html,http://oprekandroid.com/yuk-cari-tahu-fitur-fitur-canggih-smartwatch-huawei-w1.html,"Yuk, Cari Tahu Fitur-Fitur Canggih Smartwatch Huawei W1","Yuk, Cari Tahu Fitur-Fitur Canggih Smartwatch Huawei W1",0,55,55,379,2708,2896,,
5207377,,http://carisinyal.com/hp-samsung-tahan-air-terbaik/,http://carisinyal.com/hp-samsung-tahan-air-terbaik/,10 HP Samsung Tahan Air Terbaik Tahun 2016,10 HP Samsung Tahan Air Terbaik Tahun 2016,0,42,42,324,7198,7013,,
4534435,,http://www.kabarandroid.com/2015/11/cara-pasang-dua-bbm-di-android-terbaru.html,http://www.kabarandroid.com/2015/11/cara-pasang-dua-bbm-di-android-terbaru.html,Cara Mudah Pasang Dua BBM di Android Terbaru,Cara Mudah Pasang Dua BBM di Android Terbaru,0,44,44,189,1927,1742,,
4543744,,http://cinemapoetica.com/persepsi-monoton-tentang-penonton/,http://cinemapoetica.com/persepsi-monoton-tentang-penonton/,Persepsi Monoton tentang Penonton,Persepsi Monoton tentang Penonton,0,33,33,61,13910,13862,,
5239088,,http://movienthusiast.com/the-hateful-eight-2015/,http://movienthusiast.com/the-hateful-eight-2015/,The Hateful Eight (2015),The Hateful Eight (2015),0,24,24,400,5457,5075,,
4544332,,http://gayahidup.rimanews.com/selebritas/read/20151117/245582/Momen-Romatis-Raisa-Dipeluk-Kakak-Pevita-Pearce,http://rimanews.com/gayahidup/selebritas/read/20151117/245582/Momen-Romantis-Raisa-Dipeluk-Kakak-Pevita-Pearce,Momen Romatis Raisa Dipeluk Kakak Pevita Pearce,Momen Romantis Raisa Dipeluk Kakak Pevita Pearce,1,47,48,151,924,937,,
5214197,,http://nasional.rimanews.com/politik/read/20160116/256051/Teror-Bom-Thamrin-dan-Perpanjangan-Kontrak-Freeport-Ada-Apa-,http://rimanews.com/nasional/politik/read/20160116/256051/Teror-Bom-Thamrin-dan-Perpanjangan-Kontrak-Freeport-Ada-Apa-,"Teror Bom Thamrin dan Perpanjangan Kontrak Freeport, Ada Apa?","Teror Bom Thamrin dan Perpanjangan Kontrak Freeport, Ada Apa?",0,61,61,65,4854,4795,,
4546183,,http://teknologi.rimanews.com/gadget/read/20151117/245578/K-Blocker-Aplikasi-untuk-Blokir-Konten-Kim-Kardashian-di-iOS,http://rimanews.com/teknologi/gadget/read/20151117/245578/K-Blocker-Aplikasi-untuk-Blokir-Konten-Kim-Kardashian-di-iOS,"K Blocker, Aplikasi untuk Blokir Konten Kim Kardashian di iOS","K Blocker, Aplikasi untuk Blokir Konten Kim Kardashian di iOS",0,61,61,1,925,926,,
5242151,,http://olahraga.rimanews.com/raket/read/20160118/256248/Australian-Open-2016-Diguncang-Skandal-Pengaturan-Skor,http://rimanews.com/olahraga/raket/read/20160118/256248/Australian-Open-2016-Diguncang-Skandal-Pengaturan-Skor,Australian Open 2016 Diguncang Skandal Pengaturan Skor,Australian Open 2016 Diguncang Skandal Pengaturan Skor,0,54,54,2,1978,1980,,
4707033,,http://olahraga.rimanews.com/beladiri/read/20151205/249080/Muaythai-Resmi-Dipertandingkan-di-PON-2020,http://rimanews.com/olahraga/beladiri/read/20151205/249080/Muaythai-Resmi-Dipertandingkan-di-PON-2020,Muaythai Resmi Dipertandingkan di PON 2020,Muaythai Resmi Dipertandingkan di PON 2020,0,42,42,1,2459,2460,,
5717407,,http://olahraga.rimanews.com/raket/read/20160220/262970/Tim-Uber-Indonesia-Masih-Berpeluang-Lolos-ke-Putaran-Final,http://rimanews.com/olahraga/raket/read/20160220/262970/Tim-Uber-Indonesia-Masih-Berpeluang-Lolos-ke-Putaran-Final,Tim Uber Indonesia Masih Berpeluang Loloske Putaran Final,Tim Uber Indonesia Masih Berpeluang Lolos ke Putaran Final,1,57,58,50,2222,2172,,
5939014,,http://olahraga.rimanews.com/atletik/read/20160314/267465/Pemkab-Bangka-Tengah-Gelar-Kejuaraan-Nasional-Panjat-Tebing,http://rimanews.com/olahraga/atletik/read/20160314/267465/Pemkab-Bangka-Tengah-Gelar-Kejuaraan-Nasional-Panjat-Tebing,Pemkab Bangka Tengah Gelar Kejuaraan Nasional Panjat Tebing,Pemkab Bangka Tengah Gelar Kejuaraan Nasional Panjat Tebing,0,59,59,0,1401,1401,,
4522101,,http://gayahidup.rimanews.com/musik/read/20151114/245093/Senior-Aura-Kasih-Sering-Tanya-Ini-pada-Glenn,http://rimanews.com/gayahidup/musik/read/20151114/245093/Senior-Aura-Kasih-Sering-Tanya-Ini-pada-Glenn,"Senior, Aura Kasih Sering Tanya Ini pada Glenn","Senior, Aura Kasih Sering Tanya Ini pada Glenn",0,46,46,278,810,723,,
4544333,,http://komunitas.rimanews.com/fotovideo/read/20151117/5022/TNI-AL-Gelar-Lomba-Halang-Rintang,http://rimanews.com/komunitas/fotovideo/read/20151117/5022/TNI-AL-Gelar-Lomba-Halang-Rintang,TNI AL Gelar Lomba Halang Rintang,TNI AL Gelar Lomba Halang Rintang,0,33,33,0,384,384,,
4540084,,http://nasional.rimanews.com/kriminal/read/20151116/245423/Pegawai-KPUD-Curi-Motor,http://rimanews.com/nasional/kriminal/read/20151116/245423/Pegawai-KPUD-Curi-Motor,Pegawai KPUD Curi Motor,Pegawai KPUD Curi Motor,0,23,23,0,1319,1319,,
4548479,,http://gayahidup.rimanews.com/musik/read/20151117/245710/Hivi-dari-i-Ngamen-i-Sampai-Ciptakan-Lagu-di-Rimanews,http://rimanews.com/gayahidup/musik/read/20151117/245710/HiVi-dari-Ngamen-Sampai-Ciptakan-Lagu-di-Rimanews,Hivi dari Ngamen Sampai Ciptakan Lagu di Rimanews,HiVi dari Ngamen Sampai Ciptakan Lagu di Rimanews,1,49,49,53,1701,1651,,
5239218,,http://gayahidup.rimanews.com/film/read/20160118/256183/Ride-Along-2-Sukses-Gusur-Star-Wars-The-Force-Awakens,http://rimanews.com/gayahidup/film/read/20160118/256183/Ride-Along-2-Sukses-Gusur-Star-Wars-The-Force-Awakens,Ride Along 2 Sukses Gusur Star Wars: The Force Awakens,Ride Along 2 Sukses Gusur Star Wars: The Force Awakens,0,54,54,215,1038,825,,
6606755,,http://teknologi.rimanews.com/otomotif/read/20160507/278394/Generasi-Terbaru-Honda-CR-V-Tertangkap-Wara-Wiri-Tengah-Diuji,http://rimanews.com/teknologi/otomotif/read/20160507/278394/Generasi-Terbaru-Honda-CR-V-Tertangkap-Wara-Wiri-Tengah-Diuji,Generasi Terbaru Honda CR-V Tertangkap Wara-Wiri Tengah Diuji,Generasi Terbaru Honda CR-V Tertangkap Wara-Wiri Tengah Diuji,0,61,61,1,494,495,,
4538495,,http://ekonomi.rimanews.com/keuangan/read/20151116/245460/Rupiah-Melemah-Tipis-ke-Rp-13-697-per-Dolar,http://rimanews.com/ekonomi/keuangan/read/20151116/245460/Rupiah-Melemah-Tipis-ke-Rp-13-697-per-Dolar,Rupiah Melemah Tipis ke Rp 13.697 per Dolar,Rupiah Melemah Tipis ke Rp 13.697 per Dolar,0,43,43,2,1663,1665,,
5745996,,http://ekonomi.rimanews.com/investasi/read/20160229/264631/Jokowi-Keputusan-Blok-Masela-Tahun-2018,http://rimanews.com/ekonomi/investasi/read/20160229/264631/Jokowi-Keputusan-Blok-Masela-Tahun-2018,Jokowi: Keputusan Blok Masela Tahun 2018,Jokowi: Keputusan Blok Masela Tahun 2018,0,40,40,63,1055,1058,,
5416264,,http://komunitas.rimanews.com/fotovideo/read/20160204/6397/Petugas-Sita-Rokok-Ilegal-di-Jawa-Tenggah,http://rimanews.com/komunitas/fotovideo/read/20160204/6397/Petugas-Sita-Rokok-Ilegal-di-Jawa-Tenggah,Petugas Sita Rokok Ilegal di Jawa Tenggah,Petugas Sita Rokok Ilegal di Jawa Tenggah,0,41,41,1,453,454,,
4199705,,http://ekonomi.rimanews.com/keuangan/read/20151001/237361/Menko-Perek-Deflasi-Bukan-Berarti-Ekonomi-Indonesia-Sudah-Membaik,http://rimanews.com/ekonomi/keuangan/read/20151001/237361/Menko-Deflasi-Bukan-Berarti-Ekonomi-Indonesia-Sudah-Membaik,Menko Perek: Deflasi Bukan Berarti Ekonomi Indonesia Sudah Membaik,Menko: Deflasi Bukan Berarti Ekonomi Indonesia Sudah Membaik,6,66,60,0,1147,1147,,
4544334,,http://internasional.rimanews.com/amerika/read/20151117/245581/CNN-Buktikan-AS-Dukung-Penuh-ISIS,http://rimanews.com/internasional/amerika/read/20151117/245581/CNN-Buktikan-AS-Dukung-Penuh-ISIS,CNN Buktikan AS Dukung Penuh ISIS,CNN Buktikan AS Dukung Penuh ISIS,0,33,33,48,1173,1129,,
5939160,,http://internasional.rimanews.com/afrika/read/20160315/267671/76-Kilogram-Gading-Gajah-Disita-di-Bandara-Mozambik,http://rimanews.com/internasional/afrika/read/20160315/267671/76-Kilogram-Gading-Gajah-Disita-di-Bandara-Mozambik,76 Kilogram Gading Gajah Disita di Bandara Mozambik,76 Kilogram Gading Gajah Disita di Bandara Mozambik,0,51,51,0,996,996,,
4198559,,http://internasional.rimanews.com/amerika/read/20151001/237366/Paus-Diam-Diam-Temui-Panitera-yang-Menentang-Pernikahan-Sesama-Jenis,http://rimanews.com/internasional/amerika/read/20151001/237366/Paus-Diam-Diam-Temui-Panitera-Penentang-Pernikahan-Sejenis,Paus Diam-Diam Temui Panitera yang Menentang Pernikahan Sesama Jenis,Paus Diam-Diam Temui Panitera Penentang Pernikahan Sejenis,12,68,58,0,2044,2044,,
4272182,,http://komunitas.rimanews.com/fotovideo/read/20151013/4348/Indonesia-Deportasi-13-Imigran-Bangladesh,http://rimanews.com/komunitas/fotovideo/read/20151013/4348/Indonesia-Deportasi-13-Imigran-Bangladesh,Indonesia Deportasi 13 Imigran Bangladesh,Indonesia Deportasi 13 Imigran Bangladesh,0,41,41,1,426,427,,
4197974,,http://internasional.rimanews.com/eropa/read/20151001/237355/Puluhan-Juta-Orang-Terancam-Kelaparan-Karena-Cuaca-Tak-Menentu,http://rimanews.com/internasional/eropa/read/20151001/237355/Puluhan-Juta-Orang-Terancam-Kelaparan-Karena-Cuaca-Tak-Menentu,Puluhan Juta Orang Terancam Kelaparan Karena Cuaca Tak Menentu,Puluhan Juta Orang Terancam Kelaparan Karena Cuaca Tak Menentu,0,62,62,1,1422,1423,,
4198293,,http://internasional.rimanews.com/timurtengah/read/20151001/237363/Wanita-Saudi-Enggan-Bekerja-di-Toko-Fashion-dan-Pakaian-Dalam,http://rimanews.com/internasional/timurtengah/read/20151001/237363/Wanita-Saudi-Enggan-Bekerja-di-Toko-Fashion-dan-Pakaian-Dalam,Wanita Saudi Enggan Bekerja di Toko Fashion dan Pakaian Dalam,Wanita Saudi Enggan Bekerja di Toko Fashion dan Pakaian Dalam,0,61,61,0,1851,1851,,
4544417,,http://nasional.rimanews.com/hukum/read/20151117/245587/JK-Yakin-Golkar-Tak-Akan-Lindungi-Setnov,http://rimanews.com/nasional/hukum/read/20151117/245587/JK-Yakin-Golkar-Tak-Akan-Lindungi-Setnov,JK Yakin Golkar Tak Akan Lindungi Setnov,JK Yakin Golkar Tak Akan Lindungi Setnov,0,40,40,1,1013,1014,,
5356370,,http://nasional.rimanews.com/hukum/read/20160128/258291/Haji-Lulung-Bersaksi-di-Kasus-Korupsi-UPS,http://rimanews.com/nasional/hukum/read/20160128/258291/Haji-Lulung-Bersaksi-di-Kasus-Korupsi-UPS,Haji Lulung Bersaksi di Kasus Korupsi UPS,Haji Lulung Bersaksi di Kasus Korupsi UPS,0,41,41,0,1763,1763,,
4521755,,http://korenista.blogspot.com/2015/11/ternyata-krystal-fx-tidak-menyukai-kai.html,,Ternyata Krystal F(X) Tidak Menyukai KAI EXO Sama Sekali,,0,56,0,0,941,0,,
5093890,,http://syafrita-irdani.blogspot.com/2016/01/lee-jun-ki-iu-dikonfirmasi-akan.html,http://syafrita-irdani.blogspot.com/2016/01/lee-jun-ki-iu-dikonfirmasi-akan.html,Lee Jun Ki & IU Dikonfirmasi Akan Berakting di “Moon Lovers”,Syafrita Irdani Putri: Lee Jun Ki & IU Dikonfirmasi Akan Berakting di “Moon Lovers”,23,60,83,0,905,905,,
4705689,,http://litanythrift.blogspot.com/2015/12/kisah-vanness-wu-personil-f4.html,http://litanythrift.blogspot.com/2015/12/kisah-vanness-wu-personil-f4.html,"Kisah Vanness Wu, Personil F4","litanystars: Kisah Vanness Wu, Personil F4",13,29,42,3093,2389,5478,,
4532155,,http://www.alodita.com/2015/11/hydroclean-review.html,http://www.alodita.com/2015/11/hydroclean-review.html,"GOOD NIGHT, SLEEP TIGHT. DON'T LET THE BED BUGS BITE!","Andra Alodita | Life & Beauty Journal: GOOD NIGHT, SLEEP TIGHT. DON'T LET THE BED BUGS BITE!",39,53,92,133,3865,3996,,
4631371,,http://nikenbicarafilm.blogspot.com/2015/11/the-hunger-games-mockingjay-part-2-2015.html,http://nikenbicarafilm.blogspot.com/2015/11/the-hunger-games-mockingjay-part-2-2015.html,"The Hunger Games: Mockingjay Part 2 (2015) (4,5/5)","Niken Bicara Film: The Hunger Games: Mockingjay Part 2 (2015) (4,5/5)",19,50,69,223,8931,8983,,
5354030,,http://ajirenji.blogspot.com/2016/01/movie-midnight-show-2016.html,http://ajirenji.blogspot.com/2016/01/movie-midnight-show-2016.html,[Movie] Midnight Show (2016),ajirenji mindstream reviews: [Movie] Midnight Show (2016),29,28,57,22,5508,5500,,
5180318,,http://arulfittron.blogspot.com/2016/01/negeri-van-oranje-2015-review-kisah.html,http://arulfittron.blogspot.com/2016/01/negeri-van-oranje-2015-review-kisah.html,NEGERI VAN ORANJE (2015) REVIEW : Kisah Kasih Di Negeri Orang,Arul's Movie Review Blog: NEGERI VAN ORANJE (2015) REVIEW : Kisah Kasih Di Negeri Orang,26,61,87,29,5620,5603,,
