id,source_id,babe_url,lib_url,babe_title,lib_title,title_distance,babe_title_len,lib_title_len,content_distance,babe_content_len,lib_content_len,,
6191581,,http://metrojambi.com/read/2016/03/29/8737/soal-pssi-wakil-ketua-komisi-x-minta-kemenpora-taati-putusan-ma.html,http://metrojambi.com/read/2016/03/29/8737/soal-pssi-wakil-ketua-komisi-x-minta-kemenpora-taati-putusan-ma.html,"Soal PSSI, Wakil Ketua Komisi X Minta Kemenpora Taati Putusan MA","Soal PSSI, Wakil Ketua Komisi X Minta Kemenpora Taati Putusan MA",0,64,64,85,1455,1370,,
5959689,,http://harianbogor.com/2016/03/902/,http://harianbogor.com/2016/03/902/,Kegiatan warga pesantren Daarul Uluum Lido dalam mengamati fenomena GMT,Kegiatan warga pesantren Daarul Uluum Lido dalam mengamati fenomena GMT,0,71,71,1,3169,3170,,
5966250,,http://harianbogor.com/2016/03/944/,http://harianbogor.com/2016/03/944/,Doclang Pa Haji Aos di kawasan Pasar Devris..,Doclang Pa Haji Aos di kawasan Pasar Devris..,0,45,45,0,860,860,,
5959705,,http://harianbogor.com/2016/03/894/,http://harianbogor.com/2016/03/894/,"Kampung Wisata di Bogor, ya cuma di Kampoeng Air Katulampa..","Kampung Wisata di Bogor, ya cuma di Kampoeng Air Katulampa..",0,60,60,100,2090,1992,,
6204116,,http://kotabogor.go.id/index.php/show_post/detail/2936/1000-mawar-untuk-bogor-berhasil-himpun-11-juta-rupiah#.Vvt_vhWLmM8http://,,1000 Mawar Untuk Bogor Berhasil Himpun 11 Juta Rupiah,Pemerintah Kota Bogor,44,53,21,143,1438,1297,,
6187187,,http://bogor-kita.com/?p=5299,http://bogor-kita.com/dprd-kabupaten-bogor-tetapkan-3-raperda-jadi-perda-baru/,DPRD Kabupaten Bogor Tetapkan 3 Raperda Jadi Perda Baru,DPRD Kabupaten Bogor Tetapkan 3 Raperda Jadi Perda Baru,0,55,55,1,2308,2309,,
6194109,,http://bogorpos.com/2016/03/29/atap-smk-grafika-mardi-yuana-bogor-ambruk-8-orang-terluka/,http://bogorpos.com/2016/03/29/atap-smk-grafika-mardi-yuana-bogor-ambruk-8-orang-terluka/,"Atap SMK Grafika Mardi Yuana Bogor Ambruk, 8 Orang Terluka","Atap SMK Grafika Mardi Yuana Bogor Ambruk, 8 Orang Terluka",0,58,58,2,1724,1726,,
6035250,,http://bogorplus.com/index.php/bogor-raya/item/10050-berita-pers-pangkalan-tni-au-atang-sendjaja,http://bogorplus.com/index.php/bogor-raya/item/10050-berita-pers-pangkalan-tni-au-atang-sendjaja,BERITA PERS PANGKALAN TNI AU ATANG SENDJAJA,BERITA PERS PANGKALAN TNI AU ATANG SENDJAJA,0,43,43,604,4557,3957,,
6822730,,http://polresbogor.info/polres-bogor-gelar-rekontruksi-kasus-pemerkosaan-terhadap-balita-25-tahun,,"POLRES BOGOR GELAR REKONTRUKSI KASUS PEMERKOSAAN TERHADAP BALITA 2,5 TAHUN",,0,74,0,0,2213,0,,
6016398,,http://www.depokraya.com/berita-depok/resep-minggu-ini-serba-mercon-ala-vebes-terrace/,,Resep Minggu Ini: Serba Mercon ala Vebe’s Terrace,HugeDomains.com,44,49,15,1461,1651,258,,
6024769,,http://www.depokpos.com/arsip/2016/03/blh-earth-hour-simbol-penghematan-energi/,http://www.depokpos.com/arsip/2016/03/blh-earth-hour-simbol-penghematan-energi/,BLH: Earth Hour Simbol Penghematan Energi,BLH: Earth Hour Simbol Penghematan Energi,0,41,41,11,1120,1113,,
5959795,,http://liputandepok.com/upaya-tingkatkan-kinerja-pemkot-depok-merekrut-banyak-pegawai/,http://liputandepok.com/upaya-tingkatkan-kinerja-pemkot-depok-merekrut-banyak-pegawai/,"Upaya Tingkatkan Kinerja, Pemkot Depok  Merekrut Banyak Pegawai","Upaya Tingkatkan Kinerja, Pemkot Depok  Merekrut Banyak Pegawai",0,63,63,65,1284,1221,,
6240814,,http://hallodepok.com/mohammad-idris-sampaikan-lkpj-walikota-ta-2015,http://hallodepok.com/mohammad-idris-sampaikan-lkpj-walikota-ta-2015,Mohammad Idris : Sampaikan LKPJ Walikota TA. 2015,Mohammad Idris : Sampaikan LKPJ Walikota TA. 2015,0,49,49,0,2638,2638,,
5961439,,http://www.riaulive.com/polisi-bentuk-tim-untuk-lacak-pemasok-kosmetik-ilegal-di-pekanbaru.html,http://www.riaulive.com/polisi-bentuk-tim-untuk-lacak-pemasok-kosmetik-ilegal-di-pekanbaru.html,Polisi Bentuk Tim Untuk Lacak Pemasok Kosmetik Ilegal di Pekanbaru,Polisi Bentuk Tim Untuk Lacak Pemasok Kosmetik Ilegal di Pekanbaru,0,66,66,132,2568,2438,,
6025643,,http://www.lantangriau.com/brigade-motor-lbh-dan-media-online-knpi-kota-pekanbaru-dikukuhkan/,http://www.lantangriau.com/brigade-motor-lbh-dan-media-online-knpi-kota-pekanbaru-dikukuhkan/,"Brigade Motor, LBH dan Media Online KNPI Kota Pekanbaru Dikukuhkan","Brigade Motor, LBH dan Media Online KNPI Kota Pekanbaru DikukuhkanLantang Riau",12,66,78,3,1204,1201,,
6322934,,http://beritaborneo.com/bp3tki-kalbar-serahkan-sembilan-tki-bermasalah-ke-polda-kalbar/,http://beritaborneo.com/bp3tki-kalbar-serahkan-sembilan-tki-bermasalah-ke-polda-kalbar/,BP3TKI Kalbar Serahkan Sembilan TKI Bermasalah Ke Polda Kalbar,BP3TKI Kalbar Serahkan Sembilan TKI Bermasalah Ke Polda Kalbar,0,62,62,141,4274,4137,,
6016550,,http://radarjatim.com/tertimbun-longsor-2-orang-penambang-ini-tewas-mengenaskan/,http://radarjatim.com/tertimbun-longsor-2-orang-penambang-ini-tewas-mengenaskan/,"Tertimbun Longsor, 2 Orang Penambang Ini Tewas Mengenaskan","Tertimbun Longsor, 2 Orang Penambang Ini Tewas Mengenaskan » Radar Jatim",14,58,72,0,1436,1436,,
6605454,,http://kabarntb.com/isc-seri-b-laga-kedua-ps-sumbawa-barat-main-imbang/,http://kabarntb.com/isc-seri-b-laga-kedua-ps-sumbawa-barat-main-imbang/,"ISC Seri B, Laga Kedua PS Sumbawa Barat Main Imbang","ISC Seri B, Laga Kedua PS Sumbawa Barat Main Imbang",0,51,51,36,3044,3008,,
6586100,,http://www.krsumsel.com/2016/05/dprd-muba-sampaikan-rekomendasi-lkpj-ta.html,http://www.krsumsel.com/2016/05/dprd-muba-sampaikan-rekomendasi-lkpj-ta.html,DPRD Muba Sampaikan Rekomendasi LKPJ TA 2015,DPRD Muba Sampaikan Rekomendasi LKPJ TA 2015,0,44,44,19,2547,2528,,
6616499,,http://blog.jobsmart.co.id/2016/05/09/cara-menyesuikan-hati-yang-masih-ingin-berlibur-dengan-raga-yang-kembali-bekerja/,http://blog.jobsmart.co.id/2016/05/09/cara-menyesuikan-hati-yang-masih-ingin-berlibur-dengan-raga-yang-kembali-bekerja/,Cara Menyesuikan Hati Yang Masih Ingin Berlibur Dengan Raga Yang Kembali Bekerja,Cara Menyesuaikan Hati Yang Masih Ingin Berlibur Dengan Raga Yang Kembali Bekerja,1,80,81,191,2110,1919,,
6189839,,http://www.tabloidbintang.com/articles/film-tv-musik/kabar/35645-koes-plus-tidak-takut-dengan-perkembangan-zaman,http://www.tabloidbintang.com/articles/film-tv-musik/kabar/35645-koes-plus-tidak-takut-dengan-perkembangan-zaman,Koes Plus Tidak Takut dengan Perkembangan Zaman,Koes Plus Tidak Takut dengan Perkembangan Zaman,0,47,47,11,664,655,,
6191225,,http://www.tabloidbintang.com/articles/berita/gosip/35656-marshanda-gelar-rapat-keluarga-terkait-masa-depan-ayahnya,http://www.tabloidbintang.com/articles/berita/gosip/35656-marshanda-gelar-rapat-keluarga-terkait-masa-depan-ayahnya,Marshanda Gelar Rapat Keluarga Terkait Masa Depan Ayahnya,Marshanda Gelar Rapat Keluarga Terkait Masa Depan Ayahnya,0,57,57,11,721,712,,
6188893,,http://www.tabloidbintang.com/articles/gaya-hidup/tekno/35487-ini-gadget-canggih-yang-dipakai-batman-di-batman-v-superman-dawn-of-justice,http://aura.tabloidbintang.com/articles/tekno/35487-ini-gadget-canggih-yang-dipakai-batman-di-batman-v-superman-dawn-of-justice,Ini Gadget Canggih yang Dipakai Batman di Batman V Superman: Dawn of Justice,Ini Gadget Canggih yang Dipakai Batman di Batman V Superman: Dawn of Justice,0,76,76,108,2445,2346,,
6188914,,http://www.tabloidbintang.com/articles/asia/korea/35413-zhoumi-super-junior-m-berpose-dengan-adikadiknya-yang-cantik,http://www.tabloidbintang.com/articles/asia/korea/35413-zhoumi-super-junior-m-berpose-dengan-adikadiknya-yang-cantik,Zhoumi Super Junior M Berpose dengan Adik-adiknya Yang Cantik,Zhoumi Super Junior M Berpose dengan Adik-adiknya Yang Cantik,0,61,61,178,823,979,,
6588416,,http://www.tabloidbintang.com/articles/wisata-kuliner/perjalanan/37834-4-tempat-wajib-kunjung-di-jepang-versi-chelsea-islan,http://www.tabloidbintang.com/articles/wisata-kuliner/perjalanan/37834-4-tempat-wajib-kunjung-di-jepang-versi-chelsea-islan,4 Tempat Wajib Kunjung di Jepang versi Chelsea Islan,4 Tempat Wajib Kunjung di Jepang versi Chelsea Islan,0,52,52,11,2491,2482,,
6208015,,http://www.arah.com/article/1400/pembajakan-berakhir-siprus-rilis-nama-pelaku-pembajak-pesawat.html,http://www.arah.com/article/1400/pembajakan-berakhir-siprus-rilis-nama-pelaku-pembajak-pesawat.html,"Pembajakan Berakhir, Siprus Rilis Nama Pelaku Pembajak Pesawat","Pembajakan Berakhir, Siprus Rilis Nama Pelaku Pembajak Pesawat | News",7,62,69,269,1477,1212,,
6592051,,http://www.arah.com/article/2934/foto-melly-goeslaw-dan-opick-laku-rp300-juta.html,,Foto Melly Goeslaw dan Opick Laku Rp300 Juta,,0,44,0,0,1561,0,,
6587687,,http://www.arah.com/article/2912/jawaban-lucu-santri-saat-diminta-jokowi-sebutkan-nama-menteri.html,http://www.arah.com/article/2912/jawaban-lucu-santri-saat-diminta-jokowi-sebutkan-nama-menteri.html,Jawaban Lucu Santri Saat Diminta Jokowi Sebutkan Nama Menteri,Jawaban Lucu Santri Saat Diminta Jokowi Sebutkan Nama Menteri | Unik,7,61,68,283,1077,796,,
6585348,,http://www.tabloidbintang.com/articles/extra/lensa/37931-dear-artis-yang-kamu-lakukan-ke-saya-itu-jahat,http://www.tabloidbintang.com/articles/extra/lensa/37931-dear-artis-yang-kamu-lakukan-ke-saya-itu-jahat,"Dear Artis, Yang Kamu Lakukan ke Saya itu... Jahat","Dear Artis, Yang Kamu Lakukan ke Saya itu... Jahat",0,50,50,227,6024,5815,,
6602710,,http://www.tabloidbintang.com/recipes/makanan/885-resep-black-cheese-sweet-bread,http://www.tabloidbintang.com/recipes/makanan/885-resep-black-cheese-sweet-bread,Resep Black Cheese Sweet Bread,Makanan,27,30,7,106,1805,1699,,
6594308,,http://kabartuban.com/semen-indonesia-gelar-pemantapan-manasik-haji/12530,http://kabartuban.com/semen-indonesia-gelar-pemantapan-manasik-haji/12530,Semen Indonesia Gelar Pemantapan Manasik Haji,Semen Indonesia Gelar Pemantapan Manasik Haji,0,45,45,16,1513,1497,,
6615879,,http://www.hotmagz.com/2016/05/lihat-deh-15-produk-couple-yang-norak.html,http://www.hotmagz.com/lihat-deh-15-produk-couple-yang-norak,"Lihat Deh 15 Produk Couple yang Norak dan Alay Ini, Mungkin Kamu akan Bersyukur Jadi Jomblo","Lihat Deh 15 Produk Couple yang Norak dan Alay Ini, Mungkin Kamu akan Bersyukur Jadi Jomblo",0,91,91,651,1162,701,,
6616666,,http://www.hotmagz.com/2016/05/netizen-digegerkan-dengan-beredarnya.html,http://www.hotmagz.com/netizen-digegerkan-dengan-beredarnya,Netizen Digegerkan dengan Beredarnya Foto Pisang Disuntik Darah Penderita HIV,Netizen Digegerkan dengan Beredarnya Foto Pisang Disuntik Darah Penderita HIV,0,77,77,1436,1592,199,,
6616289,,http://www.hotmagz.com/2016/05/inilah-6-artis-indonesia-yang-pernah.html,http://www.hotmagz.com/inilah-6-artis-indonesia-yang-perna,Inilah 6 Artis Indonesia yang Pernah Divonis Menderita Tumor dan Kanker,Inilah 6 Artis Indonesia yang Pernah Divonis Menderita Tumor dan Kanker,0,71,71,4149,4346,226,,
6616695,,http://www.hotmagz.com/2016/05/16-foto-ini-tunjukan-apa-jadinya-kalau.html,http://www.hotmagz.com/16-foto-ini-tunjukan-apa-jadinya-kalau,16 Foto ini Tunjukan Apa Jadinya Kalau Aktor Korea Ikutan Tren Meme Dear Mantan,16 Foto ini Tunjukan Apa Jadinya Kalau Aktor Korea Ikutan Tren Meme Dear Mantan,0,79,79,991,1097,141,,
6616244,,http://www.hotmagz.com/2016/05/waspadalah-kalau-berenang-di-sungai.html,http://www.hotmagz.com/waspadalah-kalau-berenang-di-sungai,"Waspadalah Kalau Berenang Di Sungai, Amoeba Pemakan Otak ini Tewaskan Seorang Wanita!","Waspadalah Kalau Berenang Di Sungai, Amoeba Pemakan Otak ini Tewaskan Seorang Wanita!",0,85,85,1745,1903,199,,
6291452,,http://swaramusik.com/evra-sukses-lewat-mashup/,,Evra Sukses Lewat  Mashup,,25,25,0,1928,1928,0,,
6656631,,http://www.pekanbaru.go.id/berita/berita-kota/3917-pernikahan-putri-walikota-tanpa-kado-dan-karangan-bunga/,,Pernikahan Putri Walikota Tanpa Kado dan Karangan Bunga,Pernikahan Putri Walikota Tanpa Kado dan Karangan Bunga | Berita | Pemerintah Kota Pekanbaru,37,55,92,46,1966,1920,,
6633566,,http://radarpekanbaru.com/news/detail/5284/tunjangan--pilot-belum-dibayar-picu-aksi-penerbangan-delay-lion-air.html,http://radarpekanbaru.com/news/detail/5284/tunjangan--pilot-belum-dibayar-picu-aksi-penerbangan-delay-lion-air.html,Tunjangan  Pilot Belum Dibayar Picu Aksi Penerbangan Delay Lion Air,Tunjangan Pilot Belum Dibayar Picu Aksi Penerbangan Delay Lion Air,1,67,66,0,1296,1296,,
6554714,,http://globalriau.com/pekanbaru/Oknum-Pol-Air-Riau-Diduga-Peras-Nelayan-di-Perbatasan,http://globalriau.com/pekanbaru/Oknum-Pol-Air-Riau-Diduga-Peras-Nelayan-di-Perbatasan,Oknum Pol Air Riau Diduga Peras Nelayan di Perbatasan,Oknum Pol Air Riau Diduga Peras Nelayan di Perbatasan Global Riau,12,53,65,508,1943,2190,,
6585566,,http://riaugreen.com/view/Pekanbaru/17674/Giliran-Kabag-Keuangan-Pemkab-Bengkalis-Ditahan-Polda-Riau.html,http://riaugreen.com/view/Pekanbaru/17674/Giliran-Kabag-Keuangan-Pemkab-Bengkalis-Ditahan-Polda-Riau.html,Giliran Kabag Keuangan Pemkab Bengkalis Ditahan Polda Riau,Giliran Kabag Keuangan Pemkab Bengkalis Ditahan Polda Riau,0,58,58,283,1535,1252,,
6587238,,http://www.riaucitizen.com/2016/05/dalih-potongan-pajak-dana-insentif.html,http://www.riaucitizen.com/2016/05/dalih-potongan-pajak-dana-insentif.html,"Dalih Potongan Pajak, Dana Insentif Ketua RT dan RW di Pekanbaru Dipangkas","Dalih Potongan Pajak, Dana Insentif Ketua RT dan RW di Pekanbaru Dipangkas",0,74,74,1,1230,1231,,
6332087,,http://riaubook.com/berita/9599/dibuka-lowongan-jadi-sekda-riau-berminat.html,http://www.riaubook.com/berita/9599/dibuka-lowongan-jadi-sekda-riau-berminat.html,"Dibuka Lowongan Jadi Sekda Riau, Berminat?","Dibuka Lowongan Jadi Sekda Riau, Berminat?",0,42,42,18,1369,1355,,
6670402,,http://riaupembaruan.com/pekanbaru/Sepasang-Mahasiswa-Tepergok-Indehoy--RT-setempat-Memberi-Denda-Dua-Ekor-Kambing,https://riaupembaruan.com/pekanbaru/Sepasang-Mahasiswa-Tepergok-Indehoy--RT-setempat-Memberi-Denda-Dua-Ekor-Kambing,"Sepasang Mahasiswa Tepergok Indehoy, RT setempat Memberi Denda Dua Ekor Kambing","Sepasang Mahasiswa Tepergok Indehoy, RT setempat Memberi Denda Dua Ekor Kambing Riau Pembaruan",15,79,94,28,829,801,,
6499034,,http://www.depokaktual.com/walikota-dan-wakil-walikota-depok-ikut-pawai-taaruf/,http://www.depokaktual.com/2016/04/walikota-dan-wakil-walikota-depok-ikut-pawai-taaruf/,Walikota dan Wakil Walikota Depok Ikut Pawai Ta’aruf,Walikota dan Wakil Walikota Depok Ikut Pawai Ta’aruf,0,52,52,1,1288,1289,,
6343332,,http://radarbogor.id/read/2016/04/11/5/65154/peternak-ikan-butuh-suntikan-dana,,Peternak Ikan Butuh Suntikan Dana,Radar Bogor | Peternak Ikan Butuh Suntikan Dana,14,33,47,219,258,61,,
6604597,,http://www.heibogor.com/post/detail/20593/Tim-Revitalisasi-Blok-F-Pasar-Kebon-Kembang-Minta-Saran-TP4D-Kejari,http://www.heibogor.com/post/detail/20593/tips-praktis-dan-nyaman-menyusui/,Tim Revitalisasi Blok F Pasar Kebon Kembang Minta Saran TP4D Kejari,Tips Praktis dan Nyaman Menyusui,52,67,32,1202,1646,1512,,
6596601,,http://humas.pontianakkota.go.id/berita-651-lebih-dari-1000-peserta-siap-khataman-al-quran-massal.html,,Lebih dari 1.000 peserta Siap Khataman Al Quran Massal,,0,54,0,0,2459,0,,
6672929,,http://liputankalbar.com/walikota-pontianak-gundah-anjloknya-nilai-un-sma/,http://liputankalbar.com/walikota-pontianak-gundah-anjloknya-nilai-un-sma/,Walikota Pontianak Gundah Anjloknya Nilai UN SMA,Walikota Pontianak Gundah Anjloknya Nilai UN SMA,0,48,48,0,1282,1282,,
6586361,,http://beritaborneo.com/polda-kalbar-musnahkan-sabu-senilai-rp34-m/,http://beritaborneo.com/polda-kalbar-musnahkan-sabu-senilai-rp34-m/,Polda Kalbar Musnahkan Sabu Senilai Rp34 M,Polda Kalbar Musnahkan Sabu Senilai Rp34 M,0,42,42,76,2598,2524,,
8525550,,http://www.pikiran-rakyat.com/bandung-raya/2016/09/26/sopir-taksi-online-penjual-sabu-diamankan-380828,http://www.pikiran-rakyat.com/bandung-raya/2016/09/26/sopir-taksi-online-penjual-sabu-diamankan-380828,Sopir Taksi Online Penjual Sabu Diamankan,Sopir Taksi Online Penjual Sabu Diamankan,0,41,41,67,1604,1537,,
8479103,,http://www.pikiran-rakyat.com/jawa-barat/2016/09/22/jabar-dipastikan-juara-umum-angkat-besi-380588,http://www.pikiran-rakyat.com/jawa-barat/2016/09/22/jabar-dipastikan-juara-umum-angkat-besi-380588,Jabar Dipastikan Juara Umum Angkat Besi,Jabar Dipastikan Juara Umum Angkat Besi,0,39,39,365,2780,2415,,
6594749,,http://feedproxy.google.com/~r/Seksualitas/~3/PZDXQFOMe3w/genggam-ponsel-penyebab-impotensi.htm,http://www.sehatki.com/genggam-ponsel-penyebab-impotensi.htm,Genggam Ponsel Terlalu Lama Tingkatkan Risiko Impoten pada Pria,Genggam Ponsel Terlalu Lama Menyebabkan Impotensi Pria,18,63,54,93,3447,3356,,
6526946,,http://smartmama.com/2016/04/28/jangan-lakukan-4-hal-ini-sebelum-bercinta/,http://smartmama.com/2016/04/28/jangan-lakukan-4-hal-ini-sebelum-bercinta/,Jangan Lakukan 4 Hal Ini Sebelum Bercinta!,Jangan Lakukan 4 Hal Ini Sebelum Bercinta!,0,42,42,1693,2022,329,,
6586796,,http://www.areadewasa.com/game-online-bisa-meningkatkan-kualitas-hubungan/,http://www.areadewasa.com/game-online-bisa-meningkatkan-kualitas-hubungan/,Game Online Bisa Meningkatkan Kualitas Hubungan?,Game Online Bisa Meningkatkan Kualitas Hubungan?,0,48,48,97,3302,3205,,
6606001,,http://www.otomania.com/read/xml/2016/05/07/184415230/Tempatnya.Kumpul.Komunitas.Biker.Se.Kalimantan,http://www.otomania.com/read/2016/05/07/184415230/Tempatnya.Kumpul.Komunitas.Biker.Se.Kalimantan,Tempatnya Kumpul Komunitas Biker Se Kalimantan,Tempatnya Kumpul Komunitas Biker Se Kalimantan,0,46,46,66,1870,1808,,
6685883,,http://www.idntimes.com/vita/alasan-kenapa-karir-sudah-wajib-dipikirkan-sejak-sma,https://life.idntimes.com/career/vita/alasan-kenapa-karir-sudah-wajib-dipikirkan-sejak-sma,Penting Banget! Ini Lho Alasan Kenapa Kamu Harus Mikirin Karirmu Sejak SMA,Penting Banget! Ini Lho Alasan Kenapa Kamu Harus Mikirin Karirmu Sejak SMA,0,74,74,1759,5803,4044,,
6668085,,http://www.idntimes.com/rizal/sisi-kehidupan-reynold-tagore-yang-belum-kamu-ketahui-animator-indonesia,https://life.idntimes.com/inspiration/rizal/sisi-kehidupan-reynold-tagore-yang-belum-kamu-ketahui-animator-indonesia,"9 Fakta Hidup Reynold Tagore, Anak Muda Surabaya yang Sukses Jadi Animator Hollywood","9 Fakta Hidup Reynold Tagore, Anak Muda Surabaya yang Sukses Jadi Animator Hollywood",0,84,84,2961,0,2961,,
6676200,,http://www.idntimes.com/tita/tips-efektif-lupain-mantan,https://life.idntimes.com/relationship/tita/tips-efektif-lupain-mantan,Galau Karena Mantan? Ini 7 Pengingat Biar Kamu Gak Tergoda Buat Hubungi Dia,Galau Karena Mantan? Ini 7 Pengingat Biar Kamu Gak Tergoda Buat Hubungi Dia,0,75,75,906,3728,2822,,
6677474,,http://www.idntimes.com/maira/beratnya-masa-masa-kuliah-diumpamakan-dengan-superhero,https://life.idntimes.com/education/maira/beratnya-masa-masa-kuliah-diumpamakan-dengan-superhero,Sadar Gak? Superhero Ini Menggambarkan Hidupmu di Tiap Semester Kuliah,Sadar Gak? Superhero Ini Menggambarkan Hidupmu di Tiap Semester Kuliah,0,70,70,848,4837,3989,,
6670056,,http://www.idntimes.com/maulida-ayu/8-tips-supaya-bisa-dapat-alis-tebal-dan-indah-seperti-raisa,https://life.idntimes.com/women/maulida-ayu/8-tips-supaya-bisa-dapat-alis-tebal-dan-indah-seperti-raisa,8 Tips Supaya Bisa Dapat Alis Tebal dan Indah Seperti Raisa,8 Tips Supaya Bisa Dapat Alis Tebal dan Indah Seperti Raisa,0,59,59,351,3395,3044,,
6596122,,http://kabarkampus.com/2016/05/buat-calon-mahasiswa-ipb-buka-kampus-di-sukabumi/,http://kabarkampus.com/2016/05/buat-calon-mahasiswa-ipb-buka-kampus-di-sukabumi/,"Buat Calon Mahasiswa, IPB Buka Kampus di Sukabumi","Buat Calon Mahasiswa, IPB Buka Kampus di Sukabumi",0,49,49,4,2817,2821,,
6588075,,http://world.kbs.co.kr/indonesian/news/news_Po_detail.htm?No=41267,http://world.kbs.co.kr/indonesian/news/news_Po_detail.htm?No=41267,Presiden : Pemerintah Mendukung Agar Anak-anak Tumbuh Menjadi Aset Bangsa,Presiden : Pemerintah Mendukung Agar Anak-anak Tumbuh Menjadi Aset Bangsa,0,73,73,154,975,839,,
6588820,,http://world.kbs.co.kr/indonesian/news/news_Ec_detail.htm?No=41274,http://world.kbs.co.kr/indonesian/news/news_Ec_detail.htm?No=41274,Rata-rata Uang Deposit Sewa Rumah di Seluruh Korea Melebihi 200 Juta Won,Rata-rata Uang Deposit Sewa Rumah di Seluruh Korea Melebihi 200 Juta Won,0,72,72,145,881,738,,
6588822,,http://world.kbs.co.kr/indonesian/news/news_IK_detail.htm?No=41271,http://world.kbs.co.kr/indonesian/news/news_IK_detail.htm?No=41271,"Konvensi Partai Buruh Korut Digelar Tanggal 6 Mei, Resmi Umumkan Era Kim Jong-un","Konvensi Partai Buruh Korut Digelar Tanggal 6 Mei, Resmi Umumkan Era Kim Jong-un",0,80,80,152,1151,999,,
6603344,,http://world.kbs.co.kr/indonesian/news/news_In_detail.htm?No=41289,http://world.kbs.co.kr/indonesian/news/news_In_detail.htm?No=41289,Rusia Membekukan Transaksi Uang dengan Korut Secara Menyeluruh,Rusia Membekukan Transaksi Uang dengan Korut Secara Menyeluruh,0,62,62,134,1401,1267,,
6588878,,http://world.kbs.co.kr/indonesian/news/news_Dm_detail.htm?No=41275,http://world.kbs.co.kr/indonesian/news/news_Dm_detail.htm?No=41275,Seekor Rubah yang Dilepas di Gunung Sobaek Lahirkan Anak,Seekor Rubah yang Dilepas di Gunung Sobaek Lahirkan Anak,0,56,56,128,774,646,,
6603715,,http://world.kbs.co.kr/indonesian/news/news_Cu_detail.htm?No=41293,http://world.kbs.co.kr/indonesian/news/news_Cu_detail.htm?No=41293,Festival Film Internasional Jeonju Ditutup,Festival Film Internasional Jeonju Ditutup,0,42,42,114,778,664,,
6505348,,http://world.kbs.co.kr/indonesian/news/news_Sc_detail.htm?No=41164,http://world.kbs.co.kr/indonesian/news/news_Sc_detail.htm?No=41164,"Suhu Udara Seoul Pada Hari Selasa Mencapai 29,4 Derajat Celsius","Suhu Udara Seoul Pada Hari Selasa Mencapai 29,4 Derajat Celsius",0,63,63,136,1015,881,,
6619287,,http://world.kbs.co.kr/indonesian/news/news_Sp_detail.htm?No=41307,http://world.kbs.co.kr/indonesian/news/news_Sp_detail.htm?No=41307,Pegolf James Hahn Menang di PGA Wells Fargo Championship,Pegolf James Hahn Menang di PGA Wells Fargo Championship,0,56,56,128,611,483,,
6630538,,http://world.kbs.co.kr/indonesian/program/program_economyplus_detail.htm?No=5504,http://world.kbs.co.kr/indonesian/program/program_economyplus_detail.htm?No=5504,Implikasi ekonomi yang timbul dari penetapan hari libur sementara,Implikasi ekonomi yang timbul dari penetapan hari libur sementara,0,65,65,78,2011,1933,,
6627906,,http://world.kbs.co.kr/indonesian/program/program_musicnews_detail.htm?No=30535,http://world.kbs.co.kr/indonesian/program/program_musicnews_detail.htm?No=30535,Akdong Musician curhat tentang 2 tahun hiatus dan inspirasi album barunya,Akdong Musician curhat tentang 2 tahun hiatus dan inspirasi album barunya,0,73,73,85,1234,1149,,
6639356,,http://world.kbs.co.kr/indonesian/program/program_koreastory_detail.htm?No=1033,http://world.kbs.co.kr/indonesian/program/program_koreastory_detail.htm?No=1033,Beruang yang Membalas Budi,Beruang yang Membalas Budi,0,26,26,40,2995,2955,,
6639413,,http://world.kbs.co.kr/indonesian/program/program_kfoodstory_detail.htm?No=10054795,http://world.kbs.co.kr/indonesian/program/program_kfoodstory_detail.htm?No=10054795,Ssamjang (쌈장),Ssamjang (쌈장),0,13,13,374,1502,1128,,
6470128,,http://www.bbc.com/indonesia/berita_indonesia/2016/04/160421_indonesia_revisi_ruuterorisme,,Perlukah memperluas pengertian 'terorisme?',,0,43,0,0,4445,0,,
8482713,,http://www.bbc.com/indonesia/berita_indonesia/2016/09/160922_indonesia_pdip_ahok,,PDI-P tidak satu suara mengusung Ahok-Djarot?,,0,45,0,0,3863,0,,
8479879,,http://www.bbc.com/indonesia/olahraga/2016/09/160922_olahraga_mourinho,,Mourinho 'serang balik' para pengkritik Manchester United,,0,57,0,0,1431,0,,
8486274,,http://www.bbc.com/indonesia/vert_cap/2016/09/160921_vert_cap_menanyakan_pekerjaan,,Mengapa sebaiknya Anda tidak menanyakan ke orang pekerjaan mereka,,0,65,0,0,6139,0,,
8477794,,http://www.bbc.com/indonesia/dunia/2016/09/160922_dunia_eropa_hamas,,Uni Eropa disarankan cabut Hamas dari daftar teroris,,0,52,0,0,1931,0,,
6586697,,http://indonesian.rti.org.tw/news/?recordId=46723,http://indonesian.rti.org.tw/news/?recordId=46723,"WNI disekap selama 4 tahun, jadibudak seks majikan","Radio Taiwan International | News | WNI disekap selama 4 tahun, jadi budak seks majikan",37,50,87,1,1749,1750,,
6602934,,http://indonesian.irib.ir/international/eropa/item/109820-rusia-konfirmasi-perpanjangan-gencatan-senjata-di-aleppo,http://indonesian.irib.ir/international/eropa/item/109820-rusia-konfirmasi-perpanjangan-gencatan-senjata-di-aleppo,Rusia Konfirmasi Perpanjangan Gencatan Senjata di Aleppo,Rusia Konfirmasi Perpanjangan Gencatan Senjata di Aleppo,0,56,56,106,1309,1203,,
6608160,,http://indonesian.irib.ir/international/afrika/item/109847-mesir-akan-tutup-situs-situs-takfiri-dan-radikal,http://indonesian.irib.ir/international/afrika/item/109847-mesir-akan-tutup-situs-situs-takfiri-dan-radikal,Mesir akan Tutup Situs-situs Takfiri dan Radikal,Mesir akan Tutup Situs-situs Takfiri dan Radikal,0,48,48,168,855,687,,
6605023,,http://indonesian.irib.ir/iran/ekonomi/item/109835-iran-gandeng-mitra-asing-garap-bisnis-hulu-migas,http://indonesian.irib.ir/iran/ekonomi/item/109835-iran-gandeng-mitra-asing-garap-bisnis-hulu-migas,Iran Gandeng Mitra Asing Garap Bisnis Hulu Migas,Iran Gandeng Mitra Asing Garap Bisnis Hulu Migas,0,48,48,218,1282,1064,,
6598310,,http://indonesian.irib.ir/iran/sosial/item/109809-khatib-jumat-tehran-iran-tak-akan-kompromi-dengan-as,http://indonesian.irib.ir/iran/sosial/item/109809-khatib-jumat-tehran-iran-tak-akan-kompromi-dengan-as,Khatib Jumat Tehran: Iran Tak akan Kompromi dengan AS,Khatib Jumat Tehran: Iran Tak akan Kompromi dengan AS,0,53,53,115,1681,1569,,
6605220,,http://indonesian.irib.ir/international/asia-dan-pasifk/item/109836-as-korsel-sepakat-tingkatkan-tekanan-pada-korut,http://indonesian.irib.ir/international/asia-dan-pasifk/item/109836-as-korsel-sepakat-tingkatkan-tekanan-pada-korut,AS-Korsel Sepakat Tingkatkan Tekanan pada Korut,AS-Korsel Sepakat Tingkatkan Tekanan pada Korut,0,47,47,134,1008,874,,
6556346,,http://indonesian.irib.ir/iran/teknologi/item/109688-,http://indonesian.irib.ir/iran/teknologi/item/109688-,Masa Depan Hubungan Militer Iran-Rusia Sangat Cerah,Masa Depan Hubungan Militer Iran-Rusia Sangat Cerah,0,51,51,139,849,712,,
