id,source_id,babe_url,lib_url,babe_title,lib_title,title_distance,babe_title_len,lib_title_len,content_distance,babe_content_len,lib_content_len
5852686,,http://purwokertokita.com/bisnis/alasan-bandara-wirasaba-lebih-mungkin-dikembangkan-dibanding-tunggul-wulung.html,http://purwokertokita.com/bisnis/alasan-bandara-wirasaba-lebih-mungkin-dikembangkan-dibanding-tunggul-wulung.html,Alasan Bandara Wirasaba Lebih Mungkin Dikembangkan dibanding Tunggul Wulung,Alasan Bandara Wirasaba Dikembangkan,39,75,36,228,1727,1501
5852691,,http://purwokertokita.com/wisata/gerhana-matahari-di-banyumas-bisa-dinikmati-di-tempat-ini.html,http://purwokertokita.com/wisata/gerhana-matahari-di-banyumas-bisa-dinikmati-di-tempat-ini.html,Gerhana Matahari di Banyumas Bisa Dinikmati di Tempat Ini,Menikmati Gerhana Matahari di Banyumas,39,57,38,249,2611,2364
6238937,,http://purwokertokita.com/kuliner/yuks-cobain-menu-pizza-di-hangout-bistro-purbalingga.html,http://purwokertokita.com/kuliner/yuks-cobain-menu-pizza-di-hangout-bistro-purbalingga.html,Yuks Cobain Menu Pizza di Hangout Bistro Purbalingga,Menu Baru Berupa Pizza di Hangout Bistro Purbalingga,13,52,52,129,2292,2169
6013674,,http://purwokertokita.com/foto/menjelajah-situs-gunung-padang-majenang.html,http://purwokertokita.com/foto/menjelajah-situs-gunung-padang-majenang.html,Menjelajah Situs Gunung Padang Majenang,Menjelajah Situs Pabahana Majenang,10,39,34,90,585,497
6021877,,http://purwokertokita.com/bola/mampukah-ranieri-membawa-leicester-city-juara.html,http://purwokertokita.com/bola/mampukah-ranieri-membawa-leicester-city-juara.html,Mampukah Ranieri Membawa Leicester City Juara?,Mampukah Leicester City Juara Liga Inggris,29,46,42,78,8772,8704
6194121,,http://lintasgayo.co/2016/03/29/luput-dari-media-aktor-hollywood-leo-dicaprio-akan-sumbang-44-m-untuk-kel,http://lintasgayo.co/2016/03/29/luput-dari-media-aktor-hollywood-leo-dicaprio-akan-sumbang-44-m-untuk-kel,"Luput dari Media, Aktor Hollywood Leo DiCaprio Akan Sumbang 44 M Untuk KEL","Luput dari Media, Aktor Hollywood Leo DiCaprio Akan Sumbang 44 M Untuk KEL | Media Online Dataran Tinggi GAYO",35,74,109,14,1039,1027
6204116,,http://kotabogor.go.id/index.php/show_post/detail/2936/1000-mawar-untuk-bogor-berhasil-himpun-11-juta-rupiah#.Vvt_vhWLmM8http://,,1000 Mawar Untuk Bogor Berhasil Himpun 11 Juta Rupiah,Pemerintah Kota Bogor,44,53,21,143,1438,1297
6016398,,http://www.depokraya.com/berita-depok/resep-minggu-ini-serba-mercon-ala-vebes-terrace/,,Resep Minggu Ini: Serba Mercon ala Vebe’s Terrace,HugeDomains.com,44,49,15,1461,1651,258
6025643,,http://www.lantangriau.com/brigade-motor-lbh-dan-media-online-knpi-kota-pekanbaru-dikukuhkan/,http://www.lantangriau.com/brigade-motor-lbh-dan-media-online-knpi-kota-pekanbaru-dikukuhkan/,"Brigade Motor, LBH dan Media Online KNPI Kota Pekanbaru Dikukuhkan","Brigade Motor, LBH dan Media Online KNPI Kota Pekanbaru DikukuhkanLantang Riau",12,66,78,3,1204,1201
6016550,,http://radarjatim.com/tertimbun-longsor-2-orang-penambang-ini-tewas-mengenaskan/,http://radarjatim.com/tertimbun-longsor-2-orang-penambang-ini-tewas-mengenaskan/,"Tertimbun Longsor, 2 Orang Penambang Ini Tewas Mengenaskan","Tertimbun Longsor, 2 Orang Penambang Ini Tewas Mengenaskan » Radar Jatim",14,58,72,0,1436,1436
6616499,,http://blog.jobsmart.co.id/2016/05/09/cara-menyesuikan-hati-yang-masih-ingin-berlibur-dengan-raga-yang-kembali-bekerja/,http://blog.jobsmart.co.id/2016/05/09/cara-menyesuikan-hati-yang-masih-ingin-berlibur-dengan-raga-yang-kembali-bekerja/,Cara Menyesuikan Hati Yang Masih Ingin Berlibur Dengan Raga Yang Kembali Bekerja,Cara Menyesuaikan Hati Yang Masih Ingin Berlibur Dengan Raga Yang Kembali Bekerja,1,80,81,191,2110,1919
6208015,,http://www.arah.com/article/1400/pembajakan-berakhir-siprus-rilis-nama-pelaku-pembajak-pesawat.html,http://www.arah.com/article/1400/pembajakan-berakhir-siprus-rilis-nama-pelaku-pembajak-pesawat.html,"Pembajakan Berakhir, Siprus Rilis Nama Pelaku Pembajak Pesawat","Pembajakan Berakhir, Siprus Rilis Nama Pelaku Pembajak Pesawat | News",7,62,69,269,1477,1212
6587687,,http://www.arah.com/article/2912/jawaban-lucu-santri-saat-diminta-jokowi-sebutkan-nama-menteri.html,http://www.arah.com/article/2912/jawaban-lucu-santri-saat-diminta-jokowi-sebutkan-nama-menteri.html,Jawaban Lucu Santri Saat Diminta Jokowi Sebutkan Nama Menteri,Jawaban Lucu Santri Saat Diminta Jokowi Sebutkan Nama Menteri | Unik,7,61,68,283,1077,796
6602710,,http://www.tabloidbintang.com/recipes/makanan/885-resep-black-cheese-sweet-bread,http://www.tabloidbintang.com/recipes/makanan/885-resep-black-cheese-sweet-bread,Resep Black Cheese Sweet Bread,Makanan,27,30,7,106,1805,1699
6291452,,http://swaramusik.com/evra-sukses-lewat-mashup/,,Evra Sukses Lewat  Mashup,,25,25,0,1928,1928,0
6656631,,http://www.pekanbaru.go.id/berita/berita-kota/3917-pernikahan-putri-walikota-tanpa-kado-dan-karangan-bunga/,,Pernikahan Putri Walikota Tanpa Kado dan Karangan Bunga,Pernikahan Putri Walikota Tanpa Kado dan Karangan Bunga | Berita | Pemerintah Kota Pekanbaru,37,55,92,46,1966,1920
6633566,,http://radarpekanbaru.com/news/detail/5284/tunjangan--pilot-belum-dibayar-picu-aksi-penerbangan-delay-lion-air.html,http://radarpekanbaru.com/news/detail/5284/tunjangan--pilot-belum-dibayar-picu-aksi-penerbangan-delay-lion-air.html,Tunjangan  Pilot Belum Dibayar Picu Aksi Penerbangan Delay Lion Air,Tunjangan Pilot Belum Dibayar Picu Aksi Penerbangan Delay Lion Air,1,67,66,0,1296,1296
6554714,,http://globalriau.com/pekanbaru/Oknum-Pol-Air-Riau-Diduga-Peras-Nelayan-di-Perbatasan,http://globalriau.com/pekanbaru/Oknum-Pol-Air-Riau-Diduga-Peras-Nelayan-di-Perbatasan,Oknum Pol Air Riau Diduga Peras Nelayan di Perbatasan,Oknum Pol Air Riau Diduga Peras Nelayan di Perbatasan Global Riau,12,53,65,508,1943,2190
6670402,,http://riaupembaruan.com/pekanbaru/Sepasang-Mahasiswa-Tepergok-Indehoy--RT-setempat-Memberi-Denda-Dua-Ekor-Kambing,https://riaupembaruan.com/pekanbaru/Sepasang-Mahasiswa-Tepergok-Indehoy--RT-setempat-Memberi-Denda-Dua-Ekor-Kambing,"Sepasang Mahasiswa Tepergok Indehoy, RT setempat Memberi Denda Dua Ekor Kambing","Sepasang Mahasiswa Tepergok Indehoy, RT setempat Memberi Denda Dua Ekor Kambing Riau Pembaruan",15,79,94,28,829,801
6343332,,http://radarbogor.id/read/2016/04/11/5/65154/peternak-ikan-butuh-suntikan-dana,,Peternak Ikan Butuh Suntikan Dana,Radar Bogor | Peternak Ikan Butuh Suntikan Dana,14,33,47,219,258,61
6604597,,http://www.heibogor.com/post/detail/20593/Tim-Revitalisasi-Blok-F-Pasar-Kebon-Kembang-Minta-Saran-TP4D-Kejari,http://www.heibogor.com/post/detail/20593/tips-praktis-dan-nyaman-menyusui/,Tim Revitalisasi Blok F Pasar Kebon Kembang Minta Saran TP4D Kejari,Tips Praktis dan Nyaman Menyusui,52,67,32,1202,1646,1512
6594749,,http://feedproxy.google.com/~r/Seksualitas/~3/PZDXQFOMe3w/genggam-ponsel-penyebab-impotensi.htm,http://www.sehatki.com/genggam-ponsel-penyebab-impotensi.htm,Genggam Ponsel Terlalu Lama Tingkatkan Risiko Impoten pada Pria,Genggam Ponsel Terlalu Lama Menyebabkan Impotensi Pria,18,63,54,93,3447,3356
6586697,,http://indonesian.rti.org.tw/news/?recordId=46723,http://indonesian.rti.org.tw/news/?recordId=46723,"WNI disekap selama 4 tahun, jadibudak seks majikan","Radio Taiwan International | News | WNI disekap selama 4 tahun, jadi budak seks majikan",37,50,87,1,1749,1750
6599370,,http://indonesia.rbth.com/news/2016/05/06/tiga-universitas-rusia-masuk-peringkat-100-universitas-terbaik-dunia_590995,http://indonesia.rbth.com/news/2016/05/06/tiga-universitas-rusia-masuk-peringkat-100-universitas-terbaik-dunia_590995,Tiga Universitas Rusia Masuk Peringkat 100 Universitas Terbaik Dunia,Tiga Universitas Rusia Masuk Peringkat 100 Universitas Terbaik Dunia | Berita Rusia,15,68,83,39,1038,1001
6605465,,http://hiburan.rakyatku.com/read/3527/2016/05/07/240-komunitas-meriahkan-pesta-komunitas-makassar,http://hiburan.rakyatku.com/read/3527/2016/05/07/240-komunitas-meriahkan-pesta-komunitas-makassar,240 Komunitas Meriahkan Pesta KomunitasMakassar,240 Komunitas Meriahkan Pesta Komunitas Makassar,1,47,48,0,654,654
6589736,,http://otomotif.rakyatku.com/read/3227/2016/05/05/unik-ford-gabungkan-mustang-1965-dan-2015-jadi-satu-kendaraan,http://otomotif.rakyatku.com/read/3227/2016/05/05/unik-ford-gabungkan-mustang-1965-dan-2015-jadi-satu-kendaraan,"Unik, Ford Gabungkan Mustang 1965 dan2015 Jadi Satu Kendaraan","Unik, Ford Gabungkan Mustang 1965 dan 2015 Jadi Satu Kendaraan",1,61,62,0,911,911
6594739,,http://travel.rakyatku.com/read/3315/2016/05/06/liburan-tanpa-lupa-jumatan-rasakan-keimewaan-perjalanan-anda,http://travel.rakyatku.com/read/3315/2016/05/06/liburan-tanpa-lupa-jumatan-rasakan-keistimewaan-perjalanan-anda,"Liburan Tanpa Lupa Jumatan, Rasakan Keimewaan Perjalanan Anda","Liburan Tanpa Lupa Jumatan, Rasakan Keistimewaan Perjalanan Anda",3,61,64,124,3502,3380
6601253,,http://www.boombastis.com/fakta-presiden-assaat/70598?utm_source=rss&utm_medium=rss,http://www.boombastis.com/fakta-presiden-assaat/70598,"5 Fakta Assaat, Presiden Indonesia yang Tak Pernah Dikenal Oleh Rakyatnya","5 Fakta Assaat, Presiden Indonesia yang Tak Pernah Dikenal Oleh Rakyatnya – Boom Bastis",14,73,87,2226,5061,2837
6586379,,http://tenagakuda.com/peugeot-speedfight-4-edisi-total-sport/,http://tenagakuda.com/peugeot-speedfight-4-edisi-total-sport/10890,Peugeot Speedfight 4 Edisi“Total Sport”,"Peugeot Speedfight 4 Edisi ""Total Sport""",3,39,40,1,1012,1013
6605437,,http://www.sepakbola.com/2016/05/persija-siap-andalkan-jose-guerra-di-lini-depan-saat-bertemu-semen-padang,http://www.sepakbola.com/populer/,Persija Siap Andalkan Jose Guerra Di Lini Depan Saat Bertemu Semen Padang,Populer • SEPAKBOLA.com,63,73,23,1166,1526,798
6603847,,http://gilabola.com/berita-bola/inggris/berita-bola-akhirnya-marcus-rashford-naik-gaji-07052016/,http://gilabola.com/berita-bola/inggris/berita-bola-akhirnya-marcus-rashford-naik-gaji-07052016/,"Berita Bola : Akhirnya, Marcus Rashford Naik Gaji!","Akhirnya, Marcus Rashford Naik Gaji!",14,50,36,182,2211,2031
6614200,,http://www.radarlamsel.com/ayo-bantu-nur-dan-ngalim/,http://www.radarlamsel.com/ayo-bantu-nur-dan-ngalim/,Ayo! Bantu Nur dan Ngalim,Ayo! Bantu Nur dan Ngalim | Radar Lamsel,15,25,40,170,3736,3566
6601227,,http://www.radarbangka.co.id/berita/detail//39311/pembunuhan-dosen-umsu-bermotif-dendam,,Pembunuhan Dosen UMSU BermotifDendam,Pembunuhan Dosen UMSU Bermotif Dendam,1,36,37,18,3252,3240
6605225,,http://jambi.tribunnews.com/2016/05/07/buat-para-pria-rawat-bulu-ini-dengan-baik-supaya-terlihat-seksi-di-depan-wanita,http://jambi.tribunnews.com/2016/05/07/buat-para-pria-rawat-bulu-ini-dengan-baik-supaya-terlihat-seksi-di-depan-wanita,"Buat Para Pria, Rawat Bulu Ini dengan Baik SupayaTerlihat Seksi di Depan Wanita","Buat Para Pria, Rawat Bulu Ini dengan Baik Supaya Terlihat Seksi di Depan Wanita",1,79,80,1162,3274,2114
6604552,,http://lampost.co/berita/jadwal-siarang-langsung-pertandingan-sepak-bola-akhir-pekan-ini,http://lampost.co/berita/,Jadwal Siarang Langsung Pertandingan Sepak Bola Akhir Pekan Ini,| Berita Online Lampung,52,63,23,1930,2168,323
6604141,,http://lifestyle.okezone.com/read/2016/05/07/298/1382346/long-weekend-di-aceh-nikmati-kelezatan-pancri-nanas,http://lifestyle.okezone.com/read/2016/05/07/298/1382346/long-weekend-di-aceh-nikmati-kelezatan-pancri-nanas,"Long Weekend di Aceh, Nikmati Kelezatan Pancri Nanas","Long Weekend di Aceh, Nikmati Kelezatan Pancri Nanas : Okezone Lifestyle",20,52,72,179,884,707
6603343,,http://www.solopos.com/2016/05/06/pengumuman-hasil-un-nilai-7-963-siswa-sma-karanganyar-diumumkan-sabtu-sore-717077,http://www.solopos.com/2016/05/06/pengumuman-hasil-un-nilai-7-963-siswa-sma-karanganyar-diumumkan-sabtu-sore-717077,PENGUMUMAN HASIL UN : Nilai7.963 Siswa SMA Karanganyar Diumumkan Sabtu Sore,PENGUMUMAN HASIL UN : Nilai 7.963 Siswa SMA Karanganyar Diumumkan Sabtu Sore,1,75,76,80,2401,2324
6603832,,http://pojoksatu.id/bola/liga-champions/2016/05/07/5-hal-yang-harus-dilakukan-madrid-sebelum-final-liga-champions/,http://pojoksatu.id/bola/liga-champions/2016/05/07/5-hal-yang-harus-dilakukan-madrid-sebelum-final-liga-champions/,5 Hal yang Harus Dilakukan Madrid sebelum Final Liga Champions,5 Hal yang Harus Dilakukan Madrid Sebelum Final Liga Champions,1,62,62,169,1745,1580
6605237,,http://pojoksatu.id/life-style/2016/05/07/angelina-jolie-bakal-terjun-ke-ranah-politik/,http://pojoksatu.id/life-style/2016/05/07/angelina-jolie-bakal-terjun-ke-ranah-politik/,Angelina Jolie Bakal Terjun ke Ranah Politik,Angelina Jolie Bakal Terjun Ke Ranah Politik,1,44,44,18,1462,1444
6586881,,http://www.tabloid-nakita.com/read/7071/hindari-berikan-garam-pada-bayi-ini-alasannya,http://nakita.id/Bayi/Hindari-Berikan-Garam-Pada-Bayi-Ini-Alasannya,"Hindari Berikan Garam PadaBayi, Ini Alasannya!","Hindari Berikan Garam Pada Bayi, Ini Alasannya!",1,46,47,162,2276,2120
6644287,,http://www.tribratanews.com/kapolsubsektor-palem-semi-sektor-jatiuwung-tangerang-kota-sambangi-pos-ronda-pokdarkamtibmas-cibodas-dan-betet-raya/,https://www.tribratanews.com/kapolsubsektor-palem-semi-sektor-jatiuwung-tangerang-kota-sambangi-pos-ronda-pokdarkamtibmas-cibodas-dan-betet-raya/,Kapolsubsektor Palem Semi Sektor Jatiuwung Tangerang Kota Sambangi Pos Ronda Pokdarkamtibmas Cibodas dan Betet Raya,Kapolsubsektor Palem Semi Sektor Jatiuwung Tangerang Kota Sambangi Pos Ronda Pokdarkamtibmas Cibodas dan Betet Raya – Tribratanews,15,115,130,28,960,932
6621195,,http://blog.misteraladin.com/5-hal-unik-yang-bisa-dilakukan-di-jakarta-pas-long-weekend/,http://blog.misteraladin.com/5-hal-unik-yang-bisa-dilakukan-di-jakarta-pas-long-weekend/,5 Hal Unik yang Bisa Dilakukan di Jakarta Pas Long Weekend,5 Hal Unik yang Bisa Dilakukan di Jakarta Pas Long Weekend – Mister Aladin Travel Discoveries,35,58,93,873,3575,2702
6629580,,http://gadgetren.com/2016/05/09/360-n4-smartphone-dengan-ram-4-gb-dan-helio-x20-seharga-1-jutaan/,https://gadgetren.com/2016/05/09/360-n4-smartphone-dengan-ram-4-gb-dan-helio-x20-seharga-1-jutaan/,360 N4 – Smartphone dengan RAM 4 GB dan Helio X20 Seharga 1 jutaan,Harga dan Spesifikasi Smartphone 360 N4 dengan RAM 4 GB,56,66,55,28,1683,1655
6643374,,"http://www.rmoljakarta.com/read/2016/05/11/25973/1/Ahok:-Kata-Siapa,--Bu-Mega-Belum-Bilang-Kok","http://www.rmoljakarta.com/read/2016/05/11/25973/Ahok:-Kata-Siapa,--Bu-Mega-Belum-Bilang-Kok-","Ahok: Kata Siapa, Bu Mega Belum Bilang Kok",rmoljakarta.com,37,42,15,79,1308,1229
6642460,,http://www.medanbagus.com/news.php?id=39004,,Pedagang Pasar Tavip Akan Ditempatkan Sementara ke Mega Lods dan Jalan Speksi,MedanBagus.com | Pedagang Pasar Tavip Akan Ditempatkan Sementara ke Mega Lods dan Jalan Speksi,17,77,94,1123,1692,2809
6642139,,http://www.bebeja.com/strategi-rawat-sengon-solomon/,http://www.bebeja.com/strategi-rawat-sengon-solomon/,Strategi Rawat Sengon Solomon,Strategi Rawat Sengon Solomon | Usaha Agribisnis,19,29,48,0,1299,1299
6655443,,http://bbpadi.litbang.pertanian.go.id/index.php/berita/berita-utama/content/317-waspadai-ulah-spekulan-pangan,http://bbpadi.litbang.pertanian.go.id/index.php/berita/berita-utama/content/317-waspadai-ulah-spekulan-pangan,Waspadai Ulah Spekulan Pangan,Balai Besar Penelitian Tanaman Padi,24,29,35,23,3663,3640
6645172,,http://www.ciyusni.com/seks/5-posisi-seks-terbaru-wajib-kamu-coba/,http://www.ciyusni.com/seks/5-posisi-seks-terbaru-wajib-kamu-coba/,5 Posisi Seks Terbaru Wajib Kamu Coba,5 Posisi Seks Terbaru Wajib Kamu Coba – Aneh Tapi Nyata,18,37,55,87,3098,3011
6653318,,http://forum-animeindo.com/musim-kedua-attack-on-titan-dirumorkan-mengalami-penundaan-dan-baru-akan-dimulai-tahun-depan/,http://forum-animeindo.com/musim-kedua-attack-on-titan-dirumorkan-mengalami-penundaan-dan-baru-akan-dimulai-tahun-depan/,“Attack on Titan” Dirumorkan Mengalami Penundaan dan Baru Akan Dimulai di Tahun 2017,“Attack on Titan” Dirumorkan Mengalami Penundaan dan Baru Akan Dimulai di Tahun 2017 – Forum Anime,14,84,98,314,1930,1616
6653371,,http://www.japanifo.com/2016/05/cerita-baru-dragon-ball-super-future-trunks-arc-dan-black-goku.html,http://www.japanifo.com/2016/05/cerita-baru-dragon-ball-super-future-trunks-arc-dan-black-goku.html,"Cerita Baru Dragon Ball Super, Future Trunks Arc dan Black Goku, Diumumkan Tayang Mulai Juni 2016","Cerita Baru Dragon Ball Super, Future Trunks Arc dan Black Goku, Diumumkan Tayang Mulai Juni 2016 | Berita Anime Jepang Terbaru",30,97,127,78,1154,1228
6663923,,http://www.solusiproperti.com/propertindo/housing/artikel/gula-untuk-membersihkan-rumah,,Gula Untuk Membersihkan Rumah,SolusiProperti : Gula Untuk Membersihkan Rumah,17,29,46,414,2041,1627
6653475,,http://www.beritarealestate.com/2016/05/hadirkan-rumahmu-dengan-tanaman.html,http://www.beritarealestate.com/2016/05/hadirkan-rumahmu-dengan-tanaman.html,Hadirkan Tanaman di Rumahmu,Berita Real Estate: Hadirkan Tanaman di Rumahmu,20,27,47,46,1324,1278
6653499,,http://mpi-update.com/kevin-pudjiadi-generasi-ke-3-pewaris-pudjiadi-group/,http://mpi-update.com/kevin-pudjiadi-generasi-ke-3-pewaris-pudjiadi-group/,"Kevin Pudjiadi, Generasi ke 3 Pewaris Pudjiadi Group","Properti Indonesia | Kevin Pudjiadi, Generasi ke 3 Pewaris Pudjiadi Group",21,52,73,18,3610,3592
6666034,,http://kriminalitas.com/ahok-dan-dian-sastro-wefie-netizen-heboh-bikin-meme/,http://kriminalitas.com/ahok-dan-dian-sastro-wefie-netizen-heboh-bikin-meme/,"Ahok dan Dian Sastro “Wefie”, Netizen Heboh Bikin Meme","Ahok dan Dian Sastro ""Wefie"", Netizen Heboh Bikin Meme",2,54,54,441,1625,1967
7565249,,http://www.rumah.com/berita-properti/2016/7/130909/hotel-tanpa-atap-dan-dinding-ini-terletak-di-kaki-gunung,http://www.rumah.com/berita-properti/2016/7/130909/hotel-tanpa-atap-dan-dinding-ini-terletak-di-kaki-gunung,Unik! Hotel Minimalis Ini Tak Punya Atap dan Dinding,Unik! Hotel Minimalis Ini Tak Punya Atap dan Dinding | Mancanegara,14,52,66,1,1856,1857
6706944,,http://remaja.suaramerdeka.com/2016/05/12/alamak-logo-instagram-berubah/,http://remaja.suaramerdeka.com/2016/05/12/alamak-logo-instagram-berubah/,Alamak! Logo Instagram Berubah,EKSPRESI SUARA REMAJA |Alamak! Logo Instagram Berubah,23,30,53,187,1791,1974
6707022,,http://berita.suaramerdeka.com/entertainment/neverland-menumpang-a-i-r/,,Neverland Menumpang A.I.R.,Neverland Menumpang A.I.R. | Entertainment SuaraMerdeka dot com,37,26,63,0,1874,1874
6707049,,http://remaja.suaramerdeka.com/2016/05/12/meskipun-saingan-tiffany-jessica-sewa-backup-dancer-yang-sama/,http://remaja.suaramerdeka.com/2016/05/12/meskipun-saingan-tiffany-jessica-sewa-backup-dancer-yang-sama/,"Meskipun Saingan, Tiffany & Jessica Sewa Backup Dancer Yang Sama?","EKSPRESI SUARA REMAJA |Meskipun Saingan, Tiffany & Jessica Sewa Backup Dancer Yang Sama?",23,65,88,189,2051,2233
6707293,,http://remaja.suaramerdeka.com/2016/05/07/93464/,http://remaja.suaramerdeka.com/2016/05/07/93464/,"Irwan Bajang, Pemilik Jawaban Dari Keresahan Penulis Muda","EKSPRESI SUARA REMAJA |Irwan Bajang, Pemilik Jawaban Dari Keresahan Penulis Muda",23,57,80,394,9216,9304
6936492,,http://remaja.suaramerdeka.com/2016/06/04/nongkrong-yummy-cuma-di-tomodachi-sushi/,http://remaja.suaramerdeka.com/2016/06/04/nongkrong-yummy-cuma-di-tomodachi-sushi/,Nongkrong Yummy? Cuma di Tomodachi Sushi!,EKSPRESI SUARA REMAJA |Nongkrong Yummy? Cuma di Tomodachi Sushi!,23,41,64,274,2098,2351
6707324,,http://remaja.suaramerdeka.com/2016/05/13/make-over-dress-up-for-prom-night/,http://remaja.suaramerdeka.com/2016/05/13/make-over-dress-up-for-prom-night/,Make Over: Dress Up For Prom Night,EKSPRESI SUARA REMAJA |Make Over: Dress Up For Prom Night,23,34,57,357,3896,4181
6707345,,http://remaja.suaramerdeka.com/2016/05/16/beauty-tips-awet-muda-ala-suzzy-miss-a/,http://remaja.suaramerdeka.com/2016/05/16/beauty-tips-awet-muda-ala-suzzy-miss-a/,Beauty Tips: Awet Muda ala Suzzy Miss A,EKSPRESI SUARA REMAJA |Beauty Tips: Awet Muda ala Suzzy Miss A,23,39,62,199,1519,1714
6707383,,http://remaja.suaramerdeka.com/2016/05/12/4-hal-yang-dilakukan-cowok-saat-berhasil-nembak-cewek/,http://remaja.suaramerdeka.com/2016/05/12/4-hal-yang-dilakukan-cowok-saat-berhasil-nembak-cewek/,4 Hal yang Dilakukan Cowok Saat Berhasil Nembak Cewek,EKSPRESI SUARA REMAJA |4 Hal yang Dilakukan Cowok Saat Berhasil Nembak Cewek,23,53,76,285,1918,2042
6707393,,http://remaja.suaramerdeka.com/2016/05/13/sma-methodist-2-medan-tingkatkan-kecerdasan-otak-lewat-ekskul-catur/,http://remaja.suaramerdeka.com/2016/05/13/sma-methodist-2-medan-tingkatkan-kecerdasan-otak-lewat-ekskul-catur/,SMA Methodist 2 Medan Tingkatkan Kecerdasan Otak Lewat Ekskul Catur,EKSPRESI SUARA REMAJA |SMA Methodist 2 Medan Tingkatkan Kecerdasan Otak Lewat Ekskul Catur,23,67,90,155,1235,1375
7432619,,http://remaja.suaramerdeka.com/2016/07/12/pokemon-go-game-baru-yang-bikin-heboh/,http://remaja.suaramerdeka.com/2016/07/12/pokemon-go-game-baru-yang-bikin-heboh/,"Pokemon Go, Game Baru yang Bikin Heboh","EKSPRESI SUARA REMAJA |Pokemon Go, Game Baru yang Bikin Heboh",23,38,61,206,1606,1727
6716432,,http://www.lingkunganhidup.co/jenis-tanaman-langka-unik-dunia/,http://www.lingkunganhidup.co/jenis-tanaman-langka-unik-dunia/,Jenis Tanaman Langka dan Unik di Dunia,10 Jenis Tanaman Langka dan Unik di Dunia,3,38,41,814,7272,6756
6729814,,http://otomotif.antaranews.com/news/1463607187/toyota-direspon-positif-pasar-mobil-indonesia,,Toyota direspon positif pasar mobil Indonesia,Toyota Sienta direspon positif pasar mobil Indonesia,7,45,52,511,2803,3239
6763670,,http://www.timlo.net/baca/68719670130/banyuwangi-kembangkan-desa-wisata-taman-sari/,http://www.timlo.net/baca/68719670130/banyuwangi-kembangkan-desa-wisata-taman-sari/,Banyuwangi Kembangkan Desa Wisata Taman Sari,Banyuwangi Kembangkan Desa Wisata Taman Sari » Timlo.Net,12,44,56,79,1410,1331
6764149,,http://www.timlo.net/baca/68719670143/underwater-festival-manjakan-penyelam-bawah-laut/,http://www.timlo.net/baca/68719670143/underwater-festival-manjakan-penyelam-bawah-laut/,"Underwater Festival, Manjakan Penyelam Bawah Laut","Underwater Festival, Manjakan Penyelam Bawah Laut » Timlo.Net",12,49,61,48,1826,1778
6744775,,http://www.timlo.net/baca/68719669922/pilgub-dki-golkar-dukung-ahok/,http://www.timlo.net/baca/68719669922/pilgub-dki-golkar-dukung-ahok/,"Pilgub DKI, Golkar Dukung Ahok?","Pilgub DKI, Golkar Dukung Ahok? » Timlo.Net",12,31,43,118,1793,1675
6886466,,http://www.timlo.net/baca/68719671483/tiga-buku-kuliner-indonesia-masuk-nominasi-gourmand-world-cookbook-awards-2016/,http://www.timlo.net/baca/68719671483/tiga-buku-kuliner-indonesia-masuk-nominasi-gourmand-world-cookbook-awards-2016/,Tiga Buku Kuliner Indonesia Masuk Nominasi Gourmand World Cookbook Awards 2016,Tiga Buku Kuliner Indonesia Masuk Nominasi Gourmand World Cookbook Awards 2016 » Timlo.Net,12,78,90,59,2318,2259
6777858,,http://www.timlo.net/baca/68719670301/jokowi-beri-semangat-pengusaha-muda/,http://www.timlo.net/baca/68719670301/jokowi-beri-semangat-pengusaha-muda/,Jokowi Beri Semangat Pengusaha Muda,Jokowi Beri Semangat Pengusaha Muda » Timlo.Net,12,35,47,63,1607,1544
6742957,,http://www.timlo.net/baca/68719669911/joey-alexander-berharap-bisa-bekerjasama-dengan-musisi-top/,http://www.timlo.net/baca/68719669911/joey-alexander-berharap-bisa-bekerjasama-dengan-musisi-top/,Joey Alexander Berharap Bisa Bekerjasama dengan Musisi Top,Joey Alexander Berharap Bisa Bekerjasama dengan Musisi Top » Timlo.Net,12,58,70,86,1513,1427
8436587,,http://www.timlo.net/baca/68719684597/twitter-dituntut-oleh-pemegang-saham-karena-gagal-penuhi-janji/,http://www.timlo.net/baca/68719684597/twitter-dituntut-oleh-pemegang-saham-karena-gagal-penuhi-janji/,Twitter Dituntut Oleh Pemegang Saham Karena Gagal Penuhi Janji,Twitter Dituntut Oleh Pemegang Saham Karena Gagal Penuhi Janji » Timlo.Net,12,62,74,60,1042,982
6771098,,http://www.timlo.net/baca/68719670207/mbah-katob-email-teknik-pemasaran-online-lawas-nan-ampuh/,http://www.timlo.net/baca/68719670207/mbah-katob-email-teknik-pemasaran-online-lawas-nan-ampuh/,"Mbah Katob: Email, Teknik Pemasaran Online Lawas nan Ampuh","Mbah Katob: Email, Teknik Pemasaran Online Lawas nan Ampuh » Timlo.Net",12,58,70,59,1432,1373
6773861,,http://www.timlo.net/baca/68719670237/taylor-swift-campakkan-pacarnya-demi-pemeran-loki/,http://www.timlo.net/baca/68719670237/taylor-swift-campakkan-pacarnya-demi-pemeran-loki/,Taylor Swift Campakkan Pacarnya Demi Pemeran Loki?,Taylor Swift Campakkan Pacarnya Demi Pemeran Loki? » Timlo.Net,12,50,62,99,1406,1307
6734267,,http://www.timlo.net/baca/68719669671/sibuk-sms-an-di-malam-pertama-wanita-ini-dicerai-suaminya/,http://www.timlo.net/baca/68719669671/sibuk-sms-an-di-malam-pertama-wanita-ini-dicerai-suaminya/,"Sibuk SMS-an di Malam Pertama, Wanita Ini Dicerai Suaminya","Sibuk SMS-an di Malam Pertama, Wanita Ini Dicerai Suaminya » Timlo.Net",12,58,70,64,1472,1408
6736398,,http://www.timlo.net/baca/68719669844/waspada-komplotan-pencuri-siang-hari-gentayangan/,http://www.timlo.net/baca/68719669844/waspada-komplotan-pencuri-siang-hari-gentayangan/,Waspada! Komplotan Pencuri Siang Hari Gentayangan,Waspada! Komplotan Pencuri Siang Hari Gentayangan » Timlo.Net,12,49,61,97,1442,1345
6734315,,http://www.timlo.net/baca/68719669667/sehari-polres-karanganyar-gelar-lima-kali-razia/,http://www.timlo.net/baca/68719669667/sehari-polres-karanganyar-gelar-lima-kali-razia/,"Sehari, Polres Karanganyar Gelar Lima Kali Razia","Sehari, Polres Karanganyar Gelar Lima Kali Razia » Timlo.Net",12,48,60,87,1362,1275
6734323,,http://www.timlo.net/baca/68719669514/petugas-kebersihan-bingung-buang-sampah/,http://www.timlo.net/baca/68719669514/petugas-kebersihan-bingung-buang-sampah/,Petugas Kebersihan Bingung Buang Sampah,Petugas Kebersihan Bingung Buang Sampah » Timlo.Net,12,39,51,163,1795,1632
6758888,,http://www.timlo.net/baca/68719670078/bupati-yuni-tinggal-kebagian-dana-operasional-rp-23-juta/,http://www.timlo.net/baca/68719670078/bupati-yuni-tinggal-kebagian-dana-operasional-rp-23-juta/,Bupati Yuni Tinggal Kebagian Dana Operasional Rp 23 Juta,Bupati Yuni Tinggal Kebagian Dana Operasional Rp 23 Juta » Timlo.Net,12,56,68,110,1900,1790
