id,source_id,babe_url,lib_url,babe_title,lib_title,title_distance,babe_title_len,lib_title_len,content_distance,babe_content_len,lib_content_len
4549180,,http://tabloid-nakita.com/read/5620/semakin-berisik-bercinta-akan-semakin-bergairah?utm_source=babe&utm_medium=app&utm_campaign=share_content&utm_content=article,http://nakita.id/Dunia-Mama/Semakin-Berisik-Hubungan-Seks-Akan-Semakin-Menggairahkan,"Semakin Berisik, Bercinta Akan Semakin Bergairah?","Semakin Berisik, Hubungan Seks Akan Semakin Menggairahkan?",18,49,58,340,3304,3254
4535717,,http://indonesiamontessori.com/the-top-7-benefits-of-play-with-geometric-solid/,http://indonesiamontessori.com/manfaat-pengenalan-bangun-geometri/,The Top 7 Benefits of Play With Geometric Solid Spielgaben,Top 7 Manfaat Pengenalan Bangun Geometri – IndonesiaMontessori.Com – global education for Indonesian parents and children,95,58,121,1073,8629,9030
5389762,,http://nunikutami.com/ternyata-tidak-ada-sekolah-yang-bagus.html,http://nunikutami.com/ternyata-tidak-ada-sekolah-yang-bagus.html,"Ternyata, Tidak Ada Sekolah yang Bagus….","Ternyata, Tidak Ada Sekolah yang Bagus ….",1,40,41,68,4110,4048
5201507,,http://www.cantikanggun.com/kamu-suka-pakai-jeans-ini-dia-tips-memilih-jeans-yang-cocok-buat-kamu/,http://www.cantikanggun.com/kamu-suka-pakai-jeans-ini-dia-tips-memilih-jeans-yang-cocok-buat-kamu/,Kamu Suka Pakai Jeans? Ini Dia Tips Memilih Jeans Yang Cocok Buat Kamu,Ini Dia Tips Memilih Jeans Yang Cocok Buat Kamu,23,70,47,117,3440,3327
4549199,,http://www.propertinet.com/rumah/973-smarthome-sekarang-lebih-murah-hanya-15-juta.html,http://www.propertinet.com/rumah/973-smarthome-sekarang-lebih-murah-hanya-15-juta.html,"RUMAH : Smarthome Sekarang Lebih Murah, Hanya 15 Juta","Smarthome Sekarang Lebih Murah, Hanya 15 Juta",8,53,45,231,2552,2325
5675804,,http://ideaonline.co.id/iDEA2013/Tips-Trik/6-Hal-yang-Harus-Ada-di-Rumah-Jika-Ingin-Bahagia?utm_source=babe&utm_medium=app&utm_campaign=share_content&utm_content=article,http://www.ideaonline.co.id/iDEA2013/Tips-Trik/6-Hal-Ini-Bisa-Menambah-Suasana-Bahagia-di-Rumah,6 Hal yang Harus Ada di Rumah Jika Ingin Bahagia,6 Hal Ini Bisa Menambah Suasana Bahagia di Rumah,33,48,48,682,3107,3201
5202398,,http://www.sajiansedap.com/recipe/detail/23212/OTAK-OTAK-BALUT-TAHU/?utm_source=babe&utm_medium=app&utm_campaign=share_content&utm_content=recipe,http://sajiansedap.com/Masakan/Panggang/Otak-Otak-Balut-Tahu,OTAK-OTAK BALUT TAHU,Sajiansedap-OTAK-OTAK BALUT TAHU,12,20,32,916,1768,854
4627913,,http://www.sajiansedap.com/recipe/detail/22897/TORTILLA-CHESSY-UP/?utm_source=babe&utm_medium=app&utm_campaign=share_content&utm_content=recipe,http://sajiansedap.com/Kue/Roti-Pastry-Snack/Tortilla-Chessy-Up,TORTILLA CHESSY UP,Sajiansedap-TORTILLA CHESSY UP,12,18,30,703,901,217
5352459,,http://www.sajiansedap.com/article/detail/968/Mangga-Dari-Berbagai-Negara-Bagian-1/?utm_source=babe&utm_medium=app&utm_campaign=share_content&utm_content=article,http://sajiansedap.com/Tips/Mangga-Dari-Berbagai-Negara-Bagian-1,Mangga Dari Berbagai Negara (Bagian 1),Sajiansedap-Mangga Dari Berbagai Negara (Bagian 1),12,38,50,571,2637,2068
5370601,,http://www.sajiansedap.com/article/detail/976/Makanan-Khas-Imlek-dan-Fakta-Uniknya/?utm_source=babe&utm_medium=app&utm_campaign=share_content&utm_content=article,http://sajiansedap.com/Info/Makanan-Khas-Imlek-Dan-Fakta-Uniknya,Makanan Khas Imlek dan Fakta Uniknya,Sajiansedap-Makanan Khas Imlek dan Fakta Uniknya,12,36,48,325,5220,4899
5182544,,http://tabloid-nakita.com/read/2657/3-penyakit-yang-perlu-diwaspadai-saat-hamil-?utm_source=babe&utm_medium=app&utm_campaign=share_content&utm_content=article,http://nakita.id/Kehamilan/3-Penyakit-Yang-Perlu-Diwaspadai-Saat-Hamil,3 Penyakit yangPerlu Diwaspadai Saat Hamil,3 Penyakit yang Perlu Diwaspadai Saat Hamil,1,42,43,195,6159,5970
5193895,,http://www.kidnesia.com/Kidnesia2014/Indonesiaku/Teropong-Daerah/Kalimantan-Tengah/Flora/Tenggaring?utm_source=babe&utm_medium=app&utm_campaign=share_content&utm_content=article,http://kidnesia.com/Indonesiaku/Teropong-Daerah/Kalimantan-Tengah/Flora/Tenggaring-Tumbuhan-Khas-Kalimantan,Tenggaring,"Tenggaring, Tumbuhan Khas Kalimantan",26,10,36,209,942,737
4739546,,http://www.kidnesia.com/Kidnesia2014/Kidnesia-TV/Kidnesia/Kidnesia-Anak-Hebat-Dinda-Amanda-Pratiwi?utm_source=babe&utm_medium=app&utm_campaign=share_content&utm_content=article,http://kidnesia.com/Kidnesia-Tv/Kidnesia/Kidnesia-Anak-Hebat-Dinda-Amanda-Pratiwi,Kidnesia Anak Hebat - Dinda Amanda Pratiwi,Kidnesia Anak Hebat,23,42,19,43,275,232
5228683,,http://intisari-online.com/read/benarkah-minyak-kelapa-dapat-menjadi-pelumas?utm_source=babe&utm_medium=app&utm_campaign=share_content&utm_content=article,http://intisari-online.com/Wellness/Healthy-Sex/Benarkah-Minyak-Kelapa-Dapat-Menjadi-Pelumas,Benarkah Minyak Kelapa DapatMenjadi Pelumas?,Benarkah Minyak Kelapa Dapat Menjadi Pelumas?,1,44,45,230,1988,1764
5241830,,http://chip.co.id/news/accessories_peripheral-gadget/15729/5_produk_logitech_rebut_good_design_award?utm_source=babe&utm_medium=app&cc=share_content&utm_content=article,,5 Produk Logitech Rebut Good Design Award,Error,38,41,5,2005,2071,73
5358316,,http://www.kilasjambi.com/index.php/seputar-jambi/item/847-fauzi-ansori-resmi-jadi-penjabat-bupati-tanjabbar,,Fauzi Ansori Resmi Jadi Penjabat Bupati Tanjabbar,Account Suspended,42,49,17,3299,3347,51
5755386,,http://www.kilasjambi.com/index.php/nasional/item/918-satu-bangunan-di-kalijodo-ini-tidak-dirobohkan,,Satu Bangunan di Kalijodo ini Tidak Dirobohkan,Account Suspended,41,46,17,756,800,51
5650520,,http://www.kilasjambi.com/index.php/eropa-amerika/item/874-turki-minta-dukungan-amerika-serang-militan-kurdi,,Turki Minta Dukungan Amerika Serang Militan Kurdi,Account Suspended,42,49,17,946,992,51
5755897,,http://www.kilasjambi.com/index.php/ragam/item/919-rio-haryanto-mengaku-semakin-nyaman-dengan-manor-racing,,Rio Haryanto Mengaku Semakin Nyaman dengan Manor Racing,Account Suspended,47,55,17,1527,1574,51
4932906,,http://www.kilasjambi.com/index.php/ragam-video/item/138-10-rekor-manusia-tercepat-di-dunia-paling-keren,,10 Rekor Manusia Tercepat Di Dunia Paling Keren,Account Suspended,40,47,17,67,87,51
5217010,,http://www.wiuww.com/news/jadi-ini-toh-surat-ancaman-isis-untuk-indonesia,http://www.wiuww.com/news/jadi-ini-toh-surat-ancaman-isis-untuk-indonesia,Jadi ini Toh Surat Ancaman ISIS untuk Indonesia?,WiUWW,47,48,5,256,4508,4382
5178976,,http://www.wiuww.com/news/inilah-manusia-tertua-di-dunia-yang-sesungguhnya-lihat-deh-berapa-usianya,http://www.wiuww.com/news/inilah-manusia-tertua-di-dunia-yang-sesungguhnya-lihat-deh-berapa-usianya,"Inilah Manusia Tertua di Dunia yang Sesungguhnya, Lihat Deh Berapa Usianya",WiUWW,72,74,5,110,960,1008
5189575,,http://www.wiuww.com/videos/cat_film-pendek/buat-kamu-yang-hobi-film-perang-kamu-wajib-tonton-film-pendek-kartun-ini,http://www.wiuww.com/videos/cat_film-pendek/buat-kamu-yang-hobi-film-perang-kamu-wajib-tonton-film-pendek-kartun-ini,"Buat Kamu yang Hobi Film Perang, Kamu Wajib Tonton Film Pendek Kartun Ini",WiUWW,71,73,5,66,448,382
5217030,,http://www.wiuww.com/entertainment/begini-nih-jadinya-film-kalau-nggak-pakai-special-effects,http://www.wiuww.com/entertainment/begini-nih-jadinya-film-kalau-nggak-pakai-special-effects,Begini Nih Jadinya Film Kalau Nggak Pakai Special Effects,WiUWW,56,57,5,154,603,481
5704947,,http://mommee.org/belajar-manajemen-rumah-tangga/,http://mommee.org/belajar-manajemen-rumah-tangga/,Belajar Manajemen Rumah Tangga,Belajar Manajemen Rumah Tangga – MoMMee.org,13,30,43,19,3171,3154
5866810,,http://www.rumahku.com/berita/read/waduh-ternyata-feses-bisa-didonor-dan-dapat-bayaran-413209,http://www.rumahku.com/artikel/read/waduh-ternyata-feses-bisa-didonor-dan-dapat-bayaran-413209,"Waduh, Ternyata FesesBisa Didonor Dan Dapat Bayaran","Waduh, Ternyata Feses Bisa Didonor dan Dapat Bayaran",2,51,52,0,885,885
5678742,,http://www.rumahku.com/berita/read/uu-tapera-disahkan-gaji-pegawai-dipotong-3-persen-413107,http://www.rumahku.com/artikel/read/uu-tapera-disahkan-gaji-pegawai-dipotong-3-persen-413107,"UU Tapera Disahkan,Gaji Pegawai Dipotong 3 Persen","UU Tapera Disahkan, Gaji Pegawai Dipotong 3 Persen",1,49,50,1,1726,1727
5763115,,http://www.koran-jakarta.com/dpr-dan-mpr-dukung-tes-urine/,,DPR dan MPR Dukung Tes Urine,| Koran Jakarta,23,28,15,5495,5521,31
5758714,,http://www.koran-jakarta.com/kubu-rouhani-kian-mulus-raih-kemenangan/,,Kubu Rouhani Kian Mulus Raih Kemenangan,| Koran Jakarta,31,39,15,2765,2793,31
5758719,,http://www.koran-jakarta.com/bjb-2015-bukukan-laba-bersih-rp138-triliun/,,"BJB 2015 Bukukan Laba Bersih Rp1,38 Triliun",| Koran Jakarta,36,43,15,2366,2395,31
5650595,,http://www.koran-jakarta.com/pengembang-agresif-garap-properti-komersial/,,Pengembang Agresif Garap Properti Komersial,| Koran Jakarta,35,43,15,2644,2671,31
5758725,,http://www.koran-jakarta.com/layanan-jaringan-fiber-hingga-quadplay/,,Layanan Jaringan Fiber Hingga Quadplay,| Koran Jakarta,30,38,15,6761,6790,31
5678771,,http://www.koran-jakarta.com/suv-bongsor-juga-bisa-ngebut/,,SUV Bongsor Juga Bisa Ngebut,| Koran Jakarta,22,28,15,6821,6850,31
5759818,,http://www.koran-jakarta.com/kado-perpisahan-pellegrini/,,Kado Perpisahan Pellegrini,| Koran Jakarta,20,26,15,4118,4146,31
5763960,,http://www.koran-jakarta.com/tangerang-expo-4-ajang-mempromosikan-produk-ukm/,,Tangerang Expo-4 Ajang Mempromosikan Produk UKM,| Koran Jakarta,39,47,15,1136,1164,31
5700891,,http://kabarkota.com/bisnis/aji-yogya-anggap-tempo-tak-demokratis,https://kabarkota.com/aji-yogya-anggap-tempo-tak-demokratis/,AJI Yogya Anggap Tempo tak Demokratis,AJI Yogya Anggap Tempo tak Demokratis – Kabarkota.com,16,37,53,23,1752,1731
5366192,,http://kabarkota.com/jalan-jalan/berwisata-sembari-uji-nyali-di-pantai-timang-gunung-kidul-2,https://kabarkota.com/berwisata-sembari-uji-nyali-di-pantai-timang-gunung-kidul-2/,Berwisata sembari Uji Nyali di Pantai Timang Gunung Kidul,Berwisata sembari Uji Nyali di Pantai Timang Gunung Kidul – Kabarkota.com,16,57,73,1,2203,2204
5366199,,http://kabarkota.com/pendidikan/dunia-akademik-dilanda-krisis-demokrasi,https://kabarkota.com/dunia-akademik-dilanda-krisis-demokrasi/,Dunia Akademik Dilanda Krisis Demokrasi,Dunia Akademik Dilanda Krisis Demokrasi – Kabarkota.com,16,39,55,23,2400,2379
5366204,,http://kabarkota.com/gaya-hidup/polri-dan-kemenkominfo-akan-patroli-media-online-dan-sosial,https://kabarkota.com/polri-dan-kemenkominfo-akan-patroli-media-online-dan-sosial/,Polri dan Kemenkominfo akan Patroli Media Online dan Sosial,Polri dan Kemenkominfo akan Patroli Media Online dan Sosial – Kabarkota.com,16,59,75,24,1106,1084
5701170,,http://unimal.ac.id/137-mubes-perdana-himpunan-mahasiswa-matematika-fkip-universitas-malikussaleh,,MUBES PERDANA HIMPUNAN MAHASISWA MATEMATIKA FKIP UNIVERSITAS MALIKUSSALEH,Mubes Himpunan Mahasiswa Matematika FKIP Universitas Malikussaleh,57,73,65,2,1819,1821
5766117,,http://www.ui.ac.id/berita/semarak-ui-open-days-2016.html,http://www.ui.ac.id/berita/semarak-ui-open-days-2016.html/,Semarak UI Open Days 2016,Semarak UI Open Days 2016 Universitas Indonesia,22,25,47,22,1792,1776
5766409,,http://berita.upi.edu/?p=8430,http://berita.upi.edu/?p=8430,Muhamad Ali Sodikin Ketua Umum KSR PMI UPI Terpilih,Muhamad Ali Sodikin Ketua Umum KSR PMI UPI Terpilih – Kabar UPI,12,51,63,15,2360,2349
5755607,,http://unri.ac.id/ur-sediakan-anggaran-25-milyar-rupiah-untuk-pengembangan-akreditasi-program-studi/,http://unri.ac.id/2016/02/29/ur-sediakan-anggaran-25-milyar-rupiah-untuk-pengembangan-akreditasi-program-studi/,"UR Sediakan Anggaran 2,5 Milyar Rupiah untuk Pengembangan Akreditasi Program Studi","UR Sediakan Anggaran 2,5 Milyar Rupiah untuk Pengembangan Akreditasi Program Studi – Universitas Riau",19,82,101,83,3206,3123
5424251,,http://www.unsri.ac.id/?act=pengumuman_detil&id=732,,Pengumuman Beasiswa Pemerintah Taiwan Program Master S2 dan Program Doktoral S3 (NEW),.:: Detil Pengumuman | Universitas Sriwijaya,68,85,44,299,1056,757
5768464,,http://www.itera.ac.id/ayoo-ikuti-workshop-pengamatan-gerhana-matahari/,http://www.itera.ac.id/ayoo-ikuti-workshop-pengamatan-gerhana-matahari/,ITERA Gelar Workshop Pengamatan Gerhana Matahari,INSTITUT TEKNOLOGI SUMATERAITERA Gelar Workshop Pengamatan Gerhana Matahari,27,48,75,0,790,790
6617292,,http://www.kuliahan.com/2016/05/pendaftaran-sbmptn-bidik-misi-gratis.html,http://www.kuliahan.com/2016/05/pendaftaran-sbmptn-bidik-misi-gratis.html,Pendaftaran SBMPTN Bidik Misi Gratis 2016,Pendaftaran SBMPTN Bidik Misi Gratis 2017-2018,6,41,46,7,6108,6112
5747388,,http://prasetya.ub.ac.id/berita/Kompas---UB-Bicara-Kilau-Properti-Malang-Raya-18040-id.html,,Kompas - UB Bicara Kilau Properti Malang Raya,Prasetya Online : Kompas-UB Bicara Kilau Properti Malang Raya,20,45,61,215,2298,2137
5428194,,http://mediajakarta.com/bermain-seru-sembari-belajar-lingkungan-di-festival-iklim/,http://mediajakarta.com/bermain-seru-sembari-belajar-lingkungan-di-festival-iklim/,Bermain seru sembari belajar lingkungan di Festival Iklim,Bermain seru sembari belajar lingkungan di Festival Iklim – Mediajakarta.com,19,57,76,49,2733,2684
5428202,,http://mediajakarta.com/yusril-siap-head-to-head-di-pilkada-dki-jakarta/,http://mediajakarta.com/yusril-siap-head-to-head-di-pilkada-dki-jakarta/,Yusril siap head to head di Pilkada DKI Jakarta,Yusril siap head to head di Pilkada DKI Jakarta – Mediajakarta.com,19,47,66,1537,1594,68
5740530,,http://mediajakarta.com/koboi-ahok-dan-pembangunan-jakarta-khas-kolonial/,http://mediajakarta.com/koboi-ahok-dan-pembangunan-jakarta-khas-kolonial/,Koboi Ahok dan Pembangunan Jakarta Khas Kolonial,Koboi Ahok dan Pembangunan Jakarta Khas Kolonial – Mediajakarta.com,19,48,67,217,6999,6790
5702070,,http://mediajakarta.com/australia-diminta-hengkang-dari-laut-timor/,http://mediajakarta.com/australia-diminta-hengkang-dari-laut-timor/,Australia diminta hengkang dari Laut Timor,Australia diminta hengkang dari Laut Timor – Mediajakarta.com,19,42,61,109,3983,3878
5679892,,http://mediajakarta.com/ini-penilaian-hidayat-nur-wahid-tentang-orang-betawi/,http://mediajakarta.com/ini-penilaian-hidayat-nur-wahid-tentang-orang-betawi/,Ini penilaian Hidayat Nur Wahid tentang orang Betawi  ,Ini penilaian Hidayat Nur Wahid tentang orang Betawi   – Mediajakarta.com,19,54,73,1373,1455,99
5429236,,http://mediajakarta.com/ini-nomor-telepon-penting-saat-banjir/,http://mediajakarta.com/ini-nomor-telepon-penting-saat-banjir/,Ini Nomor Telepon Penting Saat banjir,Ini Nomor Telepon Penting Saat banjir – Mediajakarta.com,19,37,56,1051,1252,315
5429240,,http://mediajakarta.com/air-di-kampung-pulo-lampaui-permukaan/,http://mediajakarta.com/air-di-kampung-pulo-lampaui-permukaan/,Air di Kampung Pulo Lampaui Permukaan Jalan Raya Jatinegara,Air di Kampung Pulo Lampaui Permukaan Jalan Raya Jatinegara – Mediajakarta.com,19,59,78,80,508,428
5429245,,http://mediajakarta.com/norwegia-siap-support-indonesia-dalam-pengendalian-iklim/,http://mediajakarta.com/norwegia-siap-support-indonesia-dalam-pengendalian-iklim/,Norwegia siap support Indonesia dalam pengendalian iklim,Norwegia siap support Indonesia dalam pengendalian iklim – Mediajakarta.com,19,56,75,1573,1655,96
5690757,,http://mediajakarta.com/tersandung-kasus-korupsi-pengadaan-ups-ahok-dicecer-20-pertanyaan/,http://mediajakarta.com/tersandung-kasus-korupsi-pengadaan-ups-ahok-dicecer-20-pertanyaan/,"Tersandung kasus korupsi pengadaan UPS, Ahok  dicecer 20 pertanyaan","Tersandung kasus korupsi pengadaan UPS, Ahok dicecer 20 pertanyaan – Mediajakarta.com",20,67,85,135,1475,1352
5727217,,http://mediajakarta.com/satwa-dilindungi-dijual-bebas-pemerintah-diminta-tutup-pasar-satwa-liar/,http://mediajakarta.com/satwa-dilindungi-dijual-bebas-pemerintah-diminta-tutup-pasar-satwa-liar/,"Satwa dilindungi dijual bebas, Pemerintah diminta tutup Pasar Satwa Liar","Satwa dilindungi dijual bebas, Pemerintah diminta tutup Pasar Satwa Liar – Mediajakarta.com",19,72,91,72,2751,2687
5487147,,http://www.thehungrydoctor.net/2016/01/menjadi-generaksisehatindonesia-dengan.html,http://www.thehungrydoctor.net/2016/01/menjadi-generaksisehatindonesia-dengan.html,Menjadi #generAKSISEHATIndonesia dengan Makan Sehat,The Hungry Doctor : Indonesian Food and Travel Blogger based in Jakarta: Menjadi #generAKSISEHATIndonesia dengan Makan Sehat,73,51,124,142,3544,3410
5764231,,http://lifestyle.okezone.com/read/2016/02/29/298/1324165/makan-murah-tapi-enak-di-kawasan-elit-mega-kuningan,http://lifestyle.okezone.com/read/2016/02/29/298/1324165/makan-murah-tapi-enak-di-kawasan-elit-mega-kuningan,Makan Murah Tapi Enak di Kawasan Elit Mega Kuningan,Makan Murah Tapi Enak di Kawasan Elit Mega Kuningan : Okezone Lifestyle,20,51,71,6,551,545
6288683,,https://foodcious.com/2016/04/05/steak-bumbu-bali-ala-joni-geboy/,https://foodcious.com/2016/04/05/steak-bumbu-bali-ala-joni-geboy/,Steak Bumbu Bali ala Joni Geboy,Steak Bumbu Bali ala Joni Geboy – Foodcious,12,31,43,73,2003,1986
5699377,,http://makanmana.net/2016/02/23/jw-marriot-medan-hello-gathering/,https://makanmana.net/2016/02/23/jw-marriot-medan-hello-gathering/,JW Marriott ‘Hello Gathering’,JW Marriott ‘Hello Gathering’ – Makanmana,12,29,41,177,1488,1313
5680034,,http://mozaic.co.id/female/5-blogger-dan-selebgram-ini-juga-kena-demam-atasan-kimono/,http://mozaic.co.id/female/5-blogger-dan-selebgram-ini-juga-kena-demam-atasan-kimono/,5 Blogger dan Selebgram Ini Juga Kena Demam Atasan Kimono,5 Blogger dan Selebgram Ini Juga Kena Demam Atasan Kimono • Mozaic : Mozaic,18,57,75,311,2765,3071
5700249,,http://resourceful-parenting.blogspot.com/2016/02/kisah-ayam-dan-bebek.html,http://resourceful-parenting.blogspot.com/2016/02/kisah-ayam-dan-bebek.html,Kisah Ayam dan Bebek,Resourceful-Parenting: Kisah Ayam dan Bebek,23,20,43,251,1698,1803
5680075,,http://www.toothsie.com/8-cara-mengatasi-cegukan-pada-bayi/,http://www.toothsie.com/8-cara-mengatasi-cegukan-pada-bayi/,8 Cara Mengatasi Cegukan pada Bayi,Toothsie | Transforming Indonesian's Children | Mom's Diary,46,34,59,30,2251,2223
5710875,,http://www.katalogibu.com/kesehatan/waspadai-kenali-gejala-penyakit-tipus-pada-anak.html,http://www.katalogibu.com/kesehatan/waspadai-kenali-gejala-penyakit-tipus-pada-anak.html,Waspadai & Kenali Gejala Penyakit Tipus Pada Anak!,Kenali Gejala Penyakit Tipus Pada Anak,12,50,38,1696,3505,1815
5522429,,http://ibudanmama.com/kehamilan/memilih-nama-untuk-si-kecil-sebaiknya-dilakukan-kapan/,http://ibudanmama.com/kehamilan/memilih-nama-untuk-si-kecil-sebaiknya-dilakukan-kapan/,Memilih Nama untuk Si Kecil Sebaiknya Dilakukan Kapan?,Memilih Nama Bayi Sebaiknya Kapan?,23,54,34,108,2707,2601
5853890,,http://www.idntimes.com/rizal/georges-perec-penulis-handal-yang-diabadikan-sebagai-nama-asteroid,https://news.idntimes.com/world/rizal/georges-perec-penulis-handal-yang-diabadikan-sebagai-nama-asteroid,"Georges Perec, Penulis Handal yangDiabadikan Sebagai Nama Asteroid","Georges Perec, Penulis Handal yang Diabadikan Sebagai Nama Asteroid",1,66,67,1122,3839,2721
5997950,,http://www.idntimes.com/tita/ingat-anjali-kuch-kuch-hota-hai-ini-fakta-kajol-sekarang-yang-belum-kamu-tahu,https://hype.idntimes.com/entertainment/tita/ingat-anjali-kuch-kuch-hota-hai-ini-fakta-kajol-sekarang-yang-belum-kamu-tahu,"Ingat Anjali ""Kuch Kuch Hota Hai""? Ini Fakta Kajol Sekarang yang Belum Kamu Tahu!","Ingat Anjali ""Kuch Kuch Hota Hai""? Simak 12 Fakta Menarik dari Perempuan Cantik Ini!",35,81,84,1982,2624,695
5747393,,http://www.idntimes.com/azmi/kamu-bisa-langsing-tanpa-lapar-dengan-10-menu-sarapan-simpel-dan-lezat-ini,https://food.idntimes.com/dining-guide/azmi/kamu-bisa-langsing-tanpa-lapar-dengan-10-menu-sarapan-simpel-dan-lezat-ini,Kamu Bisa Langsing Tanpa Kelaparan dengan 10 Menu Sarapan Simpel dan Lezat Ini!,Sarapan Sederhana Ini Bisa Membuatmu Turun 5 Kilo dalam 1 Bulan,60,79,63,720,4271,3561
5685183,,http://www.applenesian.com/2016/02/ios-9-3-beta-4-hadirkan-perbaikan-bug-tanggal-1-januari-1970.html,http://www.applenesian.com/2016/02/ios-9-3-beta-4-hadirkan-perbaikan-bug-tanggal-1-januari-1970.html,iOS 9.3 Beta 4 Hadirkan Perbaikan Bug Tanggal'1 Januari 1970',iOS 9.3 Beta 4 Hadirkan Perbaikan Bug Tanggal '1 Januari 1970',1,61,62,1,1851,1852
5680262,,http://encyclo.co.id/blog/Promo-Fashion-Februari-Hi-Ladies-Diskon-Seru-Hingga-70/,,Promo Fashion Februari : Hi Ladies! Diskon Seru Hingga 70%,Blog,56,58,4,17,1094,1083
5765574,,http://behijab.com/blog/jenis-jenis-jilab-yang-paling-booming/,,Jenis – Jenis Jilab Yang Paling Booming,Jenis – Jenis Jilbab Yang Paling Booming – Blog Behijab,16,39,55,708,3152,3245
5766120,,http://blog.hadiah.me/pilihan-ide-outfit-liburan-di-pantai/,https://www.hadiah.me/blog/pilihan-ide-outfit-liburan-di-pantai/,Pilihan Ide Outfit Liburan di Pantai,Ide Outfit Liburan di Pantai,8,36,28,2,1378,1380
5680284,,http://blog.hadiah.me/resep-soto-madura-mudah-dan-enak/,https://www.hadiah.me/blog/resep-soto-madura-mudah-dan-enak/,Resep Soto Madura Mudah dan Enak,Resep Soto Madura Enak dan Nikmat,9,32,33,1223,2103,882
5752604,,https://chromplex.com/sekarang-proyek-web-super-cepat-google-diaktifkan-untuk-semua-situs-wordpress/,,Sekarang Proyek WebSuper Cepat Google Diaktifkan untuk Semua Situs WordPress,Sekarang Proyek Web Super Cepat Google Diaktifkan untuk Semua Situs WordPress,1,76,77,241,1413,1177
5770370,,http://id.theasianparent.com/5-alasan-berkarir-dapat-membuat-kita-jadi-orangtua-yang-lebih-baik/,https://id.theasianparent.com/5-alasan-berkarir-dapat-membuat-kita-jadi-orangtua-yang-lebih-baik/,5 Alasan Mengapa Pekerjaan Membuat Kita Jadi Orangtua yang Lebih Baik,5 Alasan Karir Menjadikan Kita Orangtua yang Lebih Baik,25,69,55,2992,3362,370
5776010,,http://www.unj.ac.id/halaman/informasi/detail_berita_164,,DISKUSI REVITALISASI KELEMBAGAAN ALPTKI,Detail Berita,36,39,13,256,1676,1932
5776062,,http://www.upnvj.ac.id/id/berita/2016/01/pelantikan-dan-sertijab-dekan-fakultas-ekonomi-dan-bisnis-upn-veteran-jakarta.html,,"PELANTIKAN DAN SERTIJAB DEKAN FAKULTAS EKONOMI DAN BISNIS UPN ""VETERAN"" JAKARTA","PELANTIKAN DAN SERTIJAB DEKAN FAKULTAS EKONOMI DAN BISNIS UPN ""VETERAN"" JAKARTA - UPN Veteran Jakarta",22,79,101,3,1266,1265
6641849,,http://www.ugm.ac.id/id/berita/11627-mahasiswa.ugm.juara.2.kompetisi.rsm.star.case.di.belanda,http://www.ugm.ac.id/id/berita/11627-mahasiswa.ugm.juara.2.kompetisi.rsm.star.case.di.belanda,Mahasiswa UGM Juara 2 Kompetisi RSM STAR Case di Belanda,Universitas Gadjah Mada: Mahasiswa UGM Juara 2 Kompetisi RSM STAR Case di Belanda,25,56,81,61,3728,3667
6656503,,http://www.uinsgd.ac.id/front/detail/berita/motif-utama-konflik-itu-kekuasaan,,Motif Utama Konflik itu Kekuasaan,WELCOME TO UIN SUNAN GUNUNG DJATI BANDUNG,37,33,41,86,3621,3545
6632296,,http://binus.ac.id/2016/05/global-compact-network-indonesia-sambangi-binus-university-2/,,Global Compact Network Indonesia Sambangi BINUS UN...,Global Compact Network Indonesia Sambangi BINUS UNIVERSITY,8,53,58,87,1689,1602
5776281,,http://www.trisakti.ac.id/?page=news&ID=4941,http://trisakti.ac.id/,Tim Mahasiswa Teknik Perminyakan FTKE Universitas Trisakti Raih 4 Medali di ITB,Beranda Website,69,79,15,1143,1396,450
5776307,,http://www.ubb.ac.id/content/ubb-sabet-1-emas-dan-3-perunggu-di-ismc-x,http://ubb.ac.id/,UBB Sabet 1 Emas dan 3 Perunggu di ISMC X,Universitas Bangka Belitung,32,41,27,769,1026,594
5781555,,http://indonesianfoodblogger.com/post/page/3249.html,,Blogpost(s) of The Month : March 2015,IDFoodBlogger,33,37,13,970,1238,1023
6326347,,http://www.aura.co.id/recipes/food/359-resep-kering-bihun-pangsit,http://www.aura.co.id/recipes/food/359-resep-kering-bihun-pangsit,Resep Kering Bihun Pangsit,"Aura Online: Media Wanita, Kaya Informasi, Sarat Informasi",47,26,58,58,743,685
5781562,,http://www.herworld.co.id/article/2016/2/3942-Kesalahan-Membuat-Teh-yang-Mungkin-Anda-Lakukan,http://www.herworld.co.id,Kesalahan Membuat Teh yang…,Kesalahan Membuat Teh yang Mungkin Anda Lakukan,21,27,47,148,2208,2064
6699368,,http://www.cosmopolitan.co.id/article/read/5/2016/10133/beraksi-dengan-tas-rumbai,,Beraksi Dengan Tas Rumbai,COSMOPOLITAN INDONESIA,24,25,22,429,485,74
5785123,,http://www.cosmopolitan.co.id/article/read/2/2016/9778/tipe-outerwear-untuk-musim-hujan,,Tipe Outerwear Untuk Musim Hujan,COSMOPOLITAN INDONESIA,30,32,22,1039,1106,74
5785135,,http://www.cosmopolitan.co.id/article/read/3/2016/9791/trend-motif-garis-saat-ini,,Trend Motif Garis Saat Ini,COSMOPOLITAN INDONESIA,24,26,22,1934,2006,74
6326399,,http://www.kawankumagz.com/Fashion,http://www.cewekbanget.id/Fashion-And-Beauty,16 Inspirasi Legging Dengan Lukisan Hand-Made Bikin Kita Makin Gaya,Fashion & Beauty,58,67,16,573,696,197
6588016,,http://www.harpersbazaar.co.id/articles/read/5/2016/2414/6-Pilihan-Gaya-Busana-Saat-Berlibur,http://www.harpersbazaar.co.id/articles/read/5/2016/2414/6-Pilihan-Gaya-Busana-Saat-Berlibur,6 PILIHAN GAYA BUSANA SAAT BERLIBUR,6 Pilihan Gaya Busana Saat Berlibur,24,35,35,0,694,694
6604618,,http://surabayastyle.com/kritik-pembelenggu-pers-dengan-aksi-teatrikal/,http://surabayastyle.com/kritik-pembelenggu-pers-dengan-aksi-teatrikal/,Kritik Pembelenggu Pers Dengan Aksi Teatrikal,Kritik Pembelenggu Pers Dengan Aksi Teatrikal – Surabaya Style,17,45,62,88,1805,1717
5852630,,http://purwokertokita.com/rehat/ngaji-jumat-begini-tips-antisipasi-lgbt.html,http://purwokertokita.com/rehat/ngaji-jumat-begini-tips-antisipasi-lgbt.html,Ngaji Jumat : Begini Tips Antisipasi LGBT…,Ngaji Jumat : Begini Tips Antisipasi LGBT,1,42,41,258,2915,2663
5935784,,http://purwokertokita.com/ragam/ini-besaran-kenaikan-iuran-bpjs-mulai-1-april-2016.html,http://purwokertokita.com/ragam/ini-besaran-kenaikan-iuran-bpjs-mulai-1-april-2016.html,Ini Besaran Kenaikan Iuran BPJS Mulai 1 April 2016,Kenaikan Iuran BPJS Mulai 1 April 2016,12,50,38,690,1278,588
