id,source_id,babe_url,lib_url,babe_title,lib_title,title_distance,babe_title_len,lib_title_len,content_distance,babe_content_len,lib_content_len
4630619,,http://www.tempo.co/read/news/2015/11/27/111722870/JK-Rowling-Buka-Rahasia-Mengapa-Potter-Namai-Anaknya-Severus,https://m.tempo.co/read/news/2015/11/27/111722870/jk-rowling-buka-rahasia-mengapa-potter-namai-anaknya-severus,"JK Rowling Buka Rahasia, Mengapa Potter Namai Anaknya Severus  ","JK Rowling Buka Rahasia, Mengapa Potter Namai Anaknya Severus",2,63,61,214,1173,959
5239210,,http://malesbanget.com/2016/01/8-kepribadian-orang-berdasarkan-makanan-kelilng-kesukaannya/,http://malesbanget.com/2016/01/8-kepribadian-orang-berdasarkan-makanan-kelilng-kesukaannya/,8 Kepribadian Orang Berdasarkan Makanan Kelilng Kesukaannya,8 Kepribadian Orang Berdasarkan Makanan Keliling Kesukaannya,1,59,60,172,4420,4252
4544398,,http://www.antaranews.com/berita/529845/teror-paris--70-juta-unggah-dukungan-via-instagram,http://www.antaranews.com/berita/529845/teror-paris--70-juta-unggah-dukungan-via-instagram,TEROR PARIS - 70 juta unggah dukungan via Instagram,TEROR PARIS,40,51,11,933,367,1257
5240193,,http://www.kotakgame.com/berita/detail.php?id=56843&jenis=news,http://www.kotakgame.com/berita/detail.php?id=56843&jenis=news,[VIDEO] X-Legend Ungkap Keempat Class yang Akan Hadir Di Laplace (TW) Lewat Trailer Baru,Berita : [VIDEO] X-Legend Ungkap Keempat Class yang Akan Hadir Di Laplace (TW) Lewat Trailer Baru,9,88,97,109,964,1064
4202081,,http://www.aplikanologi.com/berita/spesifikasi-htc-one-a9-bocor-lhoo-penasaran/,http://aplikanologi.com/berita/spesifikasi-htc-one-a9-bocor-lhoo-penasaran/,Spesifikasi HTC One A9 BocorLhoo. Penasaran?,Spesifikasi HTC One A9 Bocor Lhoo. Penasaran?,1,44,45,66,2118,2054
4544224,,http://dapurpacu.com/269231/ford-hadirkan-jok-senyaman-sofa/,http://dapurpacu.com/269231/ford-hadirkan-jok-senyaman-sofa/,Ford Hadirkan Jok Senyaman Sofa,Ford Hadirkan Jok Senyaman Sofa | Majalah Otomotif Online by. Dapurpacu.com,44,31,75,1,951,952
5231693,,https://jalantikus.com/gadgets/alasan-menggunakan-android/?utm_source=babe&utm_medium=article&utm_campaign=artikel-from-babe,https://jalantikus.com/gadgets/alasan-menggunakan-android/,Alasan Kenapa Harus Gunakan Android Dibanding iOS,Alasan Kenapa Harus Menggunakan Android Dibanding iOS,5,49,53,192,5431,5257
4535276,,http://ngonoo.com/2015/11/121507/4-fakta-menarik-tim-amatir-hingga-selebrasi-unik-ps-tni-usai-kalahkan-surabaya-united-kemarin/,https://ngonoo.com/2015/11/121507/4-fakta-menarik-tim-amatir-hingga-selebrasi-unik-ps-tni-usai-kalahkan-surabaya-united-kemarin,4 Fakta Menarik Tim‘Amatir’ Hingga Selebrasi Unik PS TNI Usai Kalahkan Surabaya United Kemarin,4 Fakta Menarik Tim 'Amatir' Hingga Selebrasi Unik PS TNI Usai Kalahkan Surabaya United Kemarin,3,94,95,181,1723,1546
4549710,,http://ngonoo.com/2015/11/214012/wow-mobil-pemburu-hantu-ghostbusters-ini-menghabiskan-biaya-sebesar-27-miliar/,https://ngonoo.com/2015/11/214012/wow-mobil-pemburu-hantu-ghostbusters-ini-menghabiskan-biaya-sebesar-27-miliar,"Wow! Mobil Pemburu Hantu“Ghostbusters” Ini Menghabiskan Biaya Sebesar 2,7 Miliar","Wow! Mobil Pemburu Hantu ""Ghostbusters"" Ini Menghabiskan Biaya Sebesar 2,7 Miliar",3,80,81,72,1735,1663
4544332,,http://gayahidup.rimanews.com/selebritas/read/20151117/245582/Momen-Romatis-Raisa-Dipeluk-Kakak-Pevita-Pearce,http://rimanews.com/gayahidup/selebritas/read/20151117/245582/Momen-Romantis-Raisa-Dipeluk-Kakak-Pevita-Pearce,Momen Romatis Raisa Dipeluk Kakak Pevita Pearce,Momen Romantis Raisa Dipeluk Kakak Pevita Pearce,1,47,48,151,924,937
5717407,,http://olahraga.rimanews.com/raket/read/20160220/262970/Tim-Uber-Indonesia-Masih-Berpeluang-Lolos-ke-Putaran-Final,http://rimanews.com/olahraga/raket/read/20160220/262970/Tim-Uber-Indonesia-Masih-Berpeluang-Lolos-ke-Putaran-Final,Tim Uber Indonesia Masih Berpeluang Loloske Putaran Final,Tim Uber Indonesia Masih Berpeluang Lolos ke Putaran Final,1,57,58,50,2222,2172
4548479,,http://gayahidup.rimanews.com/musik/read/20151117/245710/Hivi-dari-i-Ngamen-i-Sampai-Ciptakan-Lagu-di-Rimanews,http://rimanews.com/gayahidup/musik/read/20151117/245710/HiVi-dari-Ngamen-Sampai-Ciptakan-Lagu-di-Rimanews,Hivi dari Ngamen Sampai Ciptakan Lagu di Rimanews,HiVi dari Ngamen Sampai Ciptakan Lagu di Rimanews,1,49,49,53,1701,1651
4199705,,http://ekonomi.rimanews.com/keuangan/read/20151001/237361/Menko-Perek-Deflasi-Bukan-Berarti-Ekonomi-Indonesia-Sudah-Membaik,http://rimanews.com/ekonomi/keuangan/read/20151001/237361/Menko-Deflasi-Bukan-Berarti-Ekonomi-Indonesia-Sudah-Membaik,Menko Perek: Deflasi Bukan Berarti Ekonomi Indonesia Sudah Membaik,Menko: Deflasi Bukan Berarti Ekonomi Indonesia Sudah Membaik,6,66,60,0,1147,1147
4198559,,http://internasional.rimanews.com/amerika/read/20151001/237366/Paus-Diam-Diam-Temui-Panitera-yang-Menentang-Pernikahan-Sesama-Jenis,http://rimanews.com/internasional/amerika/read/20151001/237366/Paus-Diam-Diam-Temui-Panitera-Penentang-Pernikahan-Sejenis,Paus Diam-Diam Temui Panitera yang Menentang Pernikahan Sesama Jenis,Paus Diam-Diam Temui Panitera Penentang Pernikahan Sejenis,12,68,58,0,2044,2044
5093890,,http://syafrita-irdani.blogspot.com/2016/01/lee-jun-ki-iu-dikonfirmasi-akan.html,http://syafrita-irdani.blogspot.com/2016/01/lee-jun-ki-iu-dikonfirmasi-akan.html,Lee Jun Ki & IU Dikonfirmasi Akan Berakting di “Moon Lovers”,Syafrita Irdani Putri: Lee Jun Ki & IU Dikonfirmasi Akan Berakting di “Moon Lovers”,23,60,83,0,905,905
4705689,,http://litanythrift.blogspot.com/2015/12/kisah-vanness-wu-personil-f4.html,http://litanythrift.blogspot.com/2015/12/kisah-vanness-wu-personil-f4.html,"Kisah Vanness Wu, Personil F4","litanystars: Kisah Vanness Wu, Personil F4",13,29,42,3093,2389,5478
4532155,,http://www.alodita.com/2015/11/hydroclean-review.html,http://www.alodita.com/2015/11/hydroclean-review.html,"GOOD NIGHT, SLEEP TIGHT. DON'T LET THE BED BUGS BITE!","Andra Alodita | Life & Beauty Journal: GOOD NIGHT, SLEEP TIGHT. DON'T LET THE BED BUGS BITE!",39,53,92,133,3865,3996
4631371,,http://nikenbicarafilm.blogspot.com/2015/11/the-hunger-games-mockingjay-part-2-2015.html,http://nikenbicarafilm.blogspot.com/2015/11/the-hunger-games-mockingjay-part-2-2015.html,"The Hunger Games: Mockingjay Part 2 (2015) (4,5/5)","Niken Bicara Film: The Hunger Games: Mockingjay Part 2 (2015) (4,5/5)",19,50,69,223,8931,8983
5354030,,http://ajirenji.blogspot.com/2016/01/movie-midnight-show-2016.html,http://ajirenji.blogspot.com/2016/01/movie-midnight-show-2016.html,[Movie] Midnight Show (2016),ajirenji mindstream reviews: [Movie] Midnight Show (2016),29,28,57,22,5508,5500
5180318,,http://arulfittron.blogspot.com/2016/01/negeri-van-oranje-2015-review-kisah.html,http://arulfittron.blogspot.com/2016/01/negeri-van-oranje-2015-review-kisah.html,NEGERI VAN ORANJE (2015) REVIEW : Kisah Kasih Di Negeri Orang,Arul's Movie Review Blog: NEGERI VAN ORANJE (2015) REVIEW : Kisah Kasih Di Negeri Orang,26,61,87,29,5620,5603
5216455,,http://thejosemoviereview.blogspot.com/2016/01/the-jose-flash-review-pay-ghost.html,http://thejosemoviereview.blogspot.com/2016/01/the-jose-flash-review-pay-ghost.html,The Jose Flash Review Pay the Ghost,"<span style=""font-size: small"">The Jose Flash Review </span><br/><span style=""color: #bda63b"">Pay the Ghost</span> ~ The Jose Movie Review",103,35,138,31,3345,3318
5370750,,http://pinkyrose21.blogspot.com/2016/01/beauty-haul-awal-tahun-2016.html,http://pinkyrose21.blogspot.com/2016/01/beauty-haul-awal-tahun-2016.html,Beauty Haul awal Tahun 2016,Potted Pinkyrose: Beauty Haul awal Tahun 2016,18,27,45,533,5551,5026
5192558,,http://www.leeviahan.com/2016/01/ultima-ii-delicate-translucent-face.html,http://www.leeviahan.com/2016/01/ultima-ii-delicate-translucent-face.html,Ultima II Delicate Translucent Face Powder With Moisturizer REVIEW,Beauty Blogger Indonesia by Lee Via Han: Ultima II Delicate Translucent Face Powder With Moisturizer REVIEW,41,66,107,123,5148,5031
5757443,,http://www.jessicaalicia.com/2016/03/review-emina-products-feat-sociolla.html,http://www.jessicaalicia.com/2016/03/review-emina-products-feat-sociolla.html,Review : Emina Products feat. Sociolla,∞ A BEAUTY BLOG BY JESSICA ALICIA ∞: Review : Emina Products feat. Sociolla,37,38,75,3104,4116,1449
4637224,,http://beautydoodle.blogspot.com/2015/11/cowstyle-milky-body-soap-floral.html,http://www.beautydoodle.com/2015/11/cowstyle-milky-body-soap-floral.html,Cowstyle Milky Body Soap Floral,Beauty Doodle: Cowstyle Milky Body Soap Floral,15,31,46,312,3900,3599
4634715,,http://feedproxy.google.com/~r/blogspot/racunwarnawarni/~3/ylK0QVu1yuQ/review-wipey-make-up-remover-by-douce.html,http://www.racunwarnawarni.com/2015/11/review-wipey-make-up-remover-by-douce.html,[Review] Wipey Make Up Remover by Douce et Lisse& Silk Worm Cocoon,Racun Warna-Warni: [Review] Wipey Make Up Remover by Douce et Lisse & Silk Worm Cocoon,20,66,86,514,10933,10913
5354786,,http://cheryl-raissa.blogspot.com/2016/01/1-hari-bareng-aku-update-ovale-bedak.html,http://cheryl-raissa.blogspot.com/2016/01/1-hari-bareng-aku-update-ovale-bedak.html,1 hari bareng aku + Update Ovale Bedak Dingin | Cheryl Raissa,1 hari bareng aku + Update Ovale Bedak Dingin,16,61,45,4108,4292,196
5194288,,http://thecurlygirljournal.blogspot.com/2016/01/curly-hair-products-recommendation-part.html,http://www.agnesoryza.com/2016/01/curly-hair-products-recommendation-part.html,Curly Hair Products Recommendation part 2,The Curly Girl Journal: Curly Hair Products Recommendation part 2,24,41,65,182,2514,2670
4648605,,http://defanilla.blogspot.com/2015/11/lovely-review-himalaya-herbals-clear.html,http://www.defanilla.rocks/2015/11/lovely-review-himalaya-herbals-clear.html,Lovely Review: HimalayaHerbals Clear Complexion Whitening Face Srub,Lovely Review: Himalaya Herbals Clear Complexion Whitening Face Scrub,2,67,69,142,3506,3379
5216456,,http://www.girlsweethings.com/2016/01/review-revlon-super-lustrous-lipstick.html,http://www.girlsweethings.com/2016/01/review-revlon-super-lustrous-lipstick.html,Review: Revlon Super Lustrous Lipstick,GIRLSWEETHINGS.COM: Review: Revlon Super Lustrous Lipstick,20,38,58,235,2307,2074
4546188,,http://wind-atree.blogspot.com/2015/11/review-skin-house-essential-cleansing.html,,[Review] The Skin House Essential Cleansing Oil,The Journey,39,47,11,1997,2624,627
5199714,,http://www.natashajs.com/2016/01/faceshopshoneysuckle.html,http://www.natashajs.com/2016/01/faceshopshoneysuckle.html,Review: The Face Shop's Honey Suckle Body Exfoliator,Violet Brush • Indonesian Beauty Blogger: Review: The Face Shop's Honey Suckle Body Exfoliator,42,52,94,322,2195,1875
5222742,,http://www.talkativetya.com/2016/01/-kupas-tuntas-lulur.html,http://www.talkativetya.com/2016/01/-kupas-tuntas-lulur.html,[BEAUTY 101] Kupas Tuntas Semua Tentang Lulur,Talkative Tya,38,45,13,1240,10186,8954
4523239,,http://notonlywear.blogspot.com/2015/11/nightremedy.html,http://notonlywear.blogspot.com/2015/11/nightremedy.html,Night Remedy,Not Only Wear: Night Remedy,15,12,27,289,3118,2986
5442018,,http://tinktankme.blogspot.com/2016/02/wedding-journal-makeup-touch.html,http://tinktankme.blogspot.com/2016/02/wedding-journal-makeup-touch.html,Wedding Journal: Makeup touch!,slim simply: Wedding Journal: Makeup touch!,13,30,43,109,6883,6778
5198370,,http://www.tutysaca.com/2016/01/ionssence-pocari-sweat-no-more.html,http://www.tutysaca.com/2016/01/ionssence-pocari-sweat-no-more.html,"Ionssence Pocari Sweat, No more Dehidration !","Tuty Saca: Ionssence Pocari Sweat, No more Dehidration !",11,45,56,84,4906,4828
4211706,,http://anshiera.blogspot.com/2015/10/perhatikan-apakah-makeup-mu-kadaluarsa.html,http://anshiera.blogspot.com/2015/10/perhatikan-apakah-makeup-mu-kadaluarsa.html,PERHATIKAN!! APAKAH MAKEUP-MU KADALUARSA?,AnshierA: PERHATIKAN!! APAKAH MAKEUP-MU KADALUARSA?,10,41,51,492,5443,5229
5192486,,http://len-diary.blogspot.com/2016/01/eksotisme-timor-tengah-selatan.html,,Eksotisme Timor Tengah Selatan,Đang chuyển hướng,27,30,17,5136,5213,95
5229136,,http://v1olet.blogspot.com/2016/01/north-sumatera-trip-pasir-putih.html,http://v1olet.blogspot.com/2016/01/north-sumatera-trip-pasir-putih.html,North Sumatera Trip : Pasir Putih,v1olet,31,33,6,299,1973,2272
4546804,,http://www.travelerien.com/2015/11/pergi-ke-bioskop-menonton-film.html,http://www.travelerien.com/2015/11/pergi-ke-bioskop-menonton-film.html,Pergi ke Bioskop Menonton Film,Mau Nonton Film? Cek Daftar Film Dulu,29,30,37,3061,4116,1904
5356712,,http://studentofbutterfly.blogspot.com/2016/01/jeddah-big-city-on-edge-of-red-sea.html,http://studentofbutterfly.blogspot.com/2016/01/jeddah-big-city-on-edge-of-red-sea.html,Jeddah: A Big City On The Edge Of The Red Sea,melihat duniaku dengan keindahan dan keberanian: Jeddah: A Big City On The Edge Of The Red Sea,49,45,94,240,6345,6207
4576096,,http://aufasidix.blogspot.com/2015/11/uk-ujung-kulon-trip.html,http://aufasidix.blogspot.com/2015/11/uk-ujung-kulon-trip.html,UK (Ujung Kulon) Trip,AUFA JOURNEY: UK (Ujung Kulon) Trip,14,21,35,242,5862,5622
4635437,,http://cucipikiran.blogspot.com/2015/11/sekilas-tentang-kota-pati.html,http://cucipikiran.blogspot.com/2015/11/sekilas-tentang-kota-pati.html,Sekilas tentang Kota Pati,Cuci Pikiran: Sekilas tentang Kota Pati,14,25,39,61,2563,2502
5088189,,http://ceritadisana.blogspot.com/2016/01/jangan-lupa-menjangan.html,http://ceritadisana.blogspot.com/2016/01/jangan-lupa-menjangan.html,Jangan Lupa Menjangan,Ada Cerita Disana: Jangan Lupa Menjangan,19,21,40,635,12182,11563
4540180,,http://dreamland-traveller.blogspot.com/2015/11/akibat-tidur-terlalu-nyenyak.html,http://dreamland-traveller.blogspot.com/2015/11/akibat-tidur-terlalu-nyenyak.html,Akibat Tidur Terlalu Nyenyak,Dreamland Traveller: Akibat Tidur Terlalu Nyenyak,21,28,49,1414,1538,138
5375766,,http://eatandaway.blogspot.com/2016/01/aw-kitchen-by-akira-watanabe-plaza.html,http://eatandaway.blogspot.com/2016/01/aw-kitchen-by-akira-watanabe-plaza.html,"AW Kitchen by Akira Watanabe, Plaza Indonesia","Eat And Travel, Wherever, Whenever: AW Kitchen by Akira Watanabe, Plaza Indonesia",36,45,81,4,1276,1276
4547443,,http://www.tatitujiani.com/2015/11/restu-suami-lancarkan-diriku-mengais.html,http://www.tatitujiani.com/2015/11/restu-suami-lancarkan-diriku-mengais.html,"Restu Suami, Lancarkan Diriku Mengais Ilmu Di Fun Blogging 7","Restu Suami, Lancarkan Diriku Mengais Ilmu Di Fun Blogging 7 ~ ~ Rumah Maya Tatit ~",23,60,83,7487,7627,140
4537384,,http://www.hungerranger.com/2015/10/jakarta-lenggang-jakarta.html,http://www.hungerranger.com/2015/10/jakarta-lenggang-jakarta.html,Jakarta: Lenggang Jakarta,Jakarta: Lenggang Jakarta ~ hungerranger.com,19,25,44,234,2897,2665
4648606,,http://inspirasikukeni.blogspot.com/2015/11/jambe-asri-agro-tourism.html,http://inspirasikukeni.blogspot.com/2015/11/jambe-asri-agro-tourism.html,Jambe Asri Agro Tourism,Inspirasikukeni: Jambe Asri Agro Tourism,17,23,40,143,8142,8285
5244775,,http://meciko.blogspot.com/2016/01/perlengkapan-dan-pakaian-umroh-plus.html,http://meciko.blogspot.com/2016/01/perlengkapan-dan-pakaian-umroh-plus.html,PERLENGKAPAN DAN PAKAIAN UMROH PLUS JALAN JALAN ..EDITION 2,Meciko66: PERLENGKAPAN DAN PAKAIAN UMROH PLUS JALAN JALAN ..EDITION 2,10,59,69,4416,4609,200
5232798,,http://www.foodgrapher.com/2016/01/ayam-goreng-tulang-lunak-malioboro.html,http://www.foodgrapher.com/2016/01/ayam-goreng-tulang-lunak-malioboro.html,Ayam Goreng Tulang Lunak Malioboro - Surabaya,FoodGrapher: Ayam Goreng Tulang Lunak Malioboro,24,45,47,519,7191,6684
4544118,,http://pertamax7.com/2015/11/17/dragon-ball-berhenti-tayang-di-global-tv-bukan-karena-kpi-datang-lagi-2016/,,"Dragon Ball Berhenti Tayang di Global TV Bukan Karena KPI, datang lagi 2016 !","Pertamax7.Com –Dragon Ball Berhenti Tayang di Global TV Bukan Karena KPI, datang lagi 2016 !",15,77,92,2799,2283,4448
4544119,,http://tmcblog.com/2015/11/17/honda-hadirkan-konsep-skutik-adventure-honda-city-adventure/,,Honda hadirkan Konsep Skutik Adventure  . . . Honda City Adventure,tmcblog.com » Honda hadirkan Konsep Skutik Adventure . . . Honda City Adventure,15,66,79,4494,2472,6483
8218270,,https://bengkelsepedamotor.com/2016/09/03/mengapa-throttle-by-wire/,https://bengkelsepedamotor.com/2016/09/03/mengapa-throttle-by-wire/,Mengapa Throttle by Wire,Mengapa Throttle by Wire – bengkelsepedamotor,21,24,45,113,2056,1977
4290812,,http://nichozblog.com/2015/10/16/modus-penipuan-baru-kupon-hadiah-di-sebar-di-depan-rumah-penduduk/,http://nichozblog.com/2015/10/16/modus-penipuan-baru-kupon-hadiah-di-sebar-di-depan-rumah-penduduk/,"Modus Penipuan Baru, Kupon Hadiah Di Sebar Di Depan Rumah Penduduk","nichozblogModus Penipuan Baru, Kupon Hadiah Di Sebar Di Depan Rumah Penduduk",10,66,76,654,2315,1910
4544338,,http://kelanakota.suarasurabaya.net/news/2015/162570-Novanto-:-Tidak-Mudah-Perusahaan-AS-Serahkan-Sahamnya,http://kelanakota.suarasurabaya.net/news/2015/162570-Novanto-:-Tidak-Mudah-Perusahaan-AS-Serahkan-Sahamnya,Novanto : Tidak Mudah Perusahaan AS Serahkan Sahamnya,suarasurabaya.net,44,53,17,568,2043,2600
4544268,,http://waspada.co.id/medan/ramadhan-pohan-sosok-dibalik-suksesnya-operasi-aquilla/,http://waspada.co.id/medan/ramadhan-pohan-sosok-dibalik-suksesnya-operasi-aquilla/,Ramadhan Pohan Sosok Dibalik Suksesnya Operasi Aquilla,Ramadhan Pohan Sosok Dibalik Suksesnya Operasi Aquilla – Waspada Online,17,54,71,287,6074,5796
5179214,,http://wartatimur.com/wali-kota-jadi-pembicara-dialog-akhir-tahun-partai-nasdem.html,http://wartatimur.com/wali-kota-jadi-pembicara-dialog-akhir-tahun-partai-nasdem.html,Wali Kota Jadi Pembicara Dialog Akhir Tahun Partai Nasdem,Warta Timur » Wali Kota Jadi Pembicara Dialog Akhir Tahun Partai Nasdem,14,57,71,1,2676,2677
5202411,,http://beritapagi.co.id/2016/01/16/warga-poligon-tolak-pendirian-menara-telekomunikasi.html,http://beritapagi.co.id/2016/01/16/warga-poligon-tolak-pendirian-menara-telekomunikasi.html,Warga Poligon Tolak Pendirian Menara Telekomunikasi,Warga Poligon Tolak Pendirian Menara Telekomunikasi – BeritaPagi,13,51,64,16,2259,2247
5231706,,http://hiburan.metrotvnews.com/read/2016/01/18/471396/hanung-minta-zaskia-melahirkan-anak-ketiga-secara-normal,http://hiburan.metrotvnews.com/read/2016/01/18/471396/hanung-minta-zaskia-melahirkan-anak-ketiga-secara-normal,Hanung Minta Zaskia Melahirkan Anak Ketiga secara Normal,Selebritas | Hanung Minta Zaskia Melahirkan Anak Ketiga seca…,22,56,61,1010,1293,283
4539033,,https://blog.duitpintar.com/6-aplikasi-buat-traveling-buat-yang-pengin-city-hopping-di-indonesia,https://blog.duitpintar.com/6-aplikasi-buat-traveling-buat-yang-pengin-city-hopping-di-indonesia/,6 Aplikasi Buat Traveling Buat Yang Pengin City Hopping di Indonesia,Mau City Hopping? Unduh 6 Aplikasi Buat Traveling Ini,54,68,53,645,5387,4742
4544241,,http://jagatplay.com/2015/11/news/ea-mulai-kembangkan-game-sekelas-assassins-creed/,http://jagatplay.com/2015/11/news/ea-mulai-kembangkan-game-sekelas-assassins-creed/,EA Mulai Kembangkan Game Sekelas Assassin’s Creed,EA Mulai Kembangkan Game Sekelas Assassin’s Creed – Jagat Play,13,49,62,150,1993,1847
4550275,,http://www.finansialku.com/reksa-dana-kik-eba/,https://www.finansialku.com/reksa-dana-kik-eba/,Reksa Dana KIK-EBA,Reksa dana KIK-EBA,1,18,18,235,2692,2461
4544244,,http://www.swadeka.com/lim-yo-hwan-hani-exid-dan-hong-jin-ho-jadi-bintang-tamu-running-man-mendatang/10056/,http://swadeka.com/lim-yo-hwan-hani-exid-dan-hong-jin-ho-jadi-bintang-tamu-running-man-mendatang/10056/,"Lim Yo Hwan, Hani EXID,dan Hong Jin Ho Jadi Bintang Tamu Running Man Mendatang","Lim Yo Hwan, Hani EXID, dan Hong Jin Ho Jadi Bintang Tamu Running Man Mendatang",1,78,79,197,1264,1067
5201209,,http://feedproxy.google.com/~r/yangserucom/~3/Sl1FfkZlfjY/jangan-egois-begini-trik-menikmati-orgasme-bersamaan.html,http://yangseru.com/jangan-egois-begini-trik-menikmati-orgasme-bersamaan.html,"Jangan egois, begini trik menikmati orgasme bersamaan","Jangan egois, begini trik menikmati orgasme bersamaan – yangseru.com",15,53,68,20,1672,1652
4522050,,http://tenagakuda.com/tissot-kembali-kerjasama-dengan-motogp-sampai-2022/,http://tenagakuda.com/tissot-kembali-kerjasama-dengan-motogp-sampai-2022/7068,Tissot Kembali Kerjasama denganMotoGP Sampai 2022,Tissot Kembali Kerjasama dengan MotoGP Sampai 2022,1,49,50,0,1490,1490
4947519,,http://tenagakuda.com/harley-davidson-xl1000-eksotis-evel-knievel-yang-eksotis/,http://tenagakuda.com/harley-davidson-xl1000-eksotis-evel-knievel-yang-eksotis/8108,Harley-Davidson XL1000 EksotisEvel Knievel yang Eksotis,Harley-Davidson XL1000 Eksotis Evel Knievel yang Eksotis,1,55,56,1,1192,1193
4527828,,http://tenagakuda.com/soal-penjualan-motor-honda-india-ingin-menyalip-indonesia/,http://tenagakuda.com/soal-penjualan-motor-honda-india-ingin-menyalip-indonesia/6972,"Soal Penjualan Motor Honda,India Ingin Menyalip Indonesia","Soal Penjualan Motor Honda, India Ingin Menyalip Indonesia",1,57,58,154,1298,1452
5239975,,http://tenagakuda.com/modifikasi-honda-xlr250r-yang-bikin-kagum/,http://tenagakuda.com/modifikasi-honda-xlr250r-yang-bikin-kagum/8625,Modifikasi Honda XLR250R yang BikinKagum,Modifikasi Honda XLR250R yang Bikin Kagum,1,40,41,0,1596,1596
5238673,,http://www.jitunews.com/read/28964/belum-ada-alokasi-bantuan-alsintan-dari-kementan-untuk-sumbar,http://www.jitunews.com/read/28964/belum-ada-alokasi-bantuan-alsintan-dari-kementan-untuk-sumbar,Belum Ada Alokasi Bantuan Alsintan dari Kementan untuk Sumbar,Belum Ada Alokasi Bantuan Alsintan Dari Kementan Untuk Sumbar,2,61,61,200,1481,1340
4521360,,http://duniaternak.com/pemprov-dukung-pengembangan-pakan-ternak-berbasis-industri-rumahan/,http://duniaternak.com/pemprov-dukung-pengembangan-pakan-ternak-berbasis-industri-rumahan/,Pemprov Dukung Pengembangan Pakan Ternak Berbasis Industri Rumahan,Pemprov Dukung Pengembangan Pakan Ternak Berbasis Industri RumahanBISNIS USAHA TERNAK,19,66,85,55,4674,4621
5214165,,http://feedproxy.google.com/~r/yangserucom/~3/vW21xzFbaQw/israel-tawarkan-solusi-proteksi-kendaraan-agar-tidak-mudah-dicuri.html,http://yangseru.com/israel-tawarkan-solusi-proteksi-kendaraan-agar-tidak-mudah-dicuri.html,Israel tawarkan solusi proteksi kendaraan agar tidak mudah dicuri,Israel tawarkan solusi proteksi kendaraan agar tidak mudah dicuri – yangseru.com,15,65,80,21,1639,1620
4904912,,http://mumovi.com/2015/12/album-adele-25-bikin-berhasil-gagal-move/,http://mumovi.com/2015/12/album-adele-25-bikin-berhasil-gagal-move/,Album Adele “25” Bikin Berhasil Gagal Move On,Album Adele “25” Bikin Berhasil Gagal Move On – Mumovi,9,45,54,35,3588,3567
5241778,,http://mumovi.com/2016/01/ulasan-the-big-short-2015/,http://mumovi.com/2016/01/ulasan-the-big-short-2015/,Ulasan “The Big Short” (2015),Ulasan “The Big Short” (2015) – Mumovi,9,29,38,17,4672,4663
5231434,,http://msports.net/detailpost/ungkapan-simpati-pebalap-motogp-atas-serangan-di-jakarta,http://msports.net/,Ungkapan Simpati Pebalap MotoGP Atas Serangan di Jakarta,MSPORTS.net,51,56,11,1591,1721,145
4633622,,http://forum.suara.com/forum/lifestyle/5192-pelajari-cara-agar-hubungan-pacaran-tak-mudah-putus-di-a,http://forum.suara.com/index.php,Pelajari Cara Agar Hubungan Pacaran Tak Mudah Putus di Awal,Suara.com Community,52,59,19,2597,2556,3460
4528699,,http://yangseru.com/pasar-sepi-harga-batu-akik-bacan-dan-kalimaya-tetap-tinggi.html,http://yangseru.com/pasar-sepi-harga-batu-akik-bacan-dan-kalimaya-tetap-tinggi.html,"Pasar sepi, Harga batu akik Bacan dan Kalimaya tetap tinggi","Pasar sepi, Harga batu akik Bacan dan Kalimaya tetap tinggi – yangseru.com",15,59,74,107,1491,1388
4549379,,http://yangseru.com/video-nyata-selingkuh-pasangan-ini-terkena-gancet.html,http://yangseru.com/video-nyata-selingkuh-pasangan-ini-terkena-gancet.html,"Video nyata: Selingkuh, pasangan ini terkena Gancet","Video nyata: Selingkuh, pasangan ini terkena Gancet – yangseru.com",15,51,66,120,2500,2388
5096298,,http://www.harapanrakyat.com/2015/08/prediksi-seorang-psikolog-soal-hubungan-manusia-dan-robot/,http://www.harapanrakyat.com/2015/08/prediksi-seorang-psikolog-soal-hubungan-manusia-dan-robot/,Ini Prediksi Seorang Psikolog Soal Hubungan Manusia dan Robot,Prediksi Seorang Psikolog Soal Hubungan Manusia dan Robot,4,61,57,63,1268,1205
4531910,,http://waktoe.com/menteri-koperasi-dan-ukm-luncurkan-kartu-iumk-iumk-berikan-kepastian-hukum-dan-pemberdayaan/,http://waktoe.com/menteri-koperasi-dan-ukm-luncurkan-kartu-iumk-iumk-berikan-kepastian-hukum-dan-pemberdayaan/,Menteri Koperasi dan UKM Luncurkan Kartu IUMK  IUMK Berikan Kepastian Hukum dan Pemberdayaan,Menteri Koperasi dan UKM Luncurkan Kartu IUMK IUMK Berikan Kepastian Hukum dan Pemberdayaan,1,92,91,351,2053,1704
5231680,,http://www.sundul.com/berita-bola/liga-inggris/2016/01/pardew-akui-palace-butuh-striker-baru/,http://www.sundul.com/berita-bola/liga-inggris/2016/01/pardew-akui-palace-butuh-striker-baru/,Pardew Akui Palace Butuh Striker Baru,Berita Bola: Pardew Akui Palace Butuh Striker Baru,13,37,50,4,2818,2822
4549382,,http://www.murianews.com/2015/11/17/60257/syukuran-panen-raya-petani-tembakau-rembang-dangdutan-di-sawah.html,http://www.murianews.com/2015/11/17/60257/syukuran-panen-raya-petani-tembakau-rembang-dangdutan-di-sawah.html,"Syukuran Panen Raya, Petani Tembakau Rembang‘Dangdutan’ di Sawah","Syukuran Panen Raya, Petani Tembakau Rembang ‘Dangdutan’ di Sawah",1,64,65,140,1019,879
5206063,,http://www.siwalimanews.com/post/pasca_bom_jakarta_maluku_siaga_satu_1,,"Pasca Bom Jakarta, Maluku Siaga Satu",Portal Berita Terbesar di Maluku,27,36,32,85,3822,3743
4685093,,http://kesurabaya.com/jelang-pilkada-surabaya-surat-suara-mulai-didistribusikan/,http://kesurabaya.com/jelang-pilkada-surabaya-surat-suara-mulai-didistribusikan/,"Jelang Pilkada Surabaya, Surat Suara Mulai Didistribusikan","Jelang Pilkada Surabaya, Surat Suara Mulai Didistribusikan | Berita & Info Surabaya, Kuliner, Wisata, Event, Bisnis, Lifestyle, Shopping",78,58,136,25,1536,1515
