id,source_id,babe_url,lib_url,babe_title,lib_title,title_distance,babe_title_len,lib_title_len,content_distance,babe_content_len,lib_content_len,,
6927599,,http://bola.metrotvnews.com/inggris/akW45zqK-leicester-city-resmi-datangkan-mantan-kiper-mu,http://bola.metrotvnews.com/inggris/akW45zqK-leicester-city-resmi-datangkan-mantan-kiper-mu,Leicester City Resmi Datangkan Mantan Kiper MU,Inggris | Leicester City Resmi Datangkan Mantan Kiper MU…,11,46,57,980,1658,678,,
6940517,,http://bola.metrotvnews.com/spanyol/0k880AWk-alves-sarankan-coutinho-gabung-barcelona,http://bola.metrotvnews.com/spanyol/0k880AWk-alves-sarankan-coutinho-gabung-barcelona,Alves Sarankan Coutinho Gabung Barcelona,Spanyol | Alves Sarankan Coutinho Gabung Barcelona…,11,40,51,844,1258,414,,
6939858,,http://bola.metrotvnews.com/italia/5b2MX0rN-nainggolan-akhirnya-akui-didekati-chelsea,http://bola.metrotvnews.com/italia/5b2MX0rN-nainggolan-akhirnya-akui-didekati-chelsea,Nainggolan Akhirnya Akui Didekati Chelsea,Italia | Nainggolan Akhirnya Akui Didekati Chelsea…,10,41,51,759,1263,504,,
6966188,,http://bola.metrotvnews.com/jerman/GNGXWmrb-mantan-gelandang-muenchen-tak-sabar-jalani-debut-bersama-dortmund,,Mantan Gelandang Muenchen Tak Sabar Jalani Debut Bersama Dortmund,,0,65,0,0,1478,0,,
7156204,,http://bola.metrotvnews.com/champions/lKY1PZAK-berikut-hasil-undian-kualifikasi-pertama-dan-kedua-liga-champions-2016-2017,http://bola.metrotvnews.com/champions/lKY1PZAK-berikut-hasil-undian-kualifikasi-pertama-dan-kedua-liga-champions-2016-2017,Berikut Hasil Undian Kualifikasi Pertama dan Kedua Liga Champions 2016--2017,Champions | Berikut Hasil Undian Kualifikasi Pertama dan Ked…,40,76,61,1209,1708,499,,
6924849,,http://bola.metrotvnews.com/indonesia/aNrLazWk-menpora-serahkan-nasib-pssi-kepada-pemilik-suara,,Menpora Serahkan Nasib PSSI kepada Pemilik Suara,,0,48,0,0,1555,0,,
6924398,,http://microsite.suara.com/prancis2016/2016/05/27/130747/benzema-tersisih-di-piala-eropa-karena-berdarah-afrika-benarkah,http://microsite.suara.com/prancis2016/2016/05/27/130747/benzema-tersisih-di-piala-eropa-karena-berdarah-afrika-benarkah,"Benzema Tersisih di Piala Eropa Karena Berdarah Afrika, Benarkah?","Benzema Tersisih di Piala Eropa Karena Berdarah Afrika, Benarkah?",0,65,65,121,1171,1050,,
7108733,,http://microsite.suara.com/prancis2016/2016/06/17/005814/taklukkan-ukraina-irlandia-utara-masih-menjaga-peluang,http://microsite.suara.com/prancis2016/2016/06/17/005814/taklukkan-ukraina-irlandia-utara-masih-menjaga-peluang,"Taklukkan Ukraina, Irlandia Utara Masih Menjaga Peluang","Taklukkan Ukraina, Irlandia Utara Masih Menjaga Peluang",0,55,55,86,2244,2158,,
6950272,,http://angkasa.co.id/komunitas/review/ternyata-ini-modivikasi-olahraga-berparasut-di-dunia/,http://angkasa.co.id/komunitas/review/ini-modifikasi-olahraga-berparasut-di-dunia/,Ini Modifikasi Olahraga Berparasut di Dunia,Ini Modifikasi Olahraga Berparasut di Dunia,0,43,43,3479,5227,1749,,
6993333,,http://www.goal.com/euro2016/id/artikel/nicola-rizzoli-pimpin-laga-inggris---rusia/12pgl7v0m8ppq11k5lso0ir1bs,http://www.goal.com/euro2016/id/artikel/nicola-rizzoli-pimpin-laga-inggris---rusia/12pgl7v0m8ppq11k5lso0ir1bs,Nicola Rizzoli Pimpin Laga Inggris - Rusia,Nicola Rizzoli Pimpin Laga Inggris,8,42,34,157,1170,1013,,
6964047,,http://www.goal.com/id-ID/news/1387/nasional/2016/06/07/24348102/madura-united-fc-mau-turunkan-harga-tiket,http://www.goal.com/id-ID/news/1391/indonesia-soccer-championship/2016/06/07/24348102/madura-united-fc-mau-turunkan-harga-tiket,Madura United Mau Turunkan Harga Tiket,Madura United FC Mau Turunkan Harga Tiket,3,38,41,0,2201,2201,,
6964060,,http://www.goal.com/id-ID/news/1071/internasional/2016/06/07/24356462/jamie-vardy-rekrutan-sempurna-untuk-arsenal,http://www.goal.com/id-ID/news/1108/sepakbola-inggris/2016/06/07/24356462/jamie-vardy-rekrutan-sempurna-untuk-arsenal,Vardy Rekrutan Sempurna Untuk Arsenal,Jamie Vardy Rekrutan Sempurna Untuk Arsenal,6,37,43,0,2002,2002,,
6964080,,http://www.goal.com/id-ID/news/2277/liga-liga-eropa/2016/06/06/24327812/argentina-tunggu-kabar-lionel-messi,http://www.goal.com/id-ID/news/1366/amerika-utara-amerika-tengah-amerika-selatan/2016/06/06/24327812/argentina-tunggu-kabar-lionel-messi,Argentina Tunggu Kabar Messi,Argentina Tunggu Kabar Lionel Messi,7,28,35,0,1119,1119,,
6996674,,http://www.goal.com/id-ID/news/2279/editorial-liputan-khusus/2016/06/09/24431512/juventus-pimpin-perburuan-miralem-pjanic,http://www.goal.com/id-ID/news/784/transfer-pemain/2016/06/09/24431512/juventus-pimpin-perburuan-miralem-pjanic,Juve Pimpin Perburuan Pjanic,Juventus Pimpin Perburuan Miralem Pjanic,12,28,40,0,951,951,,
6984834,,http://www.goal.com/id-ID/news/784/transfer-pemain/2016/06/08/24398072/disasar-jadi-pelatih-timnas-u-19-rudy-eka-priyambada-kaget,http://www.goal.com/id-ID/news/1387/nasional/2016/06/08/24398072/disasar-jadi-pelatih-timnas-u-19-rudy-eka-priyambada-kaget,"Disasar Jadi Pelatih Timnas U-19, Rudy Eka Priyambada Kaget","Disasar Jadi Pelatih Timnas U-19, Rudy Eka Priyambada Kaget",0,59,59,0,2009,2009,,
6953877,,http://news.rakyatku.com/read/7939/2016/06/05/polres-terkesan-tutupi-kasus-kadis-pu-dan-sda-bone-ada-apa-,http://news.rakyatku.com/read/7939/2016/06/05/polres-terkesan-tutupi-kasus-kadis-pu-dan-sda-bone-ada-apa-,"Polres Terkesan Tutupi Kasus Kadis PU dan SDA Bone, Ada Apa?","Polres Terkesan Tutupi Kasus Kadis PU dan SDA Bone, Ada Apa?",0,60,60,0,1368,1368,,
6953885,,http://news.rakyatku.com/read/8011/2016/06/06/anggaran-ka-trans-sulawesi-minim-kemenhub-siapkan-tiga-opsi,http://news.rakyatku.com/read/8011/2016/06/06/anggaran-ka-trans-sulawesi-minim-kemenhub-siapkan-tiga-opsi,"Anggaran KA Trans Sulawesi Minim, Kemenhub Siapkan Tiga Opsi","Anggaran KA Trans Sulawesi Minim, Kemenhub Siapkan Tiga Opsi",0,60,60,0,1473,1473,,
6953911,,http://news.rakyatku.com/read/7956/2016/06/05/arab-saudi-perluas-strategi-anti-iran-di-luar-timur-tengah,http://news.rakyatku.com/read/7956/2016/06/05/arab-saudi-perluas-strategi-anti-iran-di-luar-timur-tengah,Arab Saudi Perluas Strategi Anti-Iran di luar Timur Tengah,Arab Saudi Perluas Strategi Anti-Iran di luar Timur Tengah,0,58,58,32,2175,2187,,
6953940,,http://news.rakyatku.com/read/7697/2016/06/03/bank-indonesia-buka-lowongan-kerja-cek-di-sini-,http://news.rakyatku.com/read/7697/2016/06/03/bank-indonesia-buka-lowongan-kerja-cek-di-sini-,"Bank Indonesia Buka Lowongan Kerja, Cek di Sini!","Bank Indonesia Buka Lowongan Kerja, Cek di Sini!",0,48,48,32,2619,2587,,
6954029,,http://news.rakyatku.com/read/7943/2016/06/05/mahasiswi-uit-korban-kebakaran-akan-dimakamkan-di-lutim,http://news.rakyatku.com/read/7943/2016/06/05/mahasiswi-uit-korban-kebakaran-akan-dimakamkan-di-lutim,Mahasiswi UIT Korban Kebakaran Akan Dimakamkan di Lutim,Mahasiswi UIT Korban Kebakaran Akan Dimakamkan di Lutim,0,55,55,0,1012,1012,,
6954049,,http://news.rakyatku.com/read/7923/2016/06/05/reza-ali-deng-ical-harus-jadi-wakil-ni-matullah,http://news.rakyatku.com/read/7923/2016/06/05/reza-ali-deng-ical-harus-jadi-wakil-ni-matullah,Reza Ali: Deng Ical Harus Jadi Wakil Ni’matullah,Reza Ali: Deng Ical Harus Jadi Wakil Ni’matullah,0,48,48,0,2009,2009,,
6954079,,http://news.rakyatku.com/read/7997/2016/06/06/danau-tempe-kembali-dilelang,http://news.rakyatku.com/read/7997/2016/06/06/danau-tempe-kembali-dilelang,Danau Tempe Kembali Dilelang,Danau Tempe Kembali Dilelang,0,28,28,0,2323,2323,,
7504909,,http://tekno.rakyatku.com/read/13180/2016/07/17/ketahui-sebelum-bermain-ini-daftar-istilah-di-pokemon-go,http://tekno.rakyatku.com/read/13180/2016/07/17/ketahui-sebelum-bermain-ini-daftar-istilah-di-pokemon-go,"Ketahui Sebelum Bermain, Ini Daftar Istilah di Pokemon Go","Ketahui Sebelum Bermain, Ini Daftar Istilah di Pokemon Go",0,57,57,14,895,881,,
7400271,,http://tekno.rakyatku.com/read/12252/2016/07/09/cari-pokemon-di-air-gadis-ini-malah-temukan-mayat,http://tekno.rakyatku.com/read/12252/2016/07/09/cari-pokemon-di-air-gadis-ini-malah-temukan-mayat,"Cari Pokemon di Air, Gadis ini Malah Temukan Mayat","Cari Pokemon di Air, Gadis ini Malah Temukan Mayat",0,50,50,0,1349,1349,,
6957836,,http://hiburan.rakyatku.com/read/8060/2016/06/06/begini-tampilan-baru-bumblebee-di-transformers-5,http://hiburan.rakyatku.com/read/8060/2016/06/06/begini-tampilan-baru-bumblebee-di-transformers-5,Begini Tampilan Baru Bumblebee di Transformers 5,Begini Tampilan Baru Bumblebee di Transformers 5,0,48,48,0,757,757,,
7134383,,http://hiburan.rakyatku.com/read/9704/2016/06/19/ini-cara-koma-ajak-anak-muda-berkolaborasi,http://hiburan.rakyatku.com/read/9704/2016/06/19/ini-cara-koma-ajak-anak-muda-berkolaborasi,Ini Cara KOMA Ajak Anak Muda Berkolaborasi,Ini Cara KOMA Ajak Anak Muda Berkolaborasi,0,42,42,0,1278,1278,,
7159973,,http://hiburan.rakyatku.com/read/9933/2016/06/21/mario-g-klau-anak-sopir-sang-juara-the-voice-indonesia-2016,http://hiburan.rakyatku.com/read/9933/2016/06/21/mario-g-klau-anak-sopir-sang-juara-the-voice-indonesia-2016,"Mario G Klau, Anak Sopir Sang Juara The Voice Indonesia 2016","Mario G Klau, Anak Sopir Sang Juara The Voice Indonesia 2016",0,60,60,0,837,837,,
6957933,,http://health.rakyatku.com/read/8064/2016/06/06/4-makanan-dan-minuman-sehat-untuk-berbuka-puasa,http://health.rakyatku.com/read/8064/2016/06/06/4-makanan-dan-minuman-sehat-untuk-berbuka-puasa,4 Makanan dan Minuman Sehat untuk Berbuka Puasa,4 Makanan dan Minuman Sehat untuk Berbuka Puasa,0,47,47,826,1582,858,,
7013022,,http://health.rakyatku.com/read/8307/2016/06/08/bayi-yang-lahir-terlambat-diyakini-lebih-cerdas,http://health.rakyatku.com/read/8307/2016/06/08/bayi-yang-lahir-terlambat-diyakini-lebih-cerdas,Bayi yang Lahir Terlambat Diyakini Lebih Cerdas,Bayi yang Lahir Terlambat Diyakini Lebih Cerdas,0,47,47,161,1054,1215,,
6955378,,http://www.prohaba.co/2016/06/05/ama-sira-tewas-ditembak-kakak-kandung,,Ama Sira Tewas Ditembak Kakak Kandung,Ama Sira Tewas Ditembak Kakak Kandung,0,37,37,58,1537,1479,,
6970026,,http://tempo.co/read/news/2016/06/07/152777528/Ini-Makanan-Kaya-Protein-Sajian-Sahur-Penahan-Lapar,https://m.tempo.co/read/news/2016/06/07/152777528/ini-makanan-kaya-protein-sajian-sahur-penahan-lapar,Ini Makanan Kaya Protein Sajian Sahur Penahan Lapar,Ini Makanan Kaya Protein Sajian Sahur Penahan Lapar,0,51,51,98,2120,2079,,
7009853,,http://mrseru.com/post/read/gara-gara-komisi-perlindungan-korupsi-mendagri-pecat-stafnya,http://mrseru.com/post/read/gara-gara-komisi-perlindungan-korupsi-mendagri-pecat-stafnya,Gara-Gara 'Komisi Perlindungan Korupsi' Mendagri Pecat Stafnya,Gara-Gara 'Komisi Perlindungan Korupsi' Mendagri Pecat Stafnya,0,62,62,24,1475,1451,,
6986555,,http://bacarita.com/asus-zenfone-selfie-puas-ber-selfie-dengan-kamera-13-megapiksel/,http://bacarita.com/asus-zenfone-selfie-puas-ber-selfie-dengan-kamera-13-megapiksel/,"ASUS Zenfone Selfie, PUAS BER-SELFIE DENGAN KAMERA 13 MEGAPIKSEL",Situs Baca Berita Terkini,58,64,25,30,9410,9380,,
6986592,,http://bacarita.com/8-mobil-baru-siap-melaju-di-indonesia-2016/,http://bacarita.com/8-mobil-baru-siap-melaju-di-indonesia-2016/,8 Mobil baru siap melaju di Indonesia 2016,Situs Baca Berita Terkini,34,42,25,292,7760,7468,,
6986737,,http://bacarita.com/skutik-baru-yamaha-mio-z-2016/,http://bacarita.com/skutik-baru-yamaha-mio-z-2016/,Skutik Baru Yamaha Mio Z 2016,Situs Baca Berita Terkini,21,29,25,227,3533,3306,,
7238402,,http://bacarita.com/keramik-cantik-sambut-lebaran/,http://bacarita.com/keramik-cantik-sambut-lebaran/,Keramik Cantik Sambut Lebaran,Situs Baca Berita Terkini,24,29,25,237,938,701,,
7292018,,http://bacarita.com/the-butcher-hidangan-ala-sang-pemotong-daging/,http://bacarita.com/the-butcher-hidangan-ala-sang-pemotong-daging/,"THE BUTCHER, Hidangan ala Sang Pemotong Daging",Situs Baca Berita Terkini,37,46,25,441,3317,2876,,
6986793,,http://bacarita.com/bom-bom-bread-unik-mendunia/,http://bacarita.com/bom-bom-bread-unik-mendunia/,"bom bom bread, unik mendunia",Situs Baca Berita Terkini,22,28,25,117,1150,1033,,
6986860,,http://bacarita.com/7-karakteristik-orang-kreatif/,http://bacarita.com/7-karakteristik-orang-kreatif/,7 Karakteristik Orang Kreatif,Situs Baca Berita Terkini,23,29,25,16,3830,3814,,
8164601,,http://bacarita.com/do-donts-untuk-menghindari-dehidrasi-kulit/,http://bacarita.com/do-donts-untuk-menghindari-dehidrasi-kulit/,Do & Don’ts untuk Menghindari Dehidrasi Kulit,Situs Baca Berita Terkini,34,45,25,47,3343,3296,,
6999610,,http://mediaindonesia.com/news/read/49909/fosil-manusia-purba-flores-belum-diberi-nama/2016-06-09,http://www.mediaindonesia.com/news/read/49909/fosil-manusia-purba-flores-belum-diberi-nama/2016-06-09,Fosil Manusia Purba Flores belum Diberi Nama,Fosil Manusia Purba Flores belum Diberi Nama,0,44,44,0,2547,2547,,
7150262,,http://gilabola.com/berita-bola/liga-internasional/euro/berita-piala-eropa-euro-2016-rumania-albania-denis-alibec-20062016/,http://gilabola.com/berita-bola/liga-internasional/euro/berita-piala-eropa-euro-2016-rumania-albania-denis-alibec-20062016/,Hasil Euro 2016 : Lihat Bagaimana Denis Alibec Pelintir Kakinya!,Hasil Euro 2016 : Lihat Bagaimana Denis Alibec Pelintir Kakinya!,0,64,64,0,1020,1020,,
7131266,,http://www.tribunnews.com/ramadan/2016/06/18/setya-novanto-buka-puasa-bersama-ribuan-anak-yatim-piatu,http://www.tribunnews.com/ramadan/2016/06/18/setya-novanto-buka-puasa-bersama-ribuan-anak-yatim-piatu,Setya Novanto Buka Puasa Bersama Ribuan Anak Yatim Piatu,Setya Novanto Buka Puasa Bersama Ribuan Anak Yatim Piatu,0,56,56,0,1480,1480,,
7133750,,http://soccer.sindonews.com/pialaeropa/read/1117840/201/susunan-pemain-islandia-vs-hungaria-1466263291,http://soccer.sindonews.com/pialaeropa/read/1117840/201/susunan-pemain-islandia-vs-hungaria-1466263291,Susunan Pemain Islandia vs Hungaria,Susunan Pemain Islandia vs Hungaria,0,35,35,217,1219,1435,,
7148804,,http://bola.okezone.com/read/2016/06/20/3/1419641/portugal-mulai-khawatir-gagal-lolos-ke-16-besar-piala-eropa-2016,http://bola.okezone.com/read/2016/06/20/3/1419641/portugal-mulai-khawatir-gagal-lolos-ke-16-besar-piala-eropa-2016,Portugal Mulai Khawatir Gagal Lolos ke 16 Besar Piala Eropa 2016,Portugal Mulai Khawatir Gagal Lolos ke 16 Besar Piala Eropa 2016 : Okezone EURO 2016,20,64,84,6,1421,1415,,
7173567,,http://historia.id/modern/gerilyawan-korea-di-pihak-indonesia,http://historia.id/modern/gerilyawan-korea-di-pihak-indonesia,Gerilyawan Korea di Pihak Indonesia,Gerilyawan Korea Di Pihak Indonesia,1,35,35,30,3111,3081,,
7131807,,http://microsite.suara.com/ramadan1437h/2016/06/18/173731/pendaftaran-mudik-gratis,http://microsite.suara.com/ramadan1437h/2016/06/18/173731/pendaftaran-mudik-gratis,Pendaftaran Mudik Gratis,Pendaftaran Mudik Gratis,0,24,24,0,386,386,,
7137677,,http://www.solopos.com/2016/06/19/tahukah-anda-alasan-sinetron-disebut-opera-sabun-730154,http://www.solopos.com/2016/06/19/tahukah-anda-alasan-sinetron-disebut-opera-sabun-730154,TAHUKAH ANDA? : Alasan Sinetron Disebut “Opera Sabun”,TAHUKAH ANDA? : Alasan Sinetron Disebut “Opera Sabun”,0,53,53,47,1359,1312,,
7130365,,http://www.solopos.com/2016/06/18/teknologi-terbaru-qualcomm-pasti-rilis-snapdragon-823-729833,http://www.solopos.com/2016/06/18/teknologi-terbaru-qualcomm-pasti-rilis-snapdragon-823-729833,TEKNOLOGI TERBARU : Qualcomm Pasti Rilis Snapdragon 823,TEKNOLOGI TERBARU : Qualcomm Pasti Rilis Snapdragon 823,0,55,55,37,2138,2101,,
7131268,,http://www.solopos.com/2016/06/18/motogp-2016-suzuki-mulai-jajal-pembalap-moto2-pengganti-vinales-730169,http://www.solopos.com/2016/06/18/motogp-2016-suzuki-mulai-jajal-pembalap-moto2-pengganti-vinales-730169,MOTOGP 2016 : Suzuki Mulai Jajal Pembalap Moto2 Pengganti Vinales,MOTOGP 2016 : Suzuki Mulai Jajal Pembalap Moto2 Pengganti Vinales,0,65,65,42,1793,1751,,
7130661,,http://www.solopos.com/2016/06/18/copa-america-centenario-prediksi-argentina-vs-venezuela-730152,http://www.solopos.com/2016/06/18/copa-america-centenario-prediksi-argentina-vs-venezuela-730152,COPA AMERICA CENTENARIO : Prediksi Argentina Vs Venezuela,COPA AMERICA CENTENARIO : Prediksi Argentina Vs Venezuela,0,57,57,265,2670,2405,,
7130869,,http://www.solopos.com/2016/06/18/uttaran-antv-rathore-dituduh-membunuh-nirbhay-730135,http://www.solopos.com/2016/06/18/uttaran-antv-rathore-dituduh-membunuh-nirbhay-730135,UTTARAN ANTV : Rathore Dituduh Membunuh Nirbhay,UTTARAN ANTV : Rathore Dituduh Membunuh Nirbhay,0,47,47,27,1852,1825,,
7147921,,https://jalantikus.com/gokil/ini-dia-10-tempat-paling-angker-di-indonesia-berani-masuk/?utm_source=babe&utm_medium=article&utm_campaign=artikel-from-babe,https://jalantikus.com/gokil/ini-dia-10-tempat-paling-angker-di-indonesia-berani-masuk/,"Ini dia 10 Tempat Paling Angker Di Indonesia, Berani Masuk?","Ini dia 10 Tempat Paling Angker Di Indonesia, Berani Masuk?",0,59,59,343,8721,8378,,
7131269,,http://rri.co.id/post/berita/285027/nasional/berikut_para_juara_di_ptq_nasional_2016.html,http://rri.co.id/post/berita/285027/nasional/berikut_para_juara_di_ptq_nasional_2016.html,Berikut Para Juara di PTQ Nasional 2016,Nasional,31,39,8,0,2492,2492,,
7132175,,http://rri.co.id/post/berita/285024/ekonomi/pasar_kuliner_perikanan_di_jawa_timur_terus_membaik.html,http://rri.co.id/post/berita/285024/ekonomi/pasar_kuliner_perikanan_di_jawa_timur_terus_membaik.html,Pasar Kuliner Perikanan di Jawa Timur Terus Membaik,Ekonomi,47,51,7,0,1119,1119,,
7148670,,http://rri.co.id/post/berita/285274/daerah/kodim_0605_subang_bertekad_sabet_juara_binter_di_tingkat_nasional.html,http://rri.co.id/post/berita/285274/daerah/kodim_0605_subang_bertekad_sabet_juara_binter_di_tingkat_nasional.html,Kodim 0605 Subang Bertekad Sabet Juara Binter di Tingkat Nasional,Daerah,61,65,6,270,1408,1138,,
7132178,,http://rri.co.id/post/berita/285055/luar_negeri/12_tersangka_teroris_ditahan_di_operasi_anti_teror_belgia.html,http://rri.co.id/post/berita/285055/luar_negeri/12_tersangka_teroris_ditahan_di_operasi_anti_teror_belgia.html,12 Tersangka Teroris Ditahan di Operasi Anti Teror Belgia,Luar Negeri,50,57,11,0,962,962,,
7132309,,http://rri.co.id/post/berita/285053/olahraga/144_pelajar_di_ntt_ikut_lomba_sirkuit_atletik_di_kota_kupang.html,http://rri.co.id/post/berita/285053/olahraga/144_pelajar_di_ntt_ikut_lomba_sirkuit_atletik_di_kota_kupang.html,144 Pelajar di NTT Ikut Lomba Sirkuit Atletik di Kota Kupang,Olahraga,55,60,8,286,2992,2706,,
7148672,,http://rri.co.id/post/berita/285273/arus_mudik_balik/kendaraan_layak_dan_pengemudi_bebas_narkoba_faktor_utama_keselamatan_arus_mudik_1437_h.html,http://rri.co.id/post/berita/285273/arus_mudik_balik/kendaraan_layak_dan_pengemudi_bebas_narkoba_faktor_utama_keselamatan_arus_mudik_1437_h.html,Kendaraan Layak dan Pengemudi Bebas Narkoba Faktor Utama Keselamatan Arus Mudik 1437 H,Arus Mudik Balik,75,86,16,0,1721,1721,,
7131602,,http://rri.co.id/post/berita/285046/serba_serbi_ramadhan/yayasan_galang_kemajuan_akan_gelar_kampung_ramadhan_di_bantaran_kali_ciliwung.html,http://rri.co.id/post/berita/285046/serba_serbi_ramadhan/yayasan_galang_kemajuan_akan_gelar_kampung_ramadhan_di_bantaran_kali_ciliwung.html,Yayasan Galang Kemajuan akan gelar Kampung Ramadhan di bantaran Kali Ciliwung,Serba Serbi Ramadhan,63,77,20,0,1807,1807,,
7150713,,http://rri.co.id/post/berita/285326/sudut_istana/jokowi_instruksikan_menteri_terkait_koordinasi_dengan_pemda_atasi_bencana.html,http://rri.co.id/post/berita/285326/sudut_istana/jokowi_instruksikan_menteri_terkait_koordinasi_dengan_pemda_atasi_bencana.html,Jokowi Instruksikan Menteri Terkait Koordinasi dengan Pemda Atasi Bencana,Sudut Istana,65,73,12,0,1022,1022,,
7147381,,http://rri.co.id/post/berita/285251/feature/pesantren_modern_alfalah_abu_lam_u_aceh_besar_pencetak_santri_berpestasi.html,http://rri.co.id/post/berita/285251/feature/pesantren_modern_alfalah_abu_lam_u_aceh_besar_pencetak_santri_berpestasi.html,"Pesantren Modern Al-Falah Abu Lam U Aceh Besar, Pencetak Santri Berpestasi",Feature,68,74,7,19,5997,5978,,
7131459,,http://rri.co.id/post/berita/285041/teknologi/astronot_amerika_inggris_rusia_mendarat_dari_stasiun_luar_angkasa.html,http://rri.co.id/post/berita/285041/teknologi/astronot_amerika_inggris_rusia_mendarat_dari_stasiun_luar_angkasa.html,"Astronot Amerika, Inggris, Rusia Mendarat dari Stasiun Luar Angkasa",Teknologi,63,67,9,0,1135,1135,,
7166768,,http://rri.co.id/post/berita/285661/kesehatan/kabupaten_bantul_deklarasi_kawasan_bebas_rokok.html,http://rri.co.id/post/berita/285661/kesehatan/kabupaten_bantul_deklarasi_kawasan_bebas_rokok.html,Kabupaten Bantul Deklarasi Kawasan Bebas Rokok,Kesehatan,40,46,9,0,1735,1735,,
7143115,,http://rri.co.id/post/berita/285215/hiburan/tembakkan_peluru_ferry_irawan_diperiksa_polisi.html,http://rri.co.id/post/berita/285215/hiburan/tembakkan_peluru_ferry_irawan_diperiksa_polisi.html,"Tembakkan Peluru, Ferry Irawan Diperiksa Polisi",Hiburan,42,47,7,0,1442,1442,,
7138956,,http://rri.co.id/post/berita/285129/budaya/kesenian_gojeg_bocah_kabupaten_magelang_meriahkan_pkb_ke38.html,http://rri.co.id/post/berita/285129/budaya/kesenian_gojeg_bocah_kabupaten_magelang_meriahkan_pkb_ke38.html,Kesenian Gojeg Bocah Kabupaten Magelang Meriahkan PKB ke-38,Budaya,55,59,6,0,1961,1961,,
7152175,,http://rri.co.id/post/berita/285378/sorotan_kampus/tak_sekedar_belajar_akubank_tawarkan_simulasi_perbankan.html,http://rri.co.id/post/berita/285378/sorotan_kampus/tak_sekedar_belajar_akubank_tawarkan_simulasi_perbankan.html,"Tak Sekedar Belajar, AKUBANK Tawarkan Simulasi Perbankan",Sorotan Kampus,48,56,14,0,1969,1969,,
7184756,,http://mediaindonesia.com/news/read/52442/polda-metro-tingkatkan-pengamanan-toko-emas-jelang-lebaran/2016-06-22,http://www.mediaindonesia.com/news/read/52442/polda-metro-tingkatkan-pengamanan-toko-emas-jelang-lebaran/2016-06-22,Polda Metro Tingkatkan Pengamanan Toko Emas Jelang Lebaran,Polda Metro Tingkatkan Pengamanan Toko Emas Jelang Lebaran,0,58,58,0,1256,1256,,
7184334,,http://mediaindonesia.com/news/read/52437/jalan-alternatif-lumbir-ajibarang-terancam-longsor/2016-06-22,http://www.mediaindonesia.com/news/read/52437/jalan-alternatif-lumbir-ajibarang-terancam-longsor/2016-06-22,Jalan Alternatif Lumbir-Ajibarang Terancam Longsor,Jalan Alternatif Lumbir-Ajibarang Terancam Longsor,0,50,50,0,1504,1504,,
7130431,,http://mediaindonesia.com/news/read/51703/pembunuh-anggota-parlemen-inggris-didakwa/2016-06-18,http://www.mediaindonesia.com/news/read/51703/pembunuh-anggota-parlemen-inggris-didakwa/2016-06-18,Pembunuh Anggota Parlemen Inggris Didakwa,Pembunuh Anggota Parlemen Inggris Didakwa,0,41,41,0,1184,1184,,
7148677,,http://mediaindonesia.com/news/read/51969/lebron-james-mvp-final-nba-2016/2016-06-20,http://www.mediaindonesia.com/news/read/51969/lebron-james-mvp-final-nba-2016/2016-06-20,LeBron James MVP Final NBA 2016,LeBron James MVP Final NBA 2016,0,31,31,16,664,648,,
7263065,,http://mediaindonesia.com/news/read/53297/mantan-ketua-pn-surabaya-dituduh-melanggar-ham/2016-06-28,http://www.mediaindonesia.com/news/read/53297/mantan-ketua-pn-surabaya-dituduh-melanggar-ham/2016-06-28,Mantan Ketua PN Surabaya Dituduh Melanggar HAM,Mantan Ketua PN Surabaya Dituduh Melanggar HAM,0,46,46,23,2553,2530,,
7136431,,http://mediaindonesia.com/news/read/51786/bising-dan-hipertensi/2016-06-19,http://www.mediaindonesia.com/news/read/51786/bising-dan-hipertensi/2016-06-19,Bising dan Hipertensi,Bising dan Hipertensi,0,21,21,12,880,868,,
7182372,,http://thewedding.id/kecantikan/18623-18623,http://thewedding.id/health-and-beauty/kecantikan/percantik-rambut-anda-dengan-bunga-di-hari-istimewa-18623,Percantik Rambut Anda dengan Bunga di Hari Istimewa,Percantik Rambut Anda dengan Bunga di Hari Istimewa,0,51,51,25,1103,1078,,
7164593,,http://thewedding.id/fashion/midsummer-night-dream-17607,http://thewedding.id/bridal-gallery/fashion/midsummer-night-dream-17607,A Midsummer Night Dream,A Midsummer Night Dream,0,23,23,39,1470,1431,,
7232961,,http://thewedding.id/food-beverages/something-blossom-17818,http://thewedding.id/wedding-needs/something-blossom-17818,Something Blossom,Something Blossom,0,17,17,0,1121,1121,,
7150213,,http://thewedding.id/bulan-madu/10-destinasi-honeymoon-favorit-dari-hawaii-sampai-niagara-falls-18927,http://thewedding.id/bulan-madu/10-destinasi-honeymoon-favorit-dari-hawaii-sampai-niagara-falls-18927,10 Destinasi Honeymoon Favorit dari Hawaii Sampai Niagara Falls,10 Destinasi Honeymoon Favorit dari Hawaii Sampai Niagara Falls,0,63,63,226,5021,4795,,
7156004,,http://thewedding.id/health-and-beauty/agar-tubuh-terhindar-dari-dehidrasi-saat-puasa-18604,http://thewedding.id/health-and-beauty/agar-tubuh-terhindar-dari-dehidrasi-saat-puasa-18604,Agar Tubuh Terhindar Dari Dehidrasi Saat Puasa,Agar Tubuh Terhindar Dari Dehidrasi Saat Puasa,0,46,46,208,4005,3802,,
7149317,,http://jakartagreater.com/mahasiswi-china-protes-sikap-pemerintah-memasang-cctv-di-asrama/,http://jakartagreater.com/mahasiswi-china-protes-sikap-pemerintah-memasang-cctv-di-asrama/,Mahasiswi China protes Kebijakan Pemerintah memasang CCTV di Asrama,Mahasiswi China protes Kebijakan Pemerintah memasang CCTV di Asrama – JakartaGreater,17,67,84,197,2648,2451,,
7180928,,http://www.monexnews.com/market-movers/market-movers-hasil-polling-brexit-jaga-tingginya-volatilitas-pasar.htm,http://www.monexnews.com,Market Movers: Hasil Polling Brexit Jaga Tingginya Volatilitas Pasar,Market Movers: Hasil Polling Brexit Jaga Tingginya Volatilitas Pasar | Market Movers News,21,68,89,1119,357,1372,,
7148679,,http://mediaindonesia.com/news/read/51975/rupiah-menguat-82-poin/2016-06-20,http://www.mediaindonesia.com/news/read/51975/rupiah-menguat-82-poin/2016-06-20,Rupiah Menguat 82 Poin,Rupiah Menguat 82 Poin,0,22,22,0,1583,1583,,
7177858,,http://mediaindonesia.com/editorial/read/775/bukan-bangsa-pasrah-bencana/2016-06-22,http://www.mediaindonesia.com/editorial/read/775/bukan-bangsa-pasrah-bencana/2016-06-22,Bukan Bangsa Pasrah Bencana,Bukan Bangsa Pasrah Bencana,0,27,27,0,2931,2931,,
